Nome,Preço,Preço Antigo,PpU,PpU Antigo
DIA Cacau Solúvel 500 g,"2,49 €",,"4,98 €/Kg",
DIA GALLETECA Bolachas Maria 800 g,"2,04 €",,"2,55 €/Kg",
OREO Bolachas Cobertas com Chocolate Branco 246 g,"2,99 €",,"12,15 €/Kg",
ROYAL Caramelo Líquido 400 g,"2,69 €",,"6,73 €/Kg",
DELTA Café Torrado Lote Chavena Grão 250 g,"3,29 €",,"13,16 €/Kg",
PENSAL Bebida de Cereais 200 g,"2,59 €",,"12,95 €/Kg",
BOCA DOCE Pudim de Chocolate 22 g,"0,59 €",,"26,82 €/Kg",
BRASA Bebida de Cererais Cevada Chicória e Centeio 200 g,"2,79 €",,"13,95 €/Kg",
DELTA Mistura Peninsular 250 g,"1,64 €",,"6,56 €/Kg",
AFTER EIGHT Chocolate Nestlé 200 g,"2,34 €",,"11,70 €/Kg",
DELTA Café Torrado Moagem Máquina 250 g,"3,29 €",,"13,16 €/Kg",
BOCA DOCE Pudim Baunilha 22 g,"0,59 €",,"26,82 €/Kg",
DIA GALLETECA Jaffa Cake Laranja 300 g,"1,53 €",,"5,10 €/Kg",
DIA Rebuçados Mel 300 g,"1,19 €",,"3,97 €/Kg",
DIA Rebuçados Limão 300 g,"1,19 €",,"3,97 €/Kg",
"CHICLETS Pastilhas Elásticas Fire Canela 16,5 g","0,99 €",,"0,99 €/ud",
SICAL Café Torrado 5 estrelas Lote Clássico em Grão 250 g,"2,74 €","3,59 €","10,96 €/Kg","14,36 €/Kg"
SICAL Café Torrado 5 estrelas Lote Clássico Moagem Grossa 250 g,"2,74 €","3,59 €","10,96 €/Kg","14,36 €/Kg"
GULLÓN Zero Sem Açúcares Wafer Baunilha 180 g,"2,19 €",,"12,17 €/Kg",
CHOCO KRISPIES Cereais de Chocolate Kellogg´s 375 g,"3,89 €",,"10,37 €/Kg",
FITNESS Cereais de Trigo Integral Nestlé 375 g,"3,59 €",,"9,57 €/Kg",
SPECIAL K Cereais Clássico 750 g,"3,74 €",,"4,99 €/Kg",
SMINT Rebuçados Menta 8 g,"1,39 €",,"173,75 €/Kg",
SIDUL Açúcar Em Pó 500 g,"1,67 €",,"3,34 €/Kg",
KELLOGG'S Corn Flakes 500 g,"3,99 €",,"7,98 €/Kg",
DIA SONHOS Cocktail de Frutas 840 g,"2,20 €",,"2,62 €/Kg",
DIA GRANJOY Corn Flakes Sem Adição de Açúcares 375 g,"1,84 €",,"4,91 €/Kg",
DIA CAFETARIA Café Torrado Moagem Máquina Expresso 250 g,"2,05 €",,"8,20 €/Kg",
DIA CAFETARIA Café Torrado Grão 250 g,"1,75 €",,"7,00 €/Kg",
DIA CAFETARIA Café Descafeinado 250 g,"1,74 €",,"6,96 €/Kg",
"TRIDENT Pastilhas Elásticas Fruit Morango 14,5 g","0,89 €",,"61,38 €/Kg",
CASA DE MATEUS Doce de Morango 345 g,"2,99 €",,"8,67 €/Kg",
SNICKERS Chocolate 50 g,"1,05 €",,"21,00 €/Kg",
DIA Doce de Framboesa Extra 390 g,"1,85 €",,"4,74 €/Kg",
CHIPS AHOY! Bolachas Mini 160 g,"1,99 €",,"12,44 €/Kg",
QUAKER Cereais Cruesli Amêndoas E Avelãs 375 g,"4,09 €",,"10,91 €/Kg",
MENTOS Caramelos de Menta 38 g,"0,74 €",,"19,47 €/Kg",
SMINT Caramelos Frutos Silvestres 8 g,"1,39 €",,"173,75 €/Kg",
MARS Mini Snacks Chocolate e Caramelo 170 g,"2,14 €","2,89 €","12,59 €/Kg","17,00 €/Kg"
DIA Bolacha Crackers 3x100 g,"1,75 €",,"5,83 €/Kg",
DIA GALLETECA Bolachas Tarteletes De Morango 150 g,"1,15 €",,"7,67 €/Kg",
DIA Barrita de Nougat Chocolate E Caramelo 5x40 g,"1,79 €",,"8,95 €/Kg",
TUC Bolachas Crackers Bacon 100 g,"1,19 €",,"11,90 €/Kg",
OREO Bolacha Mini 4x40 g,"1,99 €",,"12,44 €/Kg",
KINDER BUENO Chocolate 43 g,"1,09 €",,"25,35 €/Kg",
KINDER SURPRESA Ovo de Chocolate 20 g,"1,39 €",,"69,50 €/Kg",
DIA GRANJOY Cereais Fruta&Fibre 500 g,"2,39 €",,"4,78 €/Kg",
CEM PORCENTO Chá Emagrecimento 13 g,"0,99 €",,"76,15 €/Kg",
CEM PORCENTO Chá Prisão Ventre 13 g,"0,99 €",,"76,15 €/Kg",
SPECIAL K Cereais de Frutos Vermelhos 300 g,"2,59 €",,"8,63 €/Kg",
BUTTER COOKIES Bolachas de Manteiga 500 g,"4,37 €",,"8,74 €/Kg",
WERTHER'S Caramelos Clássicos 135 g,"2,99 €",,"22,15 €/Kg",
SALUTEM Flocos de Cevada Integrais Tostados 250 g,"1,52 €","1,79 €","6,08 €/Kg","7,16 €/Kg"
SALUTEM Muesli Integral com Frutos Tropicais 375 g,"2,28 €","2,69 €","6,08 €/Kg","7,17 €/Kg"
CUÉTARA Bolachas Choco Flakes 425 g,"3,39 €",,"7,98 €/Kg",
"TRIDENT Pastilhas Elásticas Frutos Silvestres 14,5 g","0,89 €",,"61,38 €/Kg",
TULICREME Sabor a Chocolate 200 g,"1,49 €",,"7,45 €/Kg",
CHOCO KRISPIES Barras de Cereais Kellogg's 6x20 g,"2,79 €",,"23,25 €/Kg",
MILKA Chocolate de Leite 270 g,"3,19 €","3,99 €","11,81 €/Kg","14,78 €/Kg"
ROYAL Pudim Caseiro Laranja 200 g,"1,99 €",,"9,95 €/Kg",
DIA Chá Preto 20 Un,"0,80 €",,"0,80 €/ud",
DIA HORA + DOCE Pudim Flan 80 g,"0,55 €",,"6,88 €/Kg",
LIPTON Chá Digestão Fácil 20 un,"2,99 €",,"0,15 €/ud",
KELLOG'S Barras Cereais Chocolate 129 g,"2,24 €",,"17,36 €/Kg",
"SPECIAL K Barras de Cereais com Frutos Vermelhos 6x21,5 g","2,24 €",,"17,36 €/Kg",
SUGUS Morango 45 g,"1,09 €",,"24,22 €/Kg",
LIPTON Chá Verde Pure 20 Un,"2,15 €",,"0,11 €/ud",
TWIX Snack Chocolate 50 g,"1,05 €",,"21,00 €/Kg",
CADBURY Chocolate Dairy Milk 45 g,"0,99 €",,"22,00 €/Kg",
DIA TEMPTATION Creme de Barrar com Avelã 750 g,"3,84 €",,"5,12 €/Kg",
NESCAFÉ Cappuccino Café Solúvel 125 g,"3,19 €",,"25,52 €/Kg",
DIA HORA + DOCE Pudim Caramelo 90 g,"0,46 €",,"5,11 €/Kg",
SNICKERS Chocolate 170 g,"2,14 €","2,89 €","12,59 €/Kg","17,00 €/Kg"
TOFINA Bebida de Cereais Cevada Chicória e Café 200 g,"3,49 €",,"17,45 €/Kg",
NESCAFÉ GOLD Café Solúvel 100 g,"5,69 €",,"56,90 €/Kg",
BICENTURY Tortitas de Arroz com Choco Negro 130 g,"2,39 €",,"18,38 €/Kg",
GOLDEN GRAHAMS Barras de Cereais de Trigo Integral com Leite Nestlé 150 g,"3,29 €",,"21,93 €/Kg",
"MALTESERS Drageias de Chocolate 148,5","3,69 €",,"24,85 €/Kg",
GULLÓN Zero Sem Açúcares Fibra 170 g,"2,84 €",,"16,71 €/Kg",
COOKIE CRISP Cereais com Pepitas de Chocolate Nestlé 375 g,"2,52 €",,"6,72 €/Kg",
LIPTON Chá Marocco 20 un,"2,99 €",,"0,15 €/ud",
CHOCAPIC Cereais de Chocolate Nestlé 625 g,"4,69 €",,"7,50 €/Kg",
DIA GALLETECA Bolachas Digestivas 2x400 g,"2,04 €",,"2,55 €/Kg",
BOLERO Bebida de Cereais e Fibra 200 g,"2,99 €",,"14,95 €/Kg",
CASA DE MATEUS Doce de Tomate 345 g,"2,99 €",,"8,67 €/Kg",
NESQUIK Barras de Cereais de Chocolate com Leite Nestlé 150 g,"3,29 €",,"21,93 €/Kg",
MENTOS Pastilhas Elásticas Gum Pocket Frutos Silvestres 30 g,"1,60 €",,"53,33 €/Kg",
GULLÓN Bolachas Digestivas de Aveia e Chocolate 425 g,"2,94 €",,"6,92 €/Kg",
MILKA Chocolate Toffee 300 g,"3,19 €","3,99 €","10,63 €/Kg","13,30 €/Kg"
GULLÓN Bolachas Digestivas Muesli 365 g,"2,94 €",,"8,05 €/Kg",
DELTA Café Torrado Grão 1 kg,"12,99 €",,"12,99 €/Kg",
DIA Infusão Maçã Canela 20 Un,"1,29 €",,"0,06 €/ud",
DIA Doce de Tomate Extra  390 g,"1,39 €",,"3,56 €/Kg",
DIA Rebuçados Peitorais 200 g,"1,29 €",,"6,45 €/Kg",
DIA Canudinhos Recheados de Creme de Avelã 300 g,"2,98 €","3,09 €","9,93 €/Kg","10,30 €/Kg"
NESCAFÉ DOLCE GUSTO Espresso Decaffeinato (Intensidade 5) 16 Un,"5,99 €",,"0,37 €/ud",
DIA GRANJOY Cereais com Mel 500 g,"2,86 €",,"5,72 €/Kg",
"TRIDENT Pastilhas Elásticas Fresh Peppermint 14,5 g","0,89 €",,"61,38 €/Kg",
DIA DOCE NO LAR Palitos Glacê 200 g,"1,55 €",,"7,75 €/Kg",
NUTELLA Creme de Cacau com Avelãs 200 g,"2,39 €",,"11,95 €/Kg",
BELVITA Bolachas Matinais Leite E Cereais 300 g,"2,49 €",,"8,30 €/Kg",
CUÉTARA Bolachas Bocaditos Limão 150 g,"1,89 €",,"12,60 €/Kg",
TRIUNFO GO Bolachas Digestivas de Maçã 171 g,"1,69 €",,"9,88 €/Kg",
KRAVE Cereais de Avelã 410 g,"4,49 €",,"10,95 €/Kg",
SUGUS Stick Multisabor 45 g,"1,05 €",,"23,33 €/Kg",
"CHICLETS Pastilhas Elásticas Morango 16,5 g","0,99 €",,"0,99 €/ud",
M&M'S Amendoim 45 g,"1,05 €",,"23,33 €/Kg",
GRANJA SAN FRANSCISCO Mel 1 kg,"9,99 €",,"9,99 €/Kg",
CUÉTARA Bolachas Flakes Nocilla 175 g,"2,89 €",,"16,51 €/Kg",
NESCAFÉ DOLCE GUSTO Achocolatado Nesquik 16 Un,"5,99 €",,"0,37 €/ud",
GRANJA SAN FRANSCISCO Mel Com Doseador 500 g,"5,99 €",,"11,98 €/Kg",
NESCAFÉ DOLCE GUSTO Café Au Lait 16 Un,"5,99 €",,"0,37 €/ud",
GULLÓN Zero Sem Açúcares Maria 400 g,"2,84 €",,"7,10 €/Kg",
OREO Bolacha Duplo 185 g,"1,69 €",,"9,14 €/Kg",
DIA GRANJOY Cereais Bolachas Pepitas de Chocolate  375 g,"1,95 €",,"5,20 €/Kg",
NESCAFÉ DOLCE GUSTO Café Expresso Sical (Intensidade 7) 16 Un,"5,99 €",,"0,37 €/ud",
TUC Bolachas Crackers 250 g,"2,49 €",,"9,96 €/Kg",
CHIPS AHOY! Bolachas Com Pepitas de Chocolate XL 184 g,"2,59 €",,"14,08 €/Kg",
ARTIACH Bolacha Chiquilin Chiquichocs  140 g,"2,09 €",,"14,93 €/Kg",
LIPTON Chá Infusão de Cidreira e Mel Pyramid  20 Un,"2,99 €",,"0,15 €/ud",
FERBAR Marmelada 400 g,"1,99 €",,"4,98 €/Kg",
DIA Cápsulas de Café Descafeinado Intensidade 8 10 Un,"1,73 €","1,99 €","0,17 €/ud","0,20 €/ud"
LION Cereais de Chocolate e Caramelo Nestlé 400 g,"2,52 €",,"6,30 €/Kg",
MALTESERS Chocolate 37 g,"1,05 €",,"28,38 €/Kg",
CUÉTARA Bolacha Tosta Rica Chocoguay 168 g,"2,09 €",,"12,44 €/Kg",
NICOLA Cápsulas De Café Bocage (Intensidade 7) 12 un,"3,14 €",,"0,26 €/ud",
NICOLA Cápsulas De Café Selecto (Intensidade 6) 12 un,"3,14 €",,"0,26 €/ud",
DELTA Q Cápsulas de Café Qharacter 10 Un,"3,99 €",,"0,40 €/ud",
DELTA Q Cápsulas de Café deQafeinatus 10 Un,"3,99 €",,"0,40 €/ud",
NESCAFÉ DOLCE GUSTO Café Expresso Buondi (Intensidade 8) 30 Un,"10,49 €",,"0,35 €/ud",
MENTOS Pastilhas Gum Pochet Menta Fresca 30 g,"1,60 €",,"53,33 €/Kg",
"CHICLETS Pastilhas Elásticas Spearmint 16,5 g","0,99 €",,"0,99 €/ud",
DELTA Cevada Especial  250 g,"0,89 €",,"3,56 €/Kg",
LIPTON Chá Tília Pyramid 20 Un,"1,85 €",,"0,09 €/ud",
TETLEY Chá Preto 10 Un,"0,69 €","0,94 €","0,07 €/ud","0,09 €/ud"
TETLEY Infusão de Cidreira 10 un,"0,84 €","1,14 €","0,08 €/ud","0,11 €/ud"
"KITKAT Snack de Chocolate de Leite Nestlé 41,5 g","0,99 €",,"23,86 €/Kg",
MARS Snack de Chocolate E Caramelo 51 g,"1,05 €",,"20,59 €/Kg",
GRAN PAVESI Bolachas Crackers Sem Sal 560 g,"3,99 €",,"7,13 €/Kg",
BOCA DOCE Pudim Morango 22 g,"0,59 €",,"26,82 €/Kg",
CRUNCH Chocolate Nestlé 40 g,"0,99 €",,"24,75 €/Kg",
CUÉTARA Bolacha Tosta Rica Oceanix de Chocolate com Pepitas de Chocolate 160 g,"2,09 €",,"13,06 €/Kg",
TRIDENT Pastilhas Elásticas 60 Minutos Peppermint 20 g,"0,95 €",,"47,50 €/Kg",
TRIDENT Pastilhas Elásticas Spearmint 60M 20 g,"0,95 €",,"47,50 €/Kg",
CUÉTARA Bolachas Ricanela 500 g,"1,99 €","2,69 €","3,98 €/Kg","5,38 €/Kg"
DIA VITAL Mini Tortitas de Milho E Arroz Sabor a Queijo 75 g,"1,29 €",,"17,20 €/Kg",
"DIA VITAL Tortitas de Milho com Chocolate 90,4 g","1,53 €",,"16,92 €/Kg",
BOCA DOCE Pudim Caramelo  22 g,"0,59 €",,"26,82 €/Kg",
HARIBO Bolsa de Gomas Favoritos 90 g,"1,09 €",,"12,11 €/Kg",
NESCAFÉ DOLCE GUSTO Café Ristretto Barista (Intensidade 9) 16 Un,"5,99 €",,"0,37 €/ud",
LION Snack de Chocolate de Leite 3x42 g,"2,19 €",,"17,38 €/Kg",
QUINTA DE JUGAIS Doce de Abóbora com Noz 280 g,"2,74 €",,"9,79 €/Kg",
DIA GALLETECA Bolacha de Cacau 750 g,"2,69 €",,"3,59 €/Kg",
MILKA Chocolate Choco Jelly 250 g,"3,19 €","3,99 €","12,76 €/Kg","15,96 €/Kg"
CEM PORCENTO Bolachas Marinheiras Sem Sal 200 g,"2,89 €",,"14,45 €/Kg",
MILKA Snack Chocolate Zack Oreo 37 g,"0,99 €",,"26,76 €/Kg",
DIA Infusão Tília 25 Un,"0,85 €",,"0,85 €/ud",
DIA Chá Verde 25 Un,"1,05 €",,"1,05 €/ud",
TWIX Mini Snacks Chocolate de Caramelo e Bolacha 170 g,"2,14 €","2,89 €","12,59 €/Kg","17,00 €/Kg"
MILKA Chocolate Bubbly Caramelo 250 g,"3,19 €","3,99 €","12,76 €/Kg","15,96 €/Kg"
TRIUNFO Bolachas de Aveia 190 g,"1,49 €",,"7,84 €/Kg",
MALTESERS Drageias de Chocolate 85 g,"2,19 €",,"25,76 €/Kg",
CONDI Gelatina Light Mirtilo  2x15 g,"1,89 €",,"63,00 €/Kg",
CONDI Gelatina Light Frutos Vermelhos  2x15 g,"1,89 €",,"63,00 €/Kg",
NACIONAL PowerZ 300 g,"2,65 €",,"8,83 €/Kg",
CHUPA CHUPS Chupa Mini Bolsa 120 g,"2,30 €",,"19,17 €/Kg",
KINDER BUENO Snack Chocolate Mini 108 g,"2,49 €",,"23,06 €/Kg",
SPECIAL K Cereais de Chocolate 375 g,"2,59 €",,"6,91 €/Kg",
CARRS Bolachas Table Water 125 g,"2,29 €",,"18,32 €/Kg",
BELVITA Bolacha Frutos Silvestres 300 g,"2,49 €",,"8,30 €/Kg",
HALLS Rebuçados Morango Sem Açúcar 32 g,"0,89 €",,"27,81 €/Kg",
REGINA Sombrinhas de Chocolate 15 g,"0,69 €",,"46,00 €/Kg",
PINTAROLAS Tubo Drageias Chocolate 22 g,"0,64 €",,"29,09 €/Kg",
NESTLÉ Chocolate Culinária 44% Cacau 200 g,"1,89 €",,"9,45 €/Kg",
DIA Cápsulas de Café Descafeinado Intensidade 3 16 Un,"3,79 €",,"0,24 €/ud",
MILKA Chocolate com Oreo 300 g,"3,19 €",,"10,63 €/Kg",
"TRIDENT Pastilhas Elásticas Melão Melancia 14,5 g","0,89 €",,"61,38 €/Kg",
DELTA Cevada Solúvel Seara 200 g,"1,74 €",,"8,70 €/Kg",
DELTA Mistura Solúvel Cereais + Café 200 g,"2,84 €",,"14,20 €/Kg",
GULLÓN Bolacha Recheada De Avelã Vitalday  220 g,"2,59 €",,"11,77 €/Kg",
NICOLA Cápsulas de Café Rossio N 12 un,"3,14 €",,"0,26 €/ud",
GULLÓN Bolachas de Frutos Vermelhos Vitalday 240 g,"2,59 €",,"10,79 €/Kg",
GULLÓN Bolachas Aveia e Pepitas de Chocolate Vitalday 240 g,"2,59 €",,"10,79 €/Kg",
GULLÓN Bolachas Crocantes Originais Vitalday 265 g,"2,29 €",,"8,64 €/Kg",
ARTIACH Bolacha Dinosaurus Dinoovos 140 g,"2,09 €",,"14,93 €/Kg",
DIA CAFETARIA Cápsulas de Café Intenso Intensidade 9 10 Un,"1,85 €",,"0,19 €/ud",
DIA CAFETARIA Cápsulas de Café Descafeinado Intensidade 1 10 Un,"1,85 €",,"0,19 €/ud",
MENTOS Drageias Fruta Tripack 120 g,"1,99 €",,"16,58 €/Kg",
CEM PORCENTO Biscoitos Integrais de Alfarroba  250 g,"2,69 €",,"10,76 €/Kg",
CEM PORCENTO Bolachas Marinheiras Naturais 200 g,"2,89 €",,"14,45 €/Kg",
BELVITA Bolachas Soft Bakes Frutos Silvestres  250 g,"2,99 €",,"11,96 €/Kg",
TRIUNFO GO Bolachas Digestivas de Canela 171 g,"1,69 €",,"9,88 €/Kg",
OREO Bolachas Golden 154 g,"1,49 €",,"9,68 €/Kg",
CUÉTARA Bolachas Crackers Integral 200 g,"1,29 €",,"6,45 €/Kg",
DELTA Q Cápsulas De Café Qualidus XL 40 Un,"12,99 €",,"0,32 €/ud",
HALLS Rebuçados Vitamina C Melancia 32 g,"0,89 €",,"27,81 €/Kg",
LIPTON Chá Pyramid Limão & Gengibre 20 Un,"2,99 €",,"0,15 €/ud",
TOBLERONE Chocolate Negro 100 g,"2,49 €",,"24,90 €/Kg",
DIA GALLETECA Bolachas Cobertas com Chocolate de Leite 150 g,"1,25 €",,"8,33 €/Kg",
DELTA Café Moagem Universal Portugal 250 g,"3,29 €",,"13,16 €/Kg",
TRIUNFO GO Bolachas Gestivas de Aveia 171 g,"1,69 €",,"9,88 €/Kg",
NESTLÉ Tablete de Chocolate de Leite 90 g,"1,49 €",,"16,56 €/Kg",
ROYAL Gelatina de Limão Light 10Kcal 31 g,"2,09 €",,"67,42 €/Kg",
DIA DELICIOUS Doce de Frutos Vermelhos 320 g,"2,45 €",,"7,66 €/Kg",
"TRIDENT Pastilhas Bottle Spearmint 82,6 g","2,99 €",,"36,20 €/Kg",
"TRIDENT Pastilhas Shpere Morango 82,6 g","2,99 €",,"36,20 €/Kg",
NACIONAL  Shortcake Chocoalte 180 g,"1,75 €",,"9,72 €/Kg",
REGINA Chocolate Leite com Amêndoas 24 g,"0,69 €",,"28,75 €/Kg",
REGINA Tablete Chocolate de Leite Aroma Morango 20 g,"0,59 €",,"29,50 €/Kg",
REGINA Tablete Chocolate de Leite Aroma Ananás 20 g,"0,59 €",,"29,50 €/Kg",
REGINA Tablete Chocolate de Leite Aroma Laranja 20 g,"0,59 €",,"29,50 €/Kg",
REGINA Tablete Chocolate de Leite Aroma Maracujá 20 g,"0,59 €",,"29,50 €/Kg",
GRAN PAVESI Bolacha Cracker com Sal 560 g,"3,99 €",,"7,13 €/Kg",
FERBAR Goiabada 300 g,"2,99 €",,"9,97 €/Kg",
DELTA Q Cápsulas de Café QHarisma Intensidade 12 10 Un,"2,99 €",,"0,30 €/ud",
"FITNESS Cereais de Granola, Aveia E Mel 300 g","3,99 €",,"13,30 €/Kg",
NICOLA Cápsulas de Café Bocage 16 Un,"4,64 €",,"0,29 €/ud",
TRIDENT Pastilhas Elásticas Max Splash Morango Lima 22 g,"0,95 €",,"43,18 €/Kg",
DELTA Q Cápsulas de Café Pack Intensidade 40 Un,"12,99 €",,"0,32 €/ud",
"TRIDENT Pastilhas Bottle Frutos Silvestres 82,6 g","2,99 €",,"36,20 €/Kg",
OREO Bolachas Strawberry Cheesecake 154 g,"1,49 €",,"9,68 €/Kg",
TRIDENT Pastilhas Elásticas Max Watermelon Frost 20 g,"0,95 €",,"47,50 €/Kg",
GULLÓN Bolachas Crocantes de Frutas Vitalday 300 g,"2,29 €",,"7,63 €/Kg",
TETLEY Infusão Immune Vit C (Limão e Gengibre) 20 un,"2,84 €","3,79 €","0,14 €/ud","0,19 €/ud"
TETLEY Infusão Verde Detox 20 Un,"2,84 €","3,79 €","0,14 €/ud","0,19 €/ud"
CEM PORCENTO Chocolate Negro com Stevia 100 g,"2,49 €",,"24,90 €/Kg",
SICAL Café Torrado 5 estrelas Lote Tradição Moagem Universal 250 g,"2,59 €","3,49 €","10,36 €/Kg","13,96 €/Kg"
NACIONAL Chocomax 650 g,"3,95 €",,"6,08 €/Kg",
VAHINÉ Rolinhos Cacau 65 g,"1,59 €",,"24,46 €/Kg",
VAHINÉ Baunilha Em Vagem 3 g,"7,99 €",,"2.663,33 €/Kg",
TRIDENT Pastilhas Elásticas Max Melancia & Pêssego 23 g,"0,95 €",,"41,30 €/Kg",
TRIDENT Pastilhas Elásticas Senses Berry 23 g,"0,95 €",,"41,30 €/Kg",
TRIDENT Pastilhas Elásticas Senses Melancia 23 g,"0,95 €",,"41,30 €/Kg",
DELTA Café Moagem Universal Angola 220 g,"3,69 €",,"16,77 €/Kg",
DELTA Q Cápsulas de Café Q Epic Intensidade 14 10 Un,"3,99 €",,"0,40 €/ud",
QUINTA DE JUGAIS Doce de Figo com Noz 280 g,"2,74 €",,"9,79 €/Kg",
QUAKER Cereais Muesli Goju & Mirtilos 350 g,"3,69 €",,"10,54 €/Kg",
ROYAL Gelatina de Frutos do Bosque Light 10 Kcal 31 g,"2,09 €",,"67,42 €/Kg",
"SPECIAL K Barra de Cereais Proteína Coco, Cacau & Caju 4x28 g","2,24 €",,"20,00 €/Kg",
ESTRELITAS Cereais de Mel Nestlé 550 g,"4,19 €",,"7,62 €/Kg",
CRUNCH Chocolate Dark Nestlé 100 g,"1,99 €",,"19,90 €/Kg",
NACIONAL Papas de Aveia com canela 60 g,"1,19 €",,"19,83 €/Kg",
NATURE VALLEY Barrita Aveia & Mel 210 g,"2,99 €",,"14,24 €/Kg",
NATURE VALLEY Barrita Aveia & Chocolate Negro 210 g,"2,99 €",,"14,24 €/Kg",
KINDER BUENO Chocolate 4x43 g,"3,29 €",,"19,13 €/Kg",
ROYAL Gelatina de Melancia Light 10Kcal 31 g,"2,09 €",,"67,42 €/Kg",
ROYAL Gelatina Tropical Light 10Kal 31 g,"2,09 €",,"67,42 €/Kg",
ARTIACH DINOSAUROS Bolachas Dinossauros Cookieness 185 g,"2,29 €",,"12,38 €/Kg",
FERRERO ROCHER Bombons 16 un,"4,09 €","5,49 €","20,45 €/Kg","27,45 €/Kg"
NESTLÉ Bombons Caja Roja 200 g,"7,49 €",,"37,45 €/Kg",
KINDER DELICE Bolo com cobertura de cacau e recheio cremoso 4 Un,"2,29 €",,"14,68 €/Kg",
MERCI Bombons 250 g,"4,74 €","7,29 €","18,96 €/Kg","29,16 €/Kg"
MILKA Chocolate Confetti  100 g,"1,34 €","1,69 €","13,40 €/Kg","16,90 €/Kg"
FERRERO COLLECTION Bombons 15 Un,"7,89 €",,"45,09 €/Kg",
"HALLS Rebuçados Mini Mints Menta 12,5 g","1,19 €",,"95,20 €/Kg",
"HALLS Rebuçados Mini Mints Melancia 12,5 g","1,19 €",,"95,20 €/Kg",
MILKA I Love Milka Nougat  110 g,"4,59 €",,"41,73 €/Kg",
FERRERO PRESTIGE Bombons 21 Un,"10,49 €",,"42,47 €/Kg",
RAFFAELLO Bombons 15 Un,"3,99 €",,"26,60 €/Kg",
MILKA I Love Milka Morango  110 g,"4,59 €",,"41,73 €/Kg",
DIA TEMPTATION Sortido de Bombons Sem Açúcar 300 g,"4,99 €",,"16,63 €/Kg",
DIA Topping Cobertura De Morango 295 g,"2,19 €",,"7,42 €/Kg",
DIA Topping Cobertura de Chocolate 295 g,"2,45 €",,"8,31 €/Kg",
DIA Barrita Chocolate E Avelã 110 g,"1,59 €",,"13,83 €/Kg",
DIA GALLETECA Sticks Choco Bolacha 75 g,"1,79 €",,"23,87 €/Kg",
DIA TEMPTATION Sticks de Chocolate Preto 75 g,"1,79 €",,"23,87 €/Kg",
REGINA Tablete de Chocolate e Cereais Floc Choc Stop 27 g,"0,74 €",,"27,41 €/Kg",
LINDT Chocolate de Leite Mini Cornet 75 g,"1,99 €","2,49 €","26,53 €/Kg","33,20 €/Kg"
CUÉTARA Bolacha Sortida 210 g,"3,09 €",,"14,71 €/Kg",
"DIA TEMPTATION Pétalas de Chocolate, Caramelo e Sal 125 g","2,49 €",,"19.920,00 €/Kg",
MILKA Bombons I Love Milka Praline  44 g,"2,29 €",,"52,05 €/Kg",
SALUTEM Multicereais Crocantes 500 g,"2,79 €","3,29 €","5,58 €/Kg","6,58 €/Kg"
"MILKA Chocolate De Leite Milkinis 87,5 g","1,69 €",,"19,31 €/Kg",
HALLS Canela 32 g,"0,89 €",,"27,81 €/Kg",
OREO Bolacha Original 440 g,"3,99 €",,"9,07 €/Kg",
"GULLÓN Tortitas Arroz, Chocolate Negro e Coco Vitalday 117 g","2,29 €",,"19,57 €/Kg",
GULLÓN Tortitas de Arroz com Chocolate Negro e Laranja 137 g,"2,69 €",,"19,64 €/Kg",
DIA Amendoins Cobertos de Chocolate 250 g,"2,00 €",,"8,00 €/Kg",
L'OR Cápsulas de Café Colombia Intensidade 8 10Un 10 Un,"4,49 €",,"0,45 €/ud",
L'OR Cápsulas de Café Ristretto Intensidade 11 10 Un,"4,29 €",,"0,43 €/ud",
GULLÓN Bolacha Digestive Aveia e Laranja 425 g,"2,94 €",,"6,92 €/Kg",
ST. DALFOUR Doce de Arando e Mirtilo 284 g,"4,39 €",,"15,46 €/Kg",
ST. DALFOUR Doce de 4 Frutos 284 g,"4,39 €",,"15,46 €/Kg",
HARIBO Gomas Mega Roullette 45 g,"0,94 €",,"20,89 €/Kg",
FIBRE ONE Bolacha Brownie Caramelo Salgado 5x24 g,"2,99 €",,"24,92 €/Kg",
VAHINÉ Rolinhos de Chocolate Branco e Preto 181 g,"1,59 €",,"8,78 €/Kg",
MOKAMBO Bebida Solúvel Cereais com Café Intenso 175 g,"4,49 €",,"25,66 €/Kg",
LIPTON Chá Immune Support 20 un,"2,99 €",,"0,15 €/ud",
LIPTON Chá Silhueta Cavalinha Pyramid 20 un,"2,99 €",,"0,15 €/ud",
RICORÉ Café Chicória 260 g,"7,79 €",,"29,96 €/Kg",
DEL MONTE Pêssego Metades 825 g,"3,59 €",,"4,35 €/Kg",
PANTAGRUEL Tablete 70% Cacau 200 g,"2,84 €",,"14,20 €/Kg",
LOACKER Bolacha Quadratini Napolitaner Waffer com Avelã 250 g,"3,29 €",,"13,16 €/Kg",
MINI DIVER Bolacha Recheada com Chocolate 178 g,"1,99 €",,"11,18 €/Kg",
GULLÓN Bolacha Digestive Thins Aveia Chocolate E Mirtilo 270 g,"2,94 €",,"10,89 €/Kg",
LION Snack de Chocolate de Leite Nestlé 42 g,"0,99 €",,"23,57 €/Kg",
SMINT Drageias Peppermint 35 g,"2,05 €",,"58,57 €/Kg",
HALLS Extra Strong  32 g,"0,89 €",,"27,81 €/Kg",
TRIDENT Pastilhas 60 Minutos Peppermint Bottle 80 g,"2,99 €",,"41,53 €/Kg",
TRIDENT Pastilhas 60 Minutos Spearmint Bottle 80 g,"2,99 €",,"41,53 €/Kg",
DELTA Café Solúvel  200 g,"4,14 €",,"20,70 €/Kg",
TOBLERONE Chocolate de Leite 35 g,"0,89 €",,"25,43 €/Kg",
TRIUNFO Bolachas Digestive Finas Chocolate de Leite 170 g,"2,49 €",,"14,65 €/Kg",
CHOCAPIC Barra de Cereais Nestlé 150 g,"3,29 €",,"21,93 €/Kg",
M&M'S Amendoim 100 g,"2,19 €",,"21,90 €/Kg",
NESCAFÉ Galão Café Solúvel 8x17 g,"2,99 €",,"21,99 €/Kg",
NESTLÉ Bombom Plaisir Avelã 154 g,"5,49 €",,"35,65 €/Kg",
NESTLÉ Bombom Plaisir Cereja 158 g,"5,49 €",,"34,75 €/Kg",
BELVITA Bolacha de Chocolate -30% de Açúcares 300 g,"2,49 €",,"8,30 €/Kg",
ROYAL Cheesecake 325 g,"4,29 €",,"13,20 €/Kg",
SIDUL Açúcar Mascavado Saquetas 50 Un,"1,95 €",,"7,80 €/Kg",
MILKA Bombons Moments Oreo  92 g,"2,54 €",,"27,61 €/Kg",
MILKA Bombons Moments Mix  97 g,"2,54 €",,"26,19 €/Kg",
QUAKER Papas de Aveia E Canela 57 g,"1,49 €",,"26,14 €/Kg",
"QUAKER Papas de Aveia, Maçã & Mirtilo 57 g","1,49 €",,"26,14 €/Kg",
LIPTON Chá Preto Yellow Label 20 Un,"1,69 €",,"0,08 €/ud",
LIPTON Chá Infusão Drenar & Tonificar 20 Un,"2,99 €",,"0,15 €/ud",
TRIDENT Pastilhas Oral-B Spearmint 17 g,"1,14 €",,"67,06 €/Kg",
TRIDENT Pastilhas Oral-B Peppermint 17 g,"1,14 €",,"67,06 €/Kg",
CRUNCH Cereais com Chocolate Nestlé 375 g,"2,52 €",,"6,72 €/Kg",
NESQUIK Cereais de trigo com Chocolate Nestlé 625 g,"4,59 €",,"7,34 €/Kg",
"CHEERIOS Cereais com Trigo, Mel e Aveia Nestlé 375 g","2,52 €",,"6,72 €/Kg",
ROYAL Gelatina Morango 114 g,"1,99 €",,"17,46 €/Kg",
ROYAL Gelatina de Ananás 114 g,"1,99 €",,"17,46 €/Kg",
CRUNCH Tablete de Chocolate Branco 100 g,"1,99 €",,"19,90 €/Kg",
ROYAL Gelatina Tutti Frutti 114 g,"1,99 €",,"17,46 €/Kg",
DIA Café Solúvel Descafeinado 100 g,"2,64 €",,"26,40 €/Kg",
DIA GALLETECA Bolachas Torradas 800 g,"1,74 €",,"2,18 €/Kg",
DIA Cappuccino 125 g,"1,84 €",,"14,72 €/Kg",
DIA Chocolate Branco 100 g,"0,71 €",,"7,10 €/Kg",
DIA GALLETECA Bolachas Aros de Chocolate Negro 150 g,"0,89 €",,"5,93 €/Kg",
TWIX Snack Chocolate de Caramelo E Bolacha 3x50 g,"2,39 €",,"15,93 €/Kg",
ROYAL Leite Creme 92 g,"1,09 €",,"11,85 €/Kg",
MOKAMBO Bebida de Cereais e Café 200 g,"4,49 €",,"22,45 €/Kg",
FITNESS Cereais de Aveia Integral com Chocolate Nestlé 375 g,"3,99 €",,"10,64 €/Kg",
SIDUL Açúcar Branco 1 kg,"1,69 €",,"1,69 €/Kg",
SIDUL Açúcar Amarelo 1 kg,"1,89 €",,"1,89 €/Kg",
"TRIDENT Pastilhas Elásticas White Spearmint 14,5 g","0,89 €",,"61,38 €/Kg",
CHOCAPIC Cereais de Chocolate Nestlé 375 g,"2,99 €",,"7,97 €/Kg",
CLUSTERS Cereais de Trigo Integral com Pedaços de Amêndoa Nestlé 325 g,"3,99 €",,"12,28 €/Kg",
DIA GRANJOY Cereais Estrelas 375 g,"1,60 €",,"4,27 €/Kg",
"EL MANDARIN Pudim Flan Mandarim 3x4,8 g","1,29 €",,"0,43 €/ud",
DIA GALLETECA Palitos de Champanhe 400 g,"1,45 €",,"3,62 €/Kg",
DIA Edulcorante 650 Un,"3,10 €",,"3,10 €/ud",
DIA Bolachas Água E Sal 125 g,"0,40 €",,"3,20 €/Kg",
DIA Chocolate Com Amêndoas em Pedaços 100 g,"0,71 €",,"7,10 €/Kg",
"TRIDENT Pastilhas Elásticas Fresh Spearmint 14,5 g","0,89 €",,"61,38 €/Kg",
SNICKERS Snack Chocolate de Caramelo E Amendoins 3x50 g,"2,39 €",,"15,93 €/Kg",
MARS Snack de Chocolate E Caramelo 3x45 g,"2,39 €",,"17,70 €/Kg",
ESTRELITAS Cereais de Mel Nestlé 270 g,"2,39 €",,"8,85 €/Kg",
MILKA Chocolate de Leite 100 g,"1,34 €","1,69 €","13,40 €/Kg","16,90 €/Kg"
NESCAFÉ Café Solúvel Clássico 100 g,"3,99 €",,"39,90 €/Kg",
ARTIACH Bolachas Dinosaurus 185 g,"2,09 €",,"11,30 €/Kg",
DIA CAFETARIA Café Moagem Saco 250 g,"2,05 €",,"8,20 €/Kg",
DIA Rebuçados de Mentol 200 g,"0,81 €",,"4,05 €/Kg",
DIA DELIMAGIC Caramelo Líquido 400 g,"1,49 €",,"3,73 €/Kg",
DIA HORA + DOCE Leite Creme 92 g,"0,50 €",,"5,43 €/Kg",
DIA Drops Recheio Fruta 200 g,"0,99 €",,"4,95 €/Kg",
DIA Caramelos de Frutas 200 g,"0,99 €",,"4,95 €/Kg",
