Nome,Preço,Preço Antigo,PpU,PpU Antigo
MILKA Bolachas de Chocolate Finas 126 g,"1,59 €","1,99 €","12,62 €/Kg","15,79 €/Kg"
DIA TEMPTATION Chocolate de Culinária 70% Cacau 200 g,"1,74 €",,"8,70 €/Kg",
MILKA Tablete Chocolate Daim 100 g,"1,34 €","1,69 €","13,40 €/Kg","16,90 €/Kg"
DIA GRANJOY Cereais Integrais de Frutos Vermelhos Special Form 375 g,"2,05 €",,"5,47 €/Kg",
SEARA Flocos de Aveia Instantâneos Bio 400 g,"1,39 €",,"3,47 €/Kg",
SEARA Flocos de Aveia sem Glúten Bio 400 g,"1,79 €",,"4,48 €/Kg",
DIA GRANJOY Cereais Integrais de Chocolate Special Form 375 g,"2,17 €",,"5,79 €/Kg",
FITNESS Barras Morango Nestlé 141 g,"3,59 €",,"25,46 €/Kg",
NESTLÉ Cereais Ciniminis Churros 360 g,"3,89 €",,"10,81 €/Kg",
CEM PORCENTO Chá Infusão Hibisco Bio 13 g,"0,89 €",,"68,46 €/Kg",
CEM PORCENTO Chá Infusão Camomila Bio 13 g,"0,89 €",,"68,46 €/Kg",
CEM PORCENTO Chá Infusão Detox Bio 13 g,"0,99 €",,"76,15 €/Kg",
CEM PORCENTO Chá Infusão Gengibre Bio 13 g,"0,99 €",,"76,15 €/Kg",
CUÉTARA Bolachas Chocoflakes Callejeros 5x50 g,"2,89 €",,"11,56 €/Kg",
GULLÓN Bolachas de Cacau Dibus Sharkies Sem Glúten 250 g,"2,69 €",,"10,76 €/Kg",
GULLÓN Bolachas Recheadas Chocolate Sem Glúten 250 g,"2,69 €",,"11,96 €/Kg",
LINDOR Bombons Caramelo Salgado 200 g,"6,39 €",,"31,95 €/Kg",
