Nome,Preço,Preço Antigo,PpU,PpU Antigo
DIA TONI TÓNICO Água Tónica 6x200 ml,"2,65 €",,"2,21 €/l",
COCA-COLA Sabor Light 330 ml,"0,75 €",,"2,27 €/l",
TERRAS D'EL REI Vinho Tinto Regional Alentejo 750 ml,"2,84 €",,"3,79 €/l",
"JOI Refrigerante Sem Gás de Laranja e Maracujá 1,5 L","1,90 €",,"1,27 €/l",
"FESTA DO DIA Sangria 1,5 L","1,99 €",,"1,33 €/l",
PORCA DE MURÇA Vinho Tinto 750 ml,"4,85 €",,"6,47 €/l",
GAZELA Vinho Verde Branco 750 ml,"2,84 €",,"3,79 €/l",
MARTINI Vermouth Bianco 750 ml,"8,07 €",,"10,76 €/l",
DIA RIO NOVO Vinho Tinto Doc Bairrada 750 ml,"2,56 €",,"3,41 €/l",
UM BONGO Néctar Laranja 3x200 ml,"1,39 €",,"2,32 €/l",
DIA ALVINI Vermouth Tinto 1 L,"5,35 €",,"5,35 €/l",
SCOTTISH GROCER Whisky 700 ml,"7,92 €",,"11,31 €/l",
COCA-COLA Sabor Original 500 ml,"1,00 €",,"2,00 €/l",
PORTA DA RAVESSA Vinho Branco Doc Alentejo 750 ml,"2,24 €",,"2,99 €/l",
COMPAL Sumo 100% Maçã 1 L,"1,69 €",,"1,69 €/l",
LIPTON Ice Tea Pêssego Prisma 1 L,"1,49 €",,"1,49 €/l",
NAVEGANTE Vinho Tinto Regional Alentejo 750 ml,"1,99 €",,"2,65 €/l",
CASALEIRO Vinho Tinto Regional Tejo 750 ml,"2,23 €",,"2,97 €/l",
LIPTON Ice Tea Manga Prisma 1 L,"1,49 €",,"1,49 €/l",
J&B Whisky Rare 700 ml,"16,99 €",,"24,27 €/l",
DIA MONÁSTICO Vinho Tinto Doc Dão Reserva  750 ml,"3,08 €",,"4,11 €/l",
"SANTAL Refrigerante Sem Gás Active Drink Laranja E Cenoura 1,5 L","1,49 €",,"0,99 €/l",
REGUENGOS Vinho Branco DOC Alentejo 750 ml,"3,49 €",,"4,65 €/l",
MONSARAZ Vinho Branco DOC Alentejano 750 ml,"3,99 €",,"5,32 €/l",
MONSARAZ Vinho Tinto Doc Alentejo 750 ml,"3,99 €",,"5,32 €/l",
MONÁSTICO Vinho Branco DOC Dão 750 ml,"2,05 €",,"2,73 €/l",
DIA MONÁSTICO Vinho Tinto Doc Dão 750 ml,"2,05 €",,"2,73 €/l",
"TRINA Refrigerante Sem Gás de Frutos Tropicais 1,5 L","2,15 €",,"1,43 €/l",
PERIQUITA Vinho Tinto Regional Penísula de Setúbal 750 ml,"3,49 €","4,99 €","4,65 €/l","6,65 €/l"
COMPAL Néctar Clássico de Pêssego 3x200 ml,"1,39 €",,"2,32 €/l",
TERRAS DE BACO Vinho Tinto Regional Alentejo 750 ml,"2,99 €",,"3,99 €/l",
LUSO Água Lisa Sport 750 ml,"0,69 €",,"0,92 €/l",
MONTE DAS ÂNFORAS Vinho Tinto Regional Alentejano 750 ml,"2,65 €",,"3,53 €/l",
MATEUS Vinho Rosé 750 ml,"4,29 €",,"5,72 €/l",
FRANZISKANER Cerveja com Álcool 500 ml,"2,69 €",,"5,38 €/l",
ERISTOFF Vodka 700 ml,"9,99 €",,"14,27 €/l",
"GUARANÁ ANTARCTICA Refrigerante com Gás 1,5 L","1,99 €",,"1,33 €/l",
DIA Vinho Tinto Bag In Box 5 L,"6,15 €",,"1,23 €/l",
ALABASTRO Vinho Tinto Regional Alentejano 750 ml,"2,99 €",,"3,99 €/l",
MONTE VELHO Vinho Tinto Regional Alentejo 750 ml,"5,59 €",,"7,45 €/l",
ALANDRA Vinho Tinto 750 ml,"2,10 €",,"2,80 €/l",
LIPTON Ice Tea Limão Prisma 1 L,"1,99 €",,"1,99 €/l",
BACALHÔA Moscatel de Setúbal 750 ml,"6,09 €",,"8,12 €/l",
DIA FONTE DOS FRADES Vinho Branco Regional Tejo 750 ml,"1,69 €","2,15 €","2,25 €/l","2,87 €/l"
SUMOL Refrigerante com Gás de Laranja 500 ml,"0,99 €",,"1,98 €/l",
POWERADE Ice Storm 500 ml,"1,39 €",,"2,78 €/l",
"VITALIS Água Sem Gás 1,5 L","0,57 €",,"0,38 €/l",
"FANTA ZERO Ananás 1,5 L","1,60 €",,"1,07 €/l",
LOGAN Whisky 700 ml,"23,99 €",,"34,27 €/l",
ST. BART Vinho Do Porto Branco 750 ml,"4,83 €",,"6,44 €/l",
RED BULL Energy Drink 4x250 ml,"5,39 €",,"5,39 €/l",
"PLENO Tisana de Chá Verde E Limão 1,5 L","1,89 €",,"1,26 €/l",
SUPER BOCK STOUT Cerveja com Álcool 6x330 ml,"4,04 €",,"2,04 €/l",
PORTAS DA HERDADE Vinho Tinto Regional Alentejo  750 ml,"3,44 €",,"4,59 €/l",
MARTINI Vermouth Rosso 750 ml,"8,07 €",,"10,76 €/l",
LANCERS Vinho Rosé 750 ml,"2,79 €","3,99 €","3,72 €/l","5,32 €/l"
PLANALTO Vinho Branco DOC Douro Reserva 750 ml,"3,74 €",,"4,99 €/l",
VILA DOS GAMAS Vinho Tinto Doc Alentejo 750 ml,"2,99 €",,"3,99 €/l",
ST. BART Vinho Do Porto Tawny 750 ml,"4,83 €",,"6,44 €/l",
ST. BART Vinho Do Porto Tawny 10 Anos 750 ml,"10,29 €",,"13,72 €/l",
NESTEA Limão 500 ml,"1,00 €",,"2,00 €/l",
DIA MONTE GRANDE Vinho Branco Regional Alentejo 750 ml,"1,84 €",,"2,45 €/l",
ENCOSTAS DE FAVAIOS Vinho Tinto Doc Duriense 750 ml,"2,39 €","3,69 €","3,19 €/l","4,92 €/l"
ENCOSTAS DE FAVAIOS Vinho Branco Regional Duriense 750 ml,"2,39 €","3,69 €","3,19 €/l","4,92 €/l"
DIA ALDEIA BRANCA Vinho Verde Branco Doc 750 ml,"2,05 €",,"2,73 €/l",
"NESTEA Limão 1,5 L","1,60 €",,"1,07 €/l",
"NESTEA Iced Tea Pêssego 1,5 L","1,60 €",,"1,07 €/l",
REAL LAVRADOR Vinho Branco 750 ml,"1,87 €",,"2,49 €/l",
REAL LAVRADOR Vinho Tinto 750 ml,"1,87 €",,"2,49 €/l",
LAGOSTA Vinho Verde Branco Doc 750 ml,"2,99 €",,"3,99 €/l",
DIA MONTE GRANDE Vinho Tinto Regional Reserva Alentejo 750 ml,"3,99 €",,"5,32 €/l",
FAVAIOS Vinho Moscatel 750 ml,"6,14 €",,"8,19 €/l",
"NESTEA Iced Tea Manga e Ananás 1,5 L","1,60 €",,"1,07 €/l",
COMPAL Néctar Clássico de Tutti-Frutti 3x200 ml,"1,39 €",,"2,32 €/l",
COMPAL Néctar Clássico  de Ananás 3x200 ml,"1,39 €",,"2,32 €/l",
CÁLEM Vinho Do Porto Tawny Velhotes 750 ml,"4,99 €",,"6,65 €/l",
CONVENTO DA VILA Vinho Tinto Regional Alentejo 750 ml,"2,69 €",,"3,59 €/l",
CONVENTO DA VILA Vinho Branco Regional Alentejo 750 ml,"2,69 €",,"3,59 €/l",
ERISTOFF Vodka Black 700 ml,"9,99 €","12,99 €","14,27 €/l","18,56 €/l"
CR&F Aguardente Velha Reserva 700 ml,"17,99 €",,"25,70 €/l",
DIA Água com Gás Sabor Limão 6x250 ml,"2,59 €",,"1,73 €/l",
COCA-COLA Zero Açúcar Garrafa 500 ml,"1,00 €",,"2,00 €/l",
MONTE VELHO Vinho Branco Regional Alentejano 750 ml,"5,59 €",,"7,45 €/l",
AVELEDA Vinho Verde Branco DOC Loureiro e Alvarinho 750 ml,"4,99 €",,"6,65 €/l",
DIA Néctar FrutiKids Multifrutas 3x200 ml,"1,36 €",,"2,27 €/l",
DIA COVA DO MONTE Vinho Branco DOC Douro 750 ml,"2,46 €",,"3,28 €/l",
LOIOS Vinho Tinto Regional Alentejo 750 ml,"3,09 €",,"4,12 €/l",
LOIOS Vinho Branco Regional Alentejano 750 ml,"3,09 €",,"4,12 €/l",
CARLSBERG Cerveja com Álcool 6x250 ml,"3,45 €",,"2,30 €/l",
ALABASTRO Vinho Branco 750 ml,"2,99 €",,"3,99 €/l",
GRAND ASTORIA Licor de Amêndoa Amarga 700 ml,"5,24 €",,"7,49 €/l",
GRANDJÓ Vinho Branco Meio Doce Regional Duriense 750 ml,"5,69 €",,"7,59 €/l",
FORAL Vinho Tinto Doc Douro 750 ml,"2,79 €",,"3,72 €/l",
MOIRA'S Vinho Tinto Alentejo 750 ml,"2,19 €",,"2,92 €/l",
RED BULL Bebida Energética 355 ml,"1,89 €",,"5,32 €/l",
SUPER BOCK Cerveja com Álcool 15x200 ml,"6,11 €",,"2,04 €/l",
LIPTON Ice Tea Manga Garrafa 2 L,"2,51 €",,"1,26 €/l",
AVELEDA Vinho Verde Branco 750 ml,"4,49 €",,"5,99 €/l",
EVEL Vinho Tinto Douro 750 ml,"5,69 €",,"7,59 €/l",
SUNNY DELIGHT Refrigerante Morango 310 ml,"0,79 €",,"2,55 €/l",
DONA ERMELINDA Vinho Branco DOC de Palmela 750 ml,"5,29 €",,"7,05 €/l",
DONA ERMELINDA Vinho Tinto Palmela 750 ml,"5,29 €",,"7,05 €/l",
DIA MONTE DAS SERRALHEIRAS Vinho Branco Palmela 750 ml,"1,79 €",,"2,39 €/l",
COMPAL Néctar Clássico de Ameixa 1 L,"1,69 €",,"1,69 €/l",
VINHA DO MARCO Vinho Tinto Bag In Box 5 L,"8,69 €",,"1,74 €/l",
ST. BART Vinho Do Porto Ruby 750 ml,"4,83 €",,"6,44 €/l",
SERRAS DE AZEITÃO Vinho Tinto Regional Península de Setúbal 750 ml,"2,65 €",,"3,53 €/l",
EA Vinho Tinto Regional Alentejo 750 ml,"4,14 €",,"5,52 €/l",
DIA Vinho Branco Bag In Box 5 L,"6,15 €",,"1,23 €/l",
MARQUÊS DE BORBA Vinho Tinto Doc Alentejo 750 ml,"6,69 €",,"8,92 €/l",
COCA-COLA Zero Açúcar Zero Cafeína Lata 330 ml,"0,75 €",,"2,27 €/l",
CUNHA MARTINS Vinho Tinto Doc Dão 750 ml,"2,09 €",,"2,79 €/l",
DIA FINACEPA Vinho Branco Regional Lisboa 750 ml,"1,59 €",,"2,12 €/l",
DIA FINACEPA Vinho Rosé Regional Lisboa 750 ml,"1,59 €",,"2,12 €/l",
SUPER BOCK Cerveja com Álcool 20x250 ml,"8,63 €",,"1,73 €/l",
ALIANÇA Vinho Tinto DOC Dão 750 ml,"2,99 €",,"3,99 €/l",
BUSHMILLS Whisky Irlandês 700 ml,"19,99 €",,"28,56 €/l",
COCA-COLA Sabor Original 12x150 ml,"6,24 €",,"3,47 €/l",
EA Vinho Branco Regional Alentejo 750 ml,"4,14 €",,"5,52 €/l",
ST. BART Vinho do Porto Reserva Tawny 750 ml,"8,58 €",,"11,44 €/l",
DOM MARTINHO Vinho Tinto Regional Alentejano 750 ml,"3,89 €",,"5,19 €/l",
CASALEIRO Vinho Tinto Regional Tejo Reserva 750 ml,"4,99 €",,"6,65 €/l",
DIA FONTE DOS FRADES Vinho Tinto Regional Reserva Tejo 750 ml,"3,42 €",,"4,56 €/l",
LUSO FRUTA Água Sem Gás Frutos Vermelhos 1 L,"1,28 €",,"1,28 €/l",
DIA RAMBLER'S Panaché 6x250 ml,"1,73 €",,"1,15 €/l",
DIA Licor de Ginja 700 ml,"6,03 €",,"8,61 €/l",
MONTE DA RAVASQUEIRA Vinho Tinto Clássico 750 ml,"5,49 €",,"7,32 €/l",
GALITOS Vinho Branco Regional Alentejano 750 ml,"1,78 €","2,29 €","2,37 €/l","3,05 €/l"
FIUZA Vinho Branco Regional Tejo 3 Castas 750 ml,"4,59 €",,"6,12 €/l",
CABEÇA DE TOIRO Vinho Tinto Doc Tejo Reserva 750 ml,"5,59 €",,"7,45 €/l",
GRANDREALE Espumante Doce 750 ml,"4,99 €",,"6,65 €/l",
BOMBAY Gin London Dry Sapphire 700 ml,"23,59 €",,"33,70 €/l",
COMPAL Néctar Vital de Manga E Laranja 3x200 ml,"1,39 €",,"2,32 €/l",
CABRIZ Vinho Branco DOC Dão Colheita Selecionada 750 ml,"4,99 €",,"6,65 €/l",
SAGRES RADLER Cerveja Com Álcool 6x330 ml,"3,99 €",,"2,02 €/l",
"SUNNY DELIGHT Refrigerante California 1,25 L","1,64 €",,"1,31 €/l",
LUSO Água com Frutos Vermelhos 2 L,"2,07 €",,"1,04 €/l",
FIUZA Vinho Tinto Regional Tejo 3 Castas 750 ml,"4,59 €",,"6,12 €/l",
"SUMOL Refrigerante com Gás de Ananás 1,25 L","1,39 €",,"1,11 €/l",
DANTE Vinho Lambrusco Branco 750 ml,"2,15 €",,"2,87 €/l",
SAGRES Cerveja com Álcool 30x250 ml,"26,99 €",,"3,60 €/l",
SONATURAL Sumo de Manga 750 ml,"3,99 €",,"5,32 €/l",
DIA MONTE GRANDE Vinho Tinto Regional Alentejano Bag In Box 3 L,"6,17 €",,"2,06 €/l",
SONATURAL Sumo de Frutos Vermelhos 750 ml,"3,99 €",,"5,32 €/l",
UM BONGO Néctar Tum Tum Manga 3x200 ml,"1,49 €",,"2,48 €/l",
EA Vinho Tinto Regional Alentejano Reserva 750 ml,"6,99 €",,"9,32 €/l",
TRINCA BOLOTAS Vinho Tinto Doc Alentejo 750 ml,"5,59 €",,"7,45 €/l",
DEFESA DO ESPORÃO Vinho Tinto Regional Alentejano 750 ml,"7,19 €",,"9,59 €/l",
DONA ERMELINDA Vinho Tinto Doc Palmela Reserva 750 ml,"9,99 €",,"13,32 €/l",
LIPTON Ice Tea Limão Lata 250 ml,"0,56 €",,"2,24 €/l",
LIPTON Ice Tea Manga Lata 250 ml,"0,56 €",,"2,24 €/l",
LIPTON Ice Tea Pêssego Lata 250 ml,"0,56 €",,"2,24 €/l",
BSE Vinho Branco Regional Península de Setúbal 750 ml,"3,99 €",,"5,32 €/l",
PEPSI MAX Lata 330 ml,"0,56 €",,"1,70 €/l",
COMPAL Néctar Vital de Frutos Vermelhos 3x200 ml,"1,39 €",,"2,32 €/l",
CISTUS Vinho Tinto DOC Douro 750 ml,"4,79 €",,"6,39 €/l",
QUINTA DO CARMO Vinho Tinto Regional Alentejano 750 ml,"12,69 €",,"16,92 €/l",
SONATURAL Sumo de Pepino E Aipo 750 ml,"3,99 €",,"5,32 €/l",
SONATURAL Sumo de Limão E Menta  750 ml,"3,99 €",,"5,32 €/l",
VINHA GRANDE Vinho Tinto DOC Douro 750 ml,"8,99 €",,"11,99 €/l",
VILA REGIA Vinho Tinto DOC Douro 750 ml,"2,99 €",,"3,99 €/l",
VILA DOS GAMAS Vinho Tinto Doc Alentejo Vidigueira 750 ml,"5,49 €",,"7,32 €/l",
MONTE DE SANTA QUITÉRIA Vinho Branco 750 ml,"1,54 €","1,69 €","2,05 €/l","2,25 €/l"
FERREIRA Vinho Do Porto Tawny 750 ml,"6,29 €",,"8,39 €/l",
COMPAL Néctar Clássico de Laranja Do Algarve 3x200 ml,"1,59 €",,"2,65 €/l",
SANTAL Néctar de Manga 3x200 ml,"1,23 €",,"2,05 €/l",
SANTAL Néctar Tutti-frutti 3x200 ml,"1,23 €",,"2,05 €/l",
GRAND ASTORIA Licor de Frutos Silvestres 700 ml,"7,21 €",,"10,30 €/l",
TERRAS DO PÓ Vinho Tinto Regional Península Setúbal 750 ml,"4,69 €",,"6,25 €/l",
CARM Vinho Tinto DOC Douro 750 ml,"10,49 €",,"13,99 €/l",
ASSOBIO Vinho Tinto Regional do Douro 750 ml,"7,49 €",,"9,99 €/l",
DEU LA DEU Vinho Verde Branco DOC Alvarinho 750 ml,"5,17 €","6,99 €","6,89 €/l","9,32 €/l"
TELLU'S Vinho Branco Doc Douro 750 ml,"4,99 €",,"6,65 €/l",
REGUENGOS Vinho Tinto Doc Reserva Alentejo 750 ml,"5,99 €",,"7,99 €/l",
SONATURAL Sumo de Natural Limão E Hortelã 250 ml,"1,79 €",,"7,16 €/l",
SCHWEPPES Água Tónica Garrafa 200 ml,"0,90 €",,"4,50 €/l",
SCHWEPPES Água Tónica Zero Lata 250 ml,"0,85 €",,"3,40 €/l",
DIA Néctar Frutikids Manga 3x200 ml,"1,36 €",,"2,27 €/l",
DIA Néctar Frutikids Tropical 1 L,"1,04 €",,"1,04 €/l",
PORTAL DE S. BRAZ Vinho Branco Regional Alentejano Private Selection 750 ml,"6,49 €",,"8,65 €/l",
CABRIZ Vinho Tinto Doc Dão Reserva 750 ml,"9,49 €",,"12,65 €/l",
KOPKE Vinho Tinto Doc Douro 750 ml,"7,49 €",,"9,99 €/l",
CASAL GARCIA Sangria 750 ml,"3,99 €",,"5,32 €/l",
REGUENGOS Vinho Branco DOC Alentejo Reserva 750 ml,"5,99 €",,"7,99 €/l",
ADEGA DE MONÇÃO Vinho Verde Tinto 750 ml,"2,49 €",,"3,32 €/l",
POUCA ROUPA Vinho Tinto Regional Alentejano 750 ml,"4,99 €",,"6,65 €/l",
SOSSEGO Vinho Branco Regional Alentejano 750 ml,"3,99 €",,"5,32 €/l",
AA Vinho Branco Regional Tejo Leve 750 ml,"1,99 €",,"2,65 €/l",
ALIANÇA Vinho Branco DOC Bairrada Reserva 750 ml,"3,49 €",,"4,65 €/l",
MONSTER ENERGY Ultra White 500 ml,"1,60 €",,"3,20 €/l",
CARM Vinho Branco DOC Douro 750 ml,"10,49 €",,"13,99 €/l",
SUPER BOCK STOUT Cerveja com Álcool 6x200 ml,"2,82 €",,"2,35 €/l",
CORAÇÃO DA MINHA TERRA Vinho Branco Frutado 750 ml,"1,59 €",,"2,12 €/l",
CORAÇÃO DA MINHA TERRA Vinho Rosado Frutado 750 ml,"1,59 €",,"2,12 €/l",
GRAND ASTORIA Moscatel Do Douro 750 ml,"4,93 €",,"6,57 €/l",
VITALIS Água Mineral Sem Gás 6 L,"1,79 €",,"0,30 €/l",
AVELEDA Vinho Branco Regional do Minho 750 ml,"5,99 €",,"7,99 €/l",
HEINEKEN Cerveja com Álcool 24x250 ml,"13,19 €",,"2,20 €/l",
SUPER BOCK Cerveja com Álcool 30x250 ml,"12,05 €",,"1,61 €/l",
"COCA-COLA Zero 1,75 L","1,85 €",,"1,06 €/l",
"COCA-COLA Original 1,75 L","2,20 €",,"1,26 €/l",
"FRIZE Água com Gás Sabor Lima, Pepino e Gengibre 4x250 ml","1,99 €",,"1,99 €/l",
SUNQUICK Concentrado de Frutos Tropicais 700 ml,"4,63 €",,"6,61 €/l",
SUNQUICK Concentrado de Laranja 700 ml,"4,63 €",,"6,61 €/l",
CAVES SANTA MARTA Vinho Tinto Bag In Box 5 L,"8,99 €",,"1,80 €/l",
PAPA FIGOS Vinho Branco DOC Douro 750 ml,"6,99 €",,"9,32 €/l",
SANTAL Néctar Fruit Power 8 Frutos 3x200 ml,"1,23 €",,"2,05 €/l",
"PLENO Tisana de Romã E Camomila 1,5 L","1,89 €",,"1,26 €/l",
SUPERGUSS Refrigerante Sem Gás de Laranja E Manga 2 L,"0,79 €",,"0,40 €/l",
SUPERGUSS Refrigerante Sem Gás de Laranja 2 L,"0,65 €","0,79 €","0,33 €/l","0,40 €/l"
FERREIRA Vinho do Porto LBV 750 ml,"14,99 €",,"19,99 €/l",
CAMPELO Vinho Verde Branco DOC 750 ml,"2,34 €",,"3,12 €/l",
LUSO Água com Sumo de Melancia 1 L,"1,28 €",,"1,28 €/l",
"TRINA Refrigerante Sem Gás Zero Maçã 1,5 L","2,15 €",,"1,43 €/l",
"TRINA ZERO Refrigerante Sem Gás Limão 1,5 L","2,15 €",,"1,43 €/l",
SÃO BRAZ Vinho Tinto Premium 750 ml,"2,99 €",,"3,99 €/l",
DESCOBRE Vinho Branco Doc Douro 750 ml,"5,99 €",,"7,99 €/l",
LIPTON Ice Tea Chá Verde Hortelã & Lima 1 L,"1,27 €",,"1,27 €/l",
CAROLANS Licor Irish Cream 700 ml,"14,79 €",,"21,13 €/l",
CATEDRAL Vinho Tinto Dao Doc 750 ml,"3,99 €",,"5,32 €/l",
VINEA Vinho Branco Regional Alentejano 750 ml,"3,69 €",,"4,92 €/l",
"SANTAL Refrigerante Sem Gás Manga e Cenoura 1,5 L","1,49 €",,"0,99 €/l",
DIA COVA DO MONTE Vinho Tinto DOC Douro Reserva 750 ml,"3,99 €",,"5,32 €/l",
BURMESTER Vinho Tinto Douro DOC 750 ml,"5,99 €",,"7,99 €/l",
"DIA RAMBLER'S Cerveja Lager 0,0º  330 ml","0,40 €",,"1,21 €/l",
LEFFE Cerveja com Álcool Blonde 330 ml,"2,44 €",,"7,39 €/l",
DIA Bebida Isotónica Blue  500 ml,"0,85 €",,"1,70 €/l",
INTIMISTA Vinho Espumante Meio Seco 750 ml,"2,39 €",,"3,19 €/l",
DUAS QUINTAS Garrafa de Vinho Tinto DOC do Douro 750 ml,"12,99 €",,"17,32 €/l",
COCA-COLA Sem Cafeína 1 L,"1,35 €",,"1,35 €/l",
MURGANHEIRA Vinho Branco Espumante Bruto Reserva 750 ml,"11,79 €",,"15,72 €/l",
SANDILIANO Vinho Espumante Rosé 750 ml,"4,32 €",,"5,76 €/l",
SANDILIANO Vinho Espumante Asti 750 ml,"5,91 €",,"7,88 €/l",
SANDILIANO Vinho Espumante Moscato 750 ml,"4,13 €",,"5,51 €/l",
FAVAÍTO Vinho Moscatel 750 ml,"6,59 €",,"8,79 €/l",
DIA RAMBLER'S Cerveja com Álcool 24x250 ml,"10,09 €",,"1,68 €/l",
ABELHARUCO Vinho Tinto Regional Alentejano 750 ml,"5,99 €",,"7,99 €/l",
SUPER BOCK Cerveja com Álcool Munich Dunkel 1927 330 ml,"1,64 €",,"4,97 €/l",
CÁLEM Vinho do Porto White Velhotes 750 ml,"4,99 €",,"6,65 €/l",
SUPER BOCK Cerveja com Álcool Bavaria Weiss 1927 330 ml,"1,64 €",,"4,97 €/l",
"7UP Refrigerante com Gás Lima-Limão Free 1,25 L","1,39 €",,"1,11 €/l",
CÁLEM Vinho do Porto Special Reserve Velhotes 750 ml,"7,49 €",,"9,99 €/l",
BOMBAY Gin London Original 700 ml,"16,59 €",,"23,70 €/l",
SONATURAL Sumo de Frutos Vermelhos 250 ml,"1,79 €",,"7,16 €/l",
SONATURAL Sumo de Manga 250 ml,"1,79 €",,"7,16 €/l",
SONATURAL Sumo de Beterraba 250 ml,"1,79 €",,"7,16 €/l",
SONATURAL Sumo de Cenoura 250 ml,"1,79 €",,"7,16 €/l",
PARCELA DE PIAS Vinho Branco Bag In Box 5 L,"5,99 €",,"1,20 €/l",
CAVES SANTA MARTA Vinho Tinto Doc Douro 750 ml,"2,29 €","2,99 €","3,05 €/l","3,99 €/l"
LEVE MUNDUS Vinho Branco Regional Lisboa 750 ml,"1,99 €",,"2,65 €/l",
PEDRAS Água com Gás Sabor Maracujá 4x250 ml,"2,85 €",,"2,85 €/l",
CAVES SANTA MARTA Vinho Branco Doc Douro 750 ml,"2,29 €","2,99 €","3,05 €/l","3,99 €/l"
LIPTON Ice Tea Pêssego Zero Açúcar 2 L,"2,31 €",,"1,16 €/l",
PORTA DA RAVESSA Vinho Rosé Alentejano 750 ml,"2,24 €",,"2,99 €/l",
GRÃO VASCO Vinho Branco Dão 750 ml,"2,99 €",,"3,99 €/l",
DANTE Vinho Lambrusco Tinto  750 ml,"2,00 €",,"2,67 €/l",
GAZELA Vinho Verde Rosé 750 ml,"2,84 €",,"3,79 €/l",
HEINEKEN Cerveja Com Álcool Lata 330 ml,"0,84 €",,"2,55 €/l",
COPERATIVA AGRÍCOLA DE FELGUEIRAS Vinho Verde Branco Doc 750 ml,"2,49 €",,"3,32 €/l",
ESTEVA Vinho Tinto Doc Douro 375 ml,"2,79 €",,"7,44 €/l",
PLANALTO Vinho Branco DOC Douro Reserva 375 ml,"2,79 €",,"7,44 €/l",
VALE DE LISBOA Vinho Tinto Regional Premium 750 ml,"2,99 €",,"3,99 €/l",
SMIRNOFF Vodka Ice 275 ml,"2,49 €",,"9,05 €/l",
CÁLEM Vinho Do Porto Tawny 10 Anos Velhotes 750 ml,"17,99 €",,"23,99 €/l",
DIA PUR&FICA Água de Nascente Sport 500 ml,"0,39 €",,"0,78 €/l",
DIA RÉGIA CASTA Espumante Bruto 750 ml,"3,39 €",,"4,52 €/l",
DIA RÉGIA CASTA Espumante Meio Seco 750 ml,"3,39 €",,"4,52 €/l",
PORTA DA RAVESSA Vinho Tinto Doc Alentejo Reserva 750 ml,"5,99 €",,"7,99 €/l",
PORTA DA RAVESSA Vinho Branco DOC Alentejo Reserva 750 ml,"5,99 €",,"7,99 €/l",
DIA RÉGIA CASTA Espumante Doce 750 ml,"3,39 €",,"4,52 €/l",
TRINCA BOLOTAS Vinho Branco Alentejo 750 ml,"5,59 €",,"7,45 €/l",
MATEUS Vinho Rosé 375 ml,"2,59 €",,"6,91 €/l",
GALITOS Vinho Tinto Regional Alentejo Bag In Box 3L 3 L,"6,34 €","7,99 €","2,11 €/l","2,66 €/l"
DIA PUR&FICA Água de Nascente 330 ml,"0,16 €",,"0,48 €/l",
"SUMOL Refrigerante com Gás de Ananás 1,75 L","1,51 €",,"0,86 €/l",
"PEPSI Refrigerante com Gás 1,75 L","1,59 €",,"0,91 €/l",
"SUMOL Refrigerante com Gás de Laranja 1,75 L","1,51 €",,"0,86 €/l",
"7UP Refrigerante com Gás de Lima-Limão 1,75 L","1,99 €",,"1,14 €/l",
QUINTA DE PANCAS Vinho Tinto Regional Lisboa 750 ml,"4,49 €",,"5,99 €/l",
PANCAS Vinho Branco Regional Lisboa 750 ml,"4,49 €",,"5,99 €/l",
QUINTA DA ALORNA Vinho Branco Regional Tejo 750 ml,"3,49 €","4,49 €","4,65 €/l","5,99 €/l"
QUINTA DA ALORNA Vinho Tinto Regional Tejo 750 ml,"3,49 €","4,49 €","4,65 €/l","5,99 €/l"
SCHWEPPES Refrigerante Sem Gás Ginger Ale 1 L,"1,95 €",,"1,95 €/l",
BAR ROYAL Cocktail Aromatizado Melão 750 ml,"3,99 €",,"5,32 €/l",
BAR ROYAL Cocktail Aromatizado Morango 750 ml,"3,99 €",,"5,32 €/l",
BANDIDA DO POMAR Sidra com Álcool Maçãs Ácidas Lata 500 ml,"1,18 €",,"2,36 €/l",
SCHWEPPES Refrigerante com Gás Citrus 1 L,"1,95 €",,"1,95 €/l",
FAISÃO Vinho Rosé 750 ml,"2,39 €",,"3,19 €/l",
FAISÃO Vinho Branco 750 ml,"2,39 €",,"3,19 €/l",
CACHO FRESCO Vinho Rosé Frisante 750 ml,"1,99 €",,"2,65 €/l",
CARLSBERG Cerveja com Álcool Lata 330 ml,"0,79 €",,"2,39 €/l",
"REFRESCA O TEU DIA Refrigerante Com Gás Gasosa 1,5 L","0,59 €",,"0,39 €/l",
COCA-COLA Sabor Original 330 ml,"0,80 €",,"2,42 €/l",
FANTA Refrigerante Com Gás de Laranja Lata 330 ml,"0,69 €",,"2,09 €/l",
DIA Vinho Rosé 1 L,"0,88 €",,"0,88 €/l",
DIA COLHEITA SECULAR Vinho Branco 1 L,"0,99 €",,"0,99 €/l",
DIA COLHEITA SECULAR Vinho Tinto 1 L,"0,99 €",,"0,99 €/l",
SAGRES Cerveja Com Álcool Lata 330 ml,"0,65 €",,"1,97 €/l",
SUPER BOCK Cerveja Com Álcool Lata 330 ml,"0,60 €",,"1,82 €/l",
TERRAS D'EL REI Vinho Branco Regional Alentejano 750 ml,"2,84 €",,"3,79 €/l",
CASTELLO Água Com Gás 6x250 ml,"2,79 €",,"1,86 €/l",
RAPOSEIRA Vinho Espumante Reserva Meio Seco 750 ml,"8,39 €",,"11,19 €/l",
WILLIAM LAWSON'S Whisky Escocês 700 ml,"12,99 €",,"18,56 €/l",
CASAL GARCIA Vinho Verde Branco DOC 750 ml,"4,19 €",,"5,59 €/l",
UM BONGO Néctar 8 Frutos 1 L,"1,49 €",,"1,49 €/l",
DIA Néctar de Manga 1 L,"1,12 €",,"1,12 €/l",
DIA Néctar de Manga 3x200 ml,"0,99 €",,"1,65 €/l",
GANCIA Vinho Espumante Asti 750 ml,"8,69 €",,"11,59 €/l",
SUMOL Refrigerante Com Gás de Laranja Lata 330 ml,"0,79 €",,"2,39 €/l",
SUMOL Refrigerante Com Gás de Ananás Lata 330 ml,"0,79 €",,"2,39 €/l",
SUPER BOCK Cerveja Sem Álcool 6x330 ml,"4,31 €",,"2,18 €/l",
PEDRAS Água Com Gás Sabor Limão 4x250 ml,"2,85 €",,"2,85 €/l",
COMPAL Néctar Clássico Pêssego 200 ml,"0,89 €",,"4,45 €/l",
RED BULL Bebida Energética 250 ml,"1,39 €",,"5,56 €/l",
ADEGA DE BORBA Vinho Branco DOC Alentejo 750 ml,"3,89 €",,"5,19 €/l",
COMPAL Néctar Vital Frutos Vermelhos 1 L,"1,29 €",,"1,29 €/l",
PORTA DA RAVESSA Vinho Tinto DOC Alentejo 750 ml,"2,24 €",,"2,99 €/l",
VINHA do MARCO Vinho Tinto 750 ml,"1,74 €",,"2,32 €/l",
"LUSO Água Mineral Natural 1,5 L","0,52 €",,"0,35 €/l",
COCA-COLA Zero Açúcar Garrafa 1 L,"1,17 €",,"1,17 €/l",
COMPAL Néctar Clássico Pêssego 1 L,"1,09 €",,"1,09 €/l",
PEDRAS SALGADAS Água Com Gás 6x250 ml,"2,74 €",,"1,83 €/l",
COMPAL Néctar Clássico de Tutti-Frutti 1 L,"1,09 €",,"1,09 €/l",
"JOI Refrigerante Sem Gás de Laranja 1,5 L","1,90 €",,"1,27 €/l",
"DIA UPSS Refrigerante Com Gás de Laranja 1,5 L","1,04 €",,"0,69 €/l",
COCA-COLA Sabor Original 1 L,"1,35 €",,"1,35 €/l",
J.P. Vinho Tinto Regional Península de Setúbal 750 ml,"2,99 €",,"3,99 €/l",
J.P. Vinho Branco Regional Península de Setúbal 750 ml,"2,99 €",,"3,99 €/l",
"SANTAL Refrigerante Sem Gás Frutos Tropicais e Cenoura 1,5 L","1,49 €",,"0,99 €/l",
REGUENGOS Vinho Tinto DOC Alentejo 750 ml,"3,49 €",,"4,65 €/l",
DIA UPSS Refrigerante Com Gás Lima-Limão Lata 330 ml,"0,55 €",,"1,67 €/l",
COMPAL Néctar Vital de Manga E Laranja 1 L,"1,29 €",,"1,29 €/l",
COCA-COLA Zero Açúcar Lata 330 ml,"0,75 €",,"2,27 €/l",
DIA Néctar Light de Manga E Laranja 1 L,"1,12 €",,"1,12 €/l",
PEPSI Refrigerante Com Gás Lata 330 ml,"0,61 €",,"1,85 €/l",
SAGRES Cerveja Com Álcool 1 L,"1,55 €",,"1,55 €/l",
"DIA Refrigerante Sem Gás de Laranja 1,5 L","0,99 €",,"0,66 €/l",
GRÃO VASCO Vinho Tinto DOC Dão 750 ml,"2,99 €",,"3,99 €/l",
CRISTAL Cerveja Cristal 6x330 ml,"2,99 €",,"0,50 €/ud",
SAGRES Cerveja Com Alcool Lata 500 ml,"0,89 €",,"1,78 €/l",
SUPER BOCK Cerveja Com Álcool Lata 500 ml,"0,79 €",,"1,58 €/l",
"DIA FRESHQUINHOS Refrigerante Sem Gás Frutas e Cenoura 1,5 L","1,25 €",,"0,83 €/l",
GUARANÁ ANTARCTICA Refrigerante Com Gás Guaraná 330 ml,"0,79 €",,"2,39 €/l",
DIA FONTE DOS FRADES Vinho Tinto Regional Tejo 750 ml,"1,69 €","2,15 €","2,25 €/l","2,87 €/l"
DIA Néctar de Tutti-Frutti 1 L,"1,04 €",,"1,04 €/l",
BEIRÃO Licor 700 ml,"10,99 €",,"15,70 €/l",
RED BULL Bebida Energética Sugar Free 250 ml,"1,39 €",,"5,56 €/l",
DIA Néctar Light de Manga E Laranja 3x200 ml,"1,29 €",,"2,15 €/l",
DIA Iced Tea de Manga 2 L,"1,24 €",,"0,62 €/l",
UM BONGO Néctar 8 Frutos 3x200 ml,"1,39 €",,"2,32 €/l",
FRIZE Água Com Gás Sabor Limão 4x250 ml,"1,93 €",,"1,93 €/l",
COMPAL Sumo 100% Laranja 1 L,"1,69 €",,"1,69 €/l",
ADEGA DE BORBA Vinho Tinto DOC Alentejo 750 ml,"3,89 €",,"5,19 €/l",
DIA EL DIABLO Bebida Energética 250 ml,"0,59 €",,"2,36 €/l",
DIA MONTE GRANDE Vinho Tinto Regional Alentejo 750 ml,"1,84 €",,"2,45 €/l",
DIA Bebida Instantânea de Maracujá 40 g,"0,85 €",,"21,25 €/Kg",
DIA Néctar de Tutti-Frutti 3x200 ml,"1,29 €",,"2,15 €/l",
SCHWEPPES Água Tónica 1 L,"1,95 €",,"1,95 €/l",
GALITOS Vinho Tinto Regional Alentejo 750 ml,"1,78 €","2,29 €","2,37 €/l","3,05 €/l"
"FANTA ZERO Uva 1,5 L","1,60 €",,"1,07 €/l",
"JOI Refrigerante Sem Gás Manga E Laranja 1,5 L","1,90 €",,"1,27 €/l",
PEDRAS SALGADAS Água Com Gás 6x330 ml,"3,69 €",,"1,86 €/l",
SUPER BOCK Cerveja Com Álcool 1 L,"1,52 €",,"1,52 €/l",
SUPER BOCK Cerveja Com Álcool 24x200 ml,"8,99 €",,"1,87 €/l",
DIA DANTE Vinho Rosé Lambrusco 750 ml,"2,00 €",,"2,67 €/l",
DIA EL DIABLO Bebida Energética Light 250 ml,"0,55 €",,"2,20 €/l",
"DIA QUERO Iced Tea de Manga 1,5 L","1,17 €",,"0,78 €/l",
