Nome,Preço,Preço Antigo,PpU,PpU Antigo
"DIA QUERO Iced Tea de Pêssego 1,5 L","1,17 €",,"0,78 €/l",
"DIA QUERO Iced Tea de Limão 1,5 L","1,17 €",,"0,78 €/l",
LUSO FRUTA Água Sem Gás Limão 1 L,"1,28 €",,"1,28 €/l",
MONSTER ENERGY Green 500 ml,"1,60 €",,"3,20 €/l",
CASA ERMELINDA Freitas Vinho Tinto Regional Setúbal 3 L,"9,99 €",,"3,33 €/l",
CRISTAL Cerveja Com Álcool 1 L,"1,35 €",,"1,35 €/l",
BURN Original 500 ml,"1,10 €",,"2,20 €/l",
"7UP Refrigerante Com Gás Lima Limão 1,25 L","1,49 €",,"1,19 €/l",
COMPAL Néctar Clássico de Laranja do Algarve 1 L,"1,69 €",,"1,69 €/l",
DIA QUERO Iced Tea de Limão 2 L,"1,24 €",,"0,62 €/l",
LUSO Água Mineral Natural 500 ml,"0,46 €",,"0,92 €/l",
ADEGA de PEGÕES Vinho Tinto Regional Setúbal 750 ml,"1,64 €","2,09 €","2,19 €/l","2,79 €/l"
ADEGA de PEGÕES Vinho Branco Regional Setúbal 750 ml,"1,64 €","2,09 €","2,19 €/l","2,79 €/l"
SCHWEPPES Água Tónica Lata 250 ml,"0,85 €",,"3,40 €/l",
"SUNNY DELIGHT Sunny Delight Florida 1,25 L","1,64 €",,"1,31 €/l",
COMPAL Néctar Vital Manga e Maracujá 1 L,"1,29 €",,"1,29 €/l",
"SUMOL Refrigerante Com Gás de Laranja 1,25 L","1,39 €",,"1,11 €/l",
DIA Iced Tea de Pêssego 6x200 ml,"1,34 €",,"1,12 €/l",
DIA Iced Tea de Manga 6x200 ml,"1,34 €",,"1,12 €/l",
DIA Iced Tea de Limão 6x200 ml,"1,34 €",,"1,12 €/l",
SOMERSBY Sidra Com Álcool Maçã 4x330 ml,"4,09 €",,"3,10 €/l",
VIDIGUEIRA Vinho Tinto DOC Alentejo 750 ml,"3,99 €",,"5,32 €/l",
CAPRI-SUN Safari 200 ml,"0,55 €",,"2,75 €/l",
PAPA FIGOS Vinho Tinto DOC Douro 750 ml,"6,99 €",,"9,32 €/l",
"DIA Sumo de Maçã 1,5 L","1,20 €",,"0,80 €/l",
"DIA Sumo Tropical 1,5 L","1,23 €",,"0,82 €/l",
SUPER BOCK Cerveja Com Álcool 6x330 ml,"4,49 €",,"2,27 €/l",
SOMERSBY Sidra Com Álcool Blackberry 4x330 ml,"4,09 €",,"3,10 €/l",
LIPTON Ice Tea Manga Prisma 200 ml,"0,45 €",,"2,25 €/l",
LIPTON Ice Tea Pêssego Prisma 200 ml,"0,45 €",,"2,25 €/l",
LIPTON Ice Tea Limão Prisma 200 ml,"0,45 €",,"2,25 €/l",
COMPAL Néctar Clássico de Ananás 1 L,"1,69 €",,"1,69 €/l",
CARTUXA Vinho Tinto DOC Alentejo 750 ml,"19,99 €",,"26,65 €/l",
CACHO FRESCO Vinho Branco Frisante 750 ml,"1,99 €",,"2,65 €/l",
LEZÍRIA Vinho Branco Meio Seco 750 ml,"1,59 €",,"2,12 €/l",
LEZÍRIA Vinho Tinto 750 ml,"1,59 €",,"2,12 €/l",
MURALHAS Vinho Verde Branco DOC 750 ml,"3,44 €","4,59 €","4,59 €/l","6,12 €/l"
PARCELA de PIAS Vinho Tinto Bag In Box   5 L,"5,99 €",,"1,20 €/l",
TELLU'S Vinho Tinto DOC Douro 750 ml,"4,99 €",,"6,65 €/l",
7UP Refrigerante Com Gás Lata 330 ml,"0,79 €",,"2,39 €/l",
DIA MONTE DAS SERRALHEIRAS Vinho Tinto D.O. Palmela 750 ml,"1,84 €",,"2,45 €/l",
DIA Néctar de Pêssego 1 L,"1,02 €",,"1,02 €/l",
DIA (CO)NÉCTAR Néctar de Pêra 1 L,"1,02 €",,"1,02 €/l",
DIA Néctar de Pêssego 3x200 ml,"0,99 €",,"1,65 €/l",
DIA (CO)NÉCTAR Néctar de Pêra 3x200 ml,"1,29 €",,"2,15 €/l",
"DIA Refrigerante Sem Gás de Laranja E Maracujá 1,5 L","0,95 €",,"0,63 €/l",
"DIA UPSS Refrigerante Com Gás de Ananás 1,5 L","1,04 €",,"0,69 €/l",
ESKY Refrigerante Com Gás Cola 2 L,"0,88 €",,"0,44 €/l",
"FANTA Laranja 1,5 L","1,60 €",,"1,07 €/l",
COMPAL Néctar Clássico de Pêra 1 L,"1,09 €",,"1,09 €/l",
ANDERSON'S Whisky Blended 700 ml,"7,41 €",,"10,59 €/l",
TAVEDO Vinho Tinto DOC Douro 750 ml,"3,99 €",,"5,32 €/l",
JAMESON Whisky Irlandês 700 ml,"20,99 €",,"29,99 €/l",
DIA VITAL Néctar Vital de Frutos Vermelhos 1 L,"1,15 €",,"1,15 €/l",
PEDRAS SALGADAS Água Com Gás 1 L,"1,47 €",,"1,47 €/l",
HEINEKEN Cerveja Com Álcool 6x250 ml,"3,79 €",,"2,53 €/l",
DIA Vinho Branco 250 ml,"0,65 €",,"2,60 €/l",
DIA Vinho Tinto Brick 250 ml,"0,65 €",,"2,60 €/l",
"DIA Água Com Gás 1,5 L","0,45 €",,"0,30 €/l",
DIA Sumo de Laranja Sem Polpa 1 L,"2,00 €",,"2,00 €/l",
LIPTON Ice Tea Limão Garrafa 2 L,"2,51 €",,"1,26 €/l",
LIPTON Ice Tea Pêssego Garrafa 2 L,"2,51 €",,"1,26 €/l",
SUPER BOCK Cerveja Com Álcool 15x330 ml,"9,08 €",,"1,83 €/l",
CABRIZ Vinho Tinto DOC Dão Colheita Selecionada 750 ml,"4,99 €",,"6,65 €/l",
CASAL GARCIA Vinho Verde Rosé DOC 750 ml,"4,19 €",,"5,59 €/l",
COMPAL Néctar Clássico de Pêra 3x200 ml,"1,39 €",,"2,32 €/l",
"DIA TONI TÓNICO Água Tónica 1,5 L","1,55 €",,"1,03 €/l",
"FANTA Refrigerante Com Gás de Laranja Zero 1,5 L","1,60 €",,"1,07 €/l",
"FANTA ZERO Maracujá 1,5 L","1,60 €",,"1,07 €/l",
SUNNY DELIGHT - Sunny Delight Florida 310 ml,"0,79 €",,"2,55 €/l",
CASTELO DE BORBA Vinho Tinto DOC Alentejo 750 ml,"4,99 €",,"6,65 €/l",
CASTELO DE BORBA Vinho Branco DOC Alentejo 750 ml,"4,99 €",,"6,65 €/l",
SUPER BOCK Cerveja Com Álcool 6x200 ml,"2,99 €",,"2,49 €/l",
"PLENO Tisana de Chá Verde e Limão Light 1,5 L","1,89 €",,"1,26 €/l",
DUORUM Vinho Tinto Doc Douro 750 ml,"12,49 €",,"16,65 €/l",
SOSSEGO Vinho Tinto Regional Alentejo 750 ml,"3,99 €",,"5,32 €/l",
ALIANÇA Vinho Tinto DOC Bairrada Reserva Aliança 750 ml,"3,49 €",,"4,65 €/l",
PEDRAS Água Com Gás Sabor Limão 1 L,"2,19 €",,"2,19 €/l",
PAPO AMARELO Vinho Tinto Regional Reserva Setúbal 750 ml,"9,99 €",,"13,32 €/l",
PAPO AMARELO Vinho Branco Regional Reserva Setúbal 750 ml,"9,99 €",,"13,32 €/l",
DESCOBRE Vinho Tinto DOC Douro 750 ml,"5,99 €",,"7,99 €/l",
DIA PUR&FICA Água de Nascente 6 L,"0,85 €",,"0,14 €/l",
"DIA PUR&FICA Água de Nascente 1,5 L","0,29 €",,"0,19 €/l",
BANDIDA do POMAR Sidra com Álcool Maçã Lata 500 ml,"1,18 €",,"2,36 €/l",
PENACOVA Água Mineral 5 L,"0,99 €",,"0,20 €/l",
"PENACOVA Água Mineral 1,5 L","0,38 €",,"0,25 €/l",
"COCA-COLA Zero Açúcar Zero Cafeína Garrafa 1,75 L","1,85 €",,"1,06 €/l",
ESTEVA Vinho Tinto DOC Douro 750 ml,"3,74 €",,"4,99 €/l",
DIA Tea de Pêssego 2 L,"1,24 €",,"0,62 €/l",
SAGRES Cerveja Sem Álcool 0.0% 330 ml,"0,68 €",,"2,06 €/l",
SOMERSBY Sidra Com Álcool Maçã Lata 500 ml,"1,29 €",,"2,58 €/l",
"LUSO Água Mineral Natural 5,4 L","1,44 €",,"0,27 €/l",
DIA PUR&FICA Água de Nascente 500 ml,"0,19 €",,"0,38 €/l",
SÃO BRAZ Vinho Tinto Regional Alentejano Selection 750 ml,"6,49 €",,"8,65 €/l",
SCHWEPPES Refrigerante Sem Gás Ginger Ale Lata 330 ml,"0,85 €",,"2,58 €/l",
SCHWEPPES Refrigerante Com Gás Citrus Lata 330 ml,"0,85 €",,"2,58 €/l",
PEDRAS Água Com Gás Sabor Tangerina 4x250 ml,"2,85 €",,"2,85 €/l",
SAGRES Cerveja com Álcool Preta Lata 330 ml,"0,74 €",,"2,24 €/l",
QUINTA DO CÔTTO Vinho Tinto do Douro 750 ml,"6,99 €",,"9,32 €/l",
BOHEMIA Cerveja com Álcool Pilsener 330 ml,"0,79 €",,"2,39 €/l",
BOHEMIA Cerveja com Álcool 330 ml,"0,79 €",,"2,39 €/l",
DIA HOLA COLA Refrigerante Com Gás Zero 2 L,"0,81 €",,"0,41 €/l",
DIA HOLA COLA Refrigerante Com Gás Lata 330 ml,"0,59 €",,"1,79 €/l",
DIA HOLA COLA Refrigerante Com Gás Zero Lata 330 ml,"0,40 €",,"1,21 €/l",
"HEINEKEN Cerveja Sem Álcool 0,0% Lata 330 ml","0,89 €",,"2,70 €/l",
BOHEMIA Cerveja com Álcool 330 ml,"0,79 €",,"2,39 €/l",
DIA HOLA COLA Refrigerante Com Gás 2 L,"1,15 €",,"0,58 €/l",
QUINTA DOS CARVALHAIS Vinho Tinto Dão Mélange à 3 750 ml,"4,49 €",,"5,99 €/l",
CAVES VELHAS Vinho Branco Bucelas 750 ml,"3,99 €",,"5,32 €/l",
ADEGA DE MONÇÃO Vinho Verde Branco DOC 750 ml,"3,29 €",,"4,39 €/l",
CASTIÇO Vinho Branco Frisante 750 ml,"2,99 €",,"3,99 €/l",
"PEPSI Refrigerante Com Gás Max 1,75 L","1,27 €",,"0,73 €/l",
CORONA Cerveja com Álcool Mexicana 210 ml,"1,25 €",,"5,95 €/l",
LUSO Água com Sabor Maçã 1 L,"1,28 €",,"1,28 €/l",
SOMERSBY Sidra Com Álcool Maçã 6x200 ml,"4,39 €",,"3,66 €/l",
DIA RAMBLER'S Cerveja 500 ml,"0,71 €",,"1,42 €/l",
DIA RAMBLER'S Cerveja 1 L,"1,35 €",,"1,35 €/l",
DIA RAMBLER'S Cerveja 6x250 ml,"2,69 €",,"1,79 €/l",
DIA RAMBLER'S Cerveja Rambler Lata 330 ml,"0,41 €",,"1,24 €/l",
ALDEIA VELHA Aguardente 700 ml,"14,99 €",,"21,41 €/l",
MARQUÊS DE MARIALVA Vinho Tinto Bairrada 750 ml,"4,24 €","4,99 €","5,65 €/l","6,65 €/l"
CASA DE SANTAR Vinho Tinto Dão 750 ml,"7,49 €",,"9,99 €/l",
JACK DANIEL'S Whisky 500 ml,"16,99 €",,"33,98 €/l",
WYBOROWA Vodka 700 ml,"10,49 €",,"14,99 €/l",
AQUARIUS Bebida Isotónica Sabor Limão 330 ml,"0,70 €",,"2,12 €/l",
SAGRES Cerveja Com Álcool 6x330 ml,"4,79 €",,"2,42 €/l",
AQUARIUS Bebida Isotónica Sabor Laranja 330 ml,"0,70 €",,"2,12 €/l",
CAPRI-SUN Refrigerante sem Gás Manga Maracujá Pouch 330 ml,"0,80 €",,"2,42 €/l",
SCHWEPPES Água Tónica Pink 1 L,"1,95 €",,"1,95 €/l",
MURGANHEIRA Vinho Branco Espumante Meio Seco Reserva 750 ml,"11,79 €",,"15,72 €/l",
SPRITE Refrigerante com Gás Lima Limão 330 ml,"0,69 €",,"2,09 €/l",
FANTA Zero Uva 330 ml,"0,69 €",,"2,09 €/l",
RAPOSEIRA Vinho Espumante Branco Bruto Reserva 750 ml,"8,39 €",,"11,19 €/l",
TAVEDO Vinho Branco DOC Douro 750 ml,"3,99 €",,"5,32 €/l",
MONSTER Bebida Energética Mango Loco 500 ml,"1,60 €",,"3,20 €/l",
TAPADA DOS GAMAS Vinho Tinto Regional Alentejano 750 ml,"3,99 €",,"5,32 €/l",
TAPADA DOS GAMAS Vinho Branco Regional Alentejano 750 ml,"3,99 €",,"5,32 €/l",
CASTELLO Água com Gás Sabor Lima 4x250 ml,"2,39 €",,"2,39 €/l",
REAL LAVRADOR Vinho Tinto Regional Alentejo Bag In Box 3L 3 L,"5,99 €",,"2,00 €/l",
REAL LAVRADOR Vinho Branco Regional Alentejo Bag In Box 3L 3 L,"5,99 €",,"2,00 €/l",
"EVIAN Água Mineral Sem Gás 1,5 L","1,79 €",,"1,19 €/l",
EVIAN Água Mineral Sem Gás 500 ml,"1,15 €",,"2,30 €/l",
SCHWEPPES Água Tónica Pink Lata 250 ml,"0,85 €",,"3,40 €/l",
LUSO Água Mineral Sem Gás 10 L,"4,25 €",,"0,43 €/l",
SCHWEPPES Limão Lata 330 ml,"0,85 €",,"2,58 €/l",
JOI Refrigerante Sem Gás Laranja 330 ml,"0,69 €",,"2,09 €/l",
MONTE VELHO Vinho Rosé Regional Alentejano 750 ml,"5,59 €",,"7,45 €/l",
BANDIDA DO POMAR Sidra com Álcool Frutos Vermelhos 500 ml,"1,18 €",,"2,36 €/l",
"SPRITE Refrigerante com Gás Lima Limão 1,5 L","1,25 €",,"0,83 €/l",
"FESTA DO DIA Sangria Branca 1,5 L","1,79 €",,"1,19 €/l",
"SPRITE Refrigerante com Gás Lima Limão Zero 1,5 L","1,25 €",,"0,83 €/l",
HEINEKEN Cerveja com Álcool Barril 5 L,"15,95 €",,"3,19 €/l",
FANTA Laranja 1 L,"1,10 €",,"1,10 €/l",
SPRITE Refrigerante com Gás Lima Limão 1 L,"0,99 €",,"0,99 €/l",
"FANTA Refrigerante com Gás Guaraná 1,5 L","1,69 €",,"1,13 €/l",
PEPSI Max Refrigerante com Gás Lima 1 L,"0,87 €",,"0,87 €/l",
PAPO AMARELO Vinho Rosé Regional Setúbal 750 ml,"9,99 €",,"13,32 €/l",
SUPER BOCK Cerveja Abadia 330 ml,"0,75 €",,"2,27 €/l",
ROMEIRA Vinho Tinto Reserva Regional Lisboa 750 ml,"3,99 €",,"5,32 €/l",
MONSTER Mule Bebida Energética 500 ml,"1,60 €",,"3,20 €/l",
SUPER BOCK CORUJA Cerveja IPA 330 ml,"0,89 €",,"2,70 €/l",
DESCOBRE Vinho Tinto Reserva DOC Douro 750 ml,"9,99 €",,"13,32 €/l",
SUPER BOCK Cerveja com Álcool Stout Lata 330 ml,"0,70 €",,"2,12 €/l",
"DIA ALCAVIDA Água Mineral Alcalina sem Gás 1,5 L","0,40 €",,"0,27 €/l",
DIA ALCAVIDA Água Mineral Alcalina sem Gás 5 L,"1,09 €",,"0,22 €/l",
MONSTER Bebida Energética Zero 500 ml,"1,60 €",,"3,20 €/l",
ABELHARUCO Vinho Branco Regional Alentejano 750 ml,"3,29 €",,"4,39 €/l",
PAÇO DO TEIXERÓ Vinho Verde Branco 750 ml,"5,99 €",,"7,99 €/l",
GORDONS Gin Sicilian Lemon 700 ml,"18,99 €",,"27,13 €/l",
BRANDYMEL Licor de Mel 700 ml,"9,99 €",,"14,27 €/l",
"SANTAL Refrigerante sem Gás Limonada 1,5 L","1,42 €",,"0,95 €/l",
BOMBAY Sapphire Gin Tonic Lata 250 ml,"2,59 €",,"10,36 €/l",
MARTINI Fiero & Tonic Lata 250 ml,"2,19 €",,"8,76 €/l",
HERDADE PAÇO DO CONDE Vinho Tinto 750 ml,"3,79 €",,"5,05 €/l",
VINHA DO CONDE Vinho Tinto 750 ml,"3,49 €",,"4,65 €/l",
BURN Bebida Energética Pêssego 500 ml,"1,10 €",,"2,20 €/l",
COMPAL Néctar Origens Limão do Algarve 1 L,"1,69 €",,"1,69 €/l",
DESPERADOS Cerveja com Tequila 6x330 ml,"8,69 €",,"4,39 €/l",
J&B Botânica 700 ml,"16,79 €",,"23,99 €/l",
"SUMOL Laranja do Algarve 1,5 L","1,89 €",,"1,26 €/l",
AR Vinho Tinto Regional Alentejano Reserva 750 ml,"4,49 €",,"5,99 €/l",
FONTANÁRIO DE PEGÕES Vinho Tinto DOC Palmela 750 ml,"2,64 €",,"3,52 €/l",
FONTANÁRIO DE PEGÕES Vinho Branco DOC Palmela 750 ml,"2,64 €",,"3,52 €/l",
MONSTER Ultra Fiesta Bebida Energética 500 ml,"1,60 €",,"3,20 €/l",
MONSTER Monarch Bebida Energética 500 ml,"1,60 €",,"3,20 €/l",
OFFLEY Porto Tónico Clink Lata 250 ml,"2,99 €",,"11,96 €/l",
JACK DANIEL'S Licor de Whisky Honey 500 ml,"16,99 €",,"33,98 €/l",
DIA MONTE DAS SERRALHEIRAS Moscatel Setúbal 750 ml,"4,49 €",,"5,99 €/l",
DIA MONTE DAS SERRALHEIRAS Vinho Tinto Reserva D. O. Palmela 750 ml,"3,38 €",,"4,51 €/l",
DIA MONTE DAS SERRALHEIRAS Vinho Rosé D. O. Palmela 750 ml,"1,79 €",,"2,39 €/l",
DIA MONTE DAS SERRALHEIRAS Vinho Tinto Syrah Reserva D. O. Palmela 750 ml,"4,73 €",,"6,31 €/l",
"DIA MONTE DAS SERRALHEIRAS Vinho Tinto Syrah Reserva D. O. Palmela 1,5 L","9,77 €",,"6,51 €/l",
DIA COVA DO MONTE Vinho Tinto DOC Douro 750 ml,"2,46 €",,"3,28 €/l",
"COMPAL Néctar Família Laranja, Maracujá e Limão 1,25 L","1,59 €",,"1,59 €/l",
BANDIDA DO POMAR Sidra com Álcool Maçã 4x250 ml,"3,19 €",,"3,19 €/l",
DIA UPSS Refrigerante com Gás de Laranja 2 L,"1,41 €",,"0,71 €/l",
BOREL Vinho Verde Tinto DOC 750 ml,"2,36 €",,"3,15 €/l",
BOREL Vinho Verde Branco DOC 750 ml,"2,36 €",,"3,15 €/l",
DIA UPSS Refrigerante com Gás de Laranja Zero 2 L,"1,09 €",,"0,55 €/l",
HEINEKEN Silver Lata 330 ml,"0,84 €",,"2,55 €/l",
SAGRES Cerveja com Álcool 6x250 ml,"3,99 €",,"2,66 €/l",
SAGRES Cerveja com Álcool 24x250 ml,"20,99 €",,"3,50 €/l",
HEINEKEN Silver 6x250 ml,"3,79 €",,"2,53 €/l",
SAGRES Cerveja com Álcool Preta 6x250 ml,"4,45 €",,"2,97 €/l",
MONSARAZ Vinho Tinto DOC Alentejano Reserva 750 ml,"4,99 €",,"6,65 €/l",
"SUMOL Refrigerante com Gás Ananás Zero 1,75 L","1,51 €",,"0,86 €/l",
SAGRES Cerveja com Álcool 15x250 ml,"13,99 €",,"3,73 €/l",
"SUMOL Refrigerante com Gás Laranja Zero 1,75 L","1,51 €",,"0,86 €/l",
DIA EL DIABLO Bebidas Energética Mojito 250 ml,"0,79 €",,"3,16 €/l",
MONTE DE PINHEIROS Vinho Tinto Regional Alentejano 750 ml,"2,49 €",,"3,32 €/l",
CASAL GARCIA Sangria Frutos Vermelhos 750 ml,"4,69 €",,"6,25 €/l",
"B! Refrigerante sem Gás Limonada 1,5 L","0,99 €",,"0,66 €/l",
"B! Refrigerante sem Gás Maracujá 1,5 L","0,99 €",,"0,66 €/l",
SONATURAL Sumo Maçã Probiótico 100 ml,"1,09 €",,"10,90 €/l",
SONATURAL Sumo Cenoura Probiótico 100 ml,"1,09 €",,"10,90 €/l",
DIA ALDEIA BRANCA Vinho Verde Rosé DOC 750 ml,"2,05 €",,"2,73 €/l",
RAMBLERS Cerveja Session IPA 330 ml,"1,65 €",,"5,00 €/l",
DIA RAMBLERS Cerveja com Álcool 100% Malte Lata 330 ml,"0,61 €",,"1,85 €/l",
MONSTER Ultra Watermelon Lata 500 ml,"1,60 €",,"3,20 €/l",
MONSTER Khaotic Juice Lata 500 ml,"1,60 €",,"3,20 €/l",
PENACOVA Água Mineral Natural 500 ml,"0,21 €",,"0,42 €/l",
GRAND ASTORIA Licor de Ginja d'Óbidos com Fruto 700 ml,"8,99 €","10,64 €","12,84 €/l","15,20 €/l"
COMPAL Néctar Origens Pêra Rocha e Framboesa 1 L,"1,69 €",,"1,69 €/l",
COMPAL Néctar Vital Ananás e Côco 1 L,"1,29 €",,"1,29 €/l",
DIA RAMBLERS Cerveja Preta com Álcool Lata 330 ml,"0,81 €",,"2,45 €/l",
DIA (CO)NÉCTAR Néctar de Ananás Original 1 L,"1,09 €",,"1,09 €/l",
JOHNNIE WALKER Whisky Escocês Black Label 12 Anos 700 ml,"25,59 €","34,99 €","36.557,14 €/l","49.985,71 €/l"
DIA QUERO Ice Tea Limão Zero 2 L,"1,12 €",,"0,56 €/l",
DIA QUERO Ice Tea Pêssego Zero 2 L,"1,12 €",,"0,56 €/l",
COMPAL Sumo 100% Multifrutos 1 L,"1,69 €",,"1,69 €/l",
COMPAL Sumo 100% Laranja 3x200 ml,"1,79 €",,"2,98 €/l",
DIA (CO)NÉCTAR Néctar de Laranja Original 1 L,"1,76 €",,"1,76 €/l",
DIA QUERO Ice Tea de Manga Zero 2 L,"1,12 €",,"0,56 €/l",
PEPSI Refrigerante com Gás 1 L,"1,09 €",,"1,09 €/l",
COMPAL Sumo 100% Maçã 3x200 ml,"1,79 €",,"2,98 €/l",
COMPAL Sumo 100% Multifrutos 3x200 ml,"1,79 €",,"2,98 €/l",
PEPSI Refrigerante com Gás MAX 1 L,"1,09 €",,"1,09 €/l",
FREIXENET Vinho Espumante Cava Blanc de Blancs Brut 750 ml,"4,59 €",,"6,12 €/l",
LAVRADORES DE FEITORIA Vinho Branco DOC Douro 750 ml,"4,99 €",,"6,65 €/l",
LAVRADORES DE FEITORIA Vinho Tinto DOC Douro 750 ml,"4,99 €",,"6,65 €/l",
"PORTA DA RAVESSA Vinho Tinto DOC Alentejo Colheita Especial 1,5 L","4,99 €",,"3,33 €/l",
PENINA Vinho Branco Regional Tejo 750 ml,"2,49 €",,"3,32 €/l",
PORTAL DA CALÇADA Vinho Verde Branco DOC Reserva 750 ml,"3,59 €",,"4,79 €/l",
LAPADAS Vinho Branco Frisante Lata 250 ml,"1,19 €",,"4,76 €/l",
