Nome,Preço,Preço Antigo,PpU,PpU Antigo
BECEL Creme Vegetal para Barrar 225 g,"2,99 €",,"13,29 €/Kg",
VAQUEIRO Margarina 250 g,"1,35 €",,"5,40 €/Kg",
PLANTA Margarina 225 g,"1,99 €",,"8,84 €/Kg",
DIA LÁCTEA Iogurte Pedaços Morango 4x125 g,"1,25 €",,"2,50 €/Kg",
DIA LÁCTEA Iogurte Aroma Morango 4x125 g,"0,79 €",,"1,58 €/Kg",
DIA LÁCTEA Iogurte Pedaços Frutos Silvestres 4x125 g,"1,25 €",,"2,50 €/Kg",
PRÉSIDENT Queijo Camembert 250 g,"3,79 €",,"15,16 €/Kg",
DIA LÁCTEA Iogurte Aroma Banana 4x125 g,"0,79 €",,"1,58 €/Kg",
SANTIAGO Queijo Serra Da Vila 190 g,"2,99 €",,"15,74 €/Kg",
SANTIAGO Queijo Regional Saloio 190 g,"2,59 €",,"13,63 €/Kg",
MOLICO Leite Em Pó Magro 380 g,"4,99 €",,"13,13 €/Kg",
DIA Iogurte Pêssego e Maracujá 500 g,"1,29 €",,"2,58 €/Kg",
DIA Iogurte Frutos Silvestres 500 g,"1,29 €",,"2,58 €/Kg",
LIMIANO Queijo Flamengo Fatias 200 g,"2,29 €","2,69 €","11,45 €/Kg","13,45 €/Kg"
DIA LÁCTEA Iogurte Pedaços Cereais 4x125 g,"1,25 €",,"2,50 €/Kg",
DIA LÁCTEA Iogurte Aroma Coco 4x125 g,"0,79 €",,"1,58 €/Kg",
DIA LÁCTEA Iogurte Líquido Aroma Banana 160 g,"0,36 €",,"0,36 €/ud",
DIA LÁCTEA Iogurte Líquido Magro Polpa Manga 4x160 g,"1,75 €",,"0,44 €/ud",
DIA Ovos Classe M 12 Un,"2,54 €",,"2,54 €/ud",
ACTIMEL Tutti Frutti 6x100 g,"2,49 €",,"4,15 €/Kg",
YOGGI Iogurte Líquido de Morango 4x160 g,"3,19 €",,"4,98 €/Kg",
DIA LÁCTEA Iogurte Aroma Tutti Frutti 4x125 g,"0,79 €",,"1,58 €/Kg",
DIA LÁCTEA Iogurte Líquido Magro Polpa Morango 4x160 g,"1,75 €",,"0,44 €/ud",
DIA LÁCTEA Natas UHT Para Cozinhar 500 ml,"1,79 €",,"3,58 €/l",
ROYAL Gelatina de Morango 4x100 g,"1,99 €",,"4,98 €/Kg",
DIA LÁCTEA Iogurte Líquido Polpa Morango 4x160 g,"1,55 €",,"2,42 €/Kg",
DIA Iogurte com Pedaços Ananás 200 g,"0,65 €",,"3,25 €/Kg",
DIA Iogurte com Pedaços Avelã 200 g,"0,65 €",,"3,25 €/Kg",
DIA Iogurte com Pedaços Morango 200 g,"0,65 €",,"3,25 €/Kg",
A VACA QUE RI Queijo Fundido Porções Light (8 unidades) 140 g,"2,23 €",,"15,93 €/Kg",
"DIA LÁCTEA Queijo Fresco 0% 4x62,5 g","2,45 €",,"9,80 €/Kg",
BABYBEL Queijo Mini Light Rede 6 unidades 120 g,"2,39 €",,"19,92 €/Kg",
DIA Iogurte Stracciatella 500 g,"1,29 €",,"2,58 €/Kg",
ROYAL Gelatina de Morango Light 10 Kcal 4x100 g,"2,19 €",,"5,48 €/Kg",
ACTIVIA Iogurte Líquido Magro Morango e Kiwi 4x155 g,"1,99 €",,"3,21 €/Kg",
DIA Iogurte Líquido Magro Ananás 4x160 g,"1,75 €",,"0,44 €/ud",
DIA LÁCTEA Iogurte Líquido 0% de Morango E Kiwi 160 g,"0,40 €",,"2,50 €/Kg",
DIA LÁCTEA Iogurte Líquido Polpa Morango e Banana 4x160 g,"1,55 €",,"2,42 €/Kg",
DIA LÁCTEA Queijo Mozzarella Fresca 125 g,"1,09 €",,"8,72 €/Kg",
DIA FIDIAS Iogurte Grego Natural Compota de Morango 4x125 g,"1,55 €",,"3,10 €/Kg",
QUINTA DA AÇAFA Queijo de Ovelha Curado 1 un,"3,99 €",,"3,99 €/ud",
CAMPAINHA Queijo Fresco Magro 200 g,"0,69 €",,"3,45 €/Kg",
CAMPAINHA Queijo Fresco Meio Gordo 200 g,"0,69 €",,"3,45 €/Kg",
YOCO Iogurte Líquido com Palhinhas Morango 6x90 g,"2,19 €",,"4,06 €/Kg",
GALBANI Queijo Mozzarella Fresca 125 g,"1,67 €",,"13,36 €/Kg",
PLANTA Creme Para Barrar com Sabor a Manteiga  225 g,"1,99 €",,"8,84 €/Kg",
CHOCAPIC Iogurte Bicompartimentado Nestlé 2x118 g,"1,85 €",,"7,84 €/Kg",
NESQUIK Iogurte Bicompartimentado Nestlé 2x116 g,"1,85 €",,"7,97 €/Kg",
QUINTA DA AÇAFA Queijo de Mistura Curado 1 Un,"2,89 €",,"2,89 €/ud",
AGROS Leite com Chocolate 8x200 ml,"2,34 €",,"1,46 €/l",
DIA BIFIDUS Iogurte Líquido Bifidus Morango e Kiwi 160 g,"0,45 €",,"0,45 €/ud",
MIMOSA Leite Com Polpa de Morango 4x200 ml,"1,99 €",,"2,49 €/l",
LACTAÇORES Queijo DOP S. Jorge 7 Meses 400 g,"6,19 €",,"15,48 €/Kg",
DIA O CHOCALHO Queijo Em Fatias Light Flamengo 200 g,"2,12 €",,"10,60 €/Kg",
DIA O CHOCALHO Queijo Em Fatias Flamengo 200 g,"1,89 €",,"9,45 €/Kg",
MIMOSA Iogurte Líquido Aroma Morango Super Poupança 6x156 ml,"2,09 €",,"2,31 €/l",
CORPOS DANONE Iogurte Líquido Magro de Morango 4x155 g,"3,39 €",,"5,47 €/Kg",
NOVA AÇORES Manteiga dos Açores 250 g,"2,29 €",,"9,16 €/Kg",
OIKOS Iogurte Grego Maracujá 4x110 g,"2,09 €",,"4,75 €/Kg",
NOVA AÇORES Queijo da Ilha Fatiado 150 g,"1,99 €",,"13,27 €/Kg",
DIA LÁCTEA Iogurte Líquido Magro de Lima-Limão 160 g,"0,40 €",,"2,50 €/Kg",
DAN'UP Iogurte Líquido de Stracciatella 4x155 g,"2,99 €",,"4,82 €/Kg",
DIA Queijo Da Ilha 400 g,"3,79 €",,"9,48 €/Kg",
SANTIAGO Queijo Fresco Meio Gordo 80 g,"0,47 €",,"5,88 €/Kg",
SANTIAGO Queijo Fresco Magro 80 g,"0,47 €",,"5,88 €/Kg",
DIA DONA MARGARIDA Margarina Culinária 250 g,"0,85 €",,"3,40 €/Kg",
ACTIVIA Iogurte Bifidus Líquido Kiwi 4x155 g,"1,99 €",,"3,21 €/Kg",
DIA FIDIAS Iogurte Grego Stracciatella 4x125 g,"1,55 €",,"3,10 €/Kg",
DIA FIDIAS Iogurte Grego Maracujá 4x125 g,"1,55 €",,"3,10 €/Kg",
DANONE Iogurte Líquido de Tutti-Frutti 4x155 g,"2,59 €",,"4,18 €/Kg",
ROYAL Gelatina de Ananás Light 10 Kcal 4x100 g,"2,19 €",,"5,48 €/Kg",
AYAM Leite de Coco 200 ml,"1,69 €",,"8,45 €/l",
DIA SONHOS Gelatina de Morango Light 8Kcal 6x100 g,"1,49 €",,"2,48 €/Kg",
ACTIVIA Iogurte Cremoso Frutos Silvestres 4x120 g,"1,89 €",,"3,94 €/Kg",
ACTIVIA Iogurte Sólido Cereais 4x115 g,"2,09 €",,"4,54 €/Kg",
UCAL Leite C/Chocolate Light 6x250 ml,"4,32 €",,"2,88 €/l",
ACTIVIA Iogurte Sólido Cremoso 0% Cocktail de Frutas 4x120 g,"2,49 €",,"5,19 €/Kg",
PRÉSIDENT Natas Frescas com 30% de Matéria Gorda 200 ml,"1,79 €",,"8,95 €/l",
MIMOSA Iogurte Líquido Magro Morango Super Poupança 6x156 ml,"2,69 €",,"2,97 €/l",
MIMOSA Iogurte Líquido Magro Frutos Tropicais Super Poupança 6x156 ml,"2,69 €",,"2,97 €/l",
SHOYCE Bebida de Arroz 0% 1 L,"1,79 €",,"1,79 €/l",
YOGGI Iogurte Sem Lactose Morango 4x160 g,"3,22 €",,"5,03 €/Kg",
YOGGI Iogurte Sem Lactose Morango & Banana 4x160 g,"3,22 €",,"5,03 €/Kg",
VIGOR Leite Pasteurizado Meio Gordo 0% de Lactose 1 L,"1,25 €",,"1,25 €/l",
VIGOR Leite Meio Gordo com Chocolate 4x200 ml,"2,09 €",,"2,61 €/l",
BECEL Margarina Sabor A Manteiga 400 g,"3,17 €",,"7,93 €/Kg",
YOGGI Iogurte Líquido de Morango 8x160 g,"4,91 €",,"3,84 €/Kg",
BECEL Pro Active Sabor Manteiga 225 g,"3,99 €",,"17,73 €/Kg",
YOGGI Iogurte Líquido Aroma Frutos Silvestres 4x160 g,"3,19 €",,"4,98 €/Kg",
YOGGI Iogurte Líquido Aroma Frutos Tropicais 4x160 g,"3,19 €",,"4,98 €/Kg",
YAOS Iogurte de Stracciatella 4x110 g,"2,19 €",,"4,98 €/Kg",
SANTIAGO Queijo Quinta do Olival Barrado 450 g,"8,49 €",,"8,49 €/ud",
SERRAS DE PENELA Queijo de Vaca E Ovelha Pequeno 1 Un,"3,89 €",,"3,89 €/ud",
SERRAS DE PENELA Queijo de Vaca E Ovelha Grande 1 Un,"6,99 €",,"6,99 €/ud",
FLORA Margarina 400 g,"3,49 €",,"8,73 €/Kg",
ACTIVIA Iogurte Líquido Frutos Silvestres 4x155 g,"1,99 €",,"3,21 €/Kg",
A VACA QUE RI Queijo Fundido Palitos Light 4x35 g,"1,99 €",,"14,21 €/Kg",
CASTELÕES Queijo Prato Light 1 Un,"6,99 €",,"6,99 €/ud",
DANET Sobremesa Baunilha 4x125 g,"1,99 €",,"3,98 €/Kg",
PAIVA Queijo Curado Meio Gordo 1 Un,"6,55 €","7,55 €","6,55 €/ud","7,55 €/ud"
LACTAÇORES Queijo DOP S. Jorge 12 Meses 300 g,"6,29 €",,"20,97 €/Kg",
DANET Sobremesa Caramelo 4x125 g,"1,99 €",,"3,98 €/Kg",
NOVA AÇORES Leite UHT Meio Gordo 1 L,"0,85 €",,"0,85 €/l",
CASTELÕES Queijo Prato 1 Un,"6,99 €",,"6,99 €/ud",
SHOYCE Bebida de Arroz 0% 200 ml,"0,60 €",,"3,00 €/l",
DIA VITAL Bebida de Arroz 1 L,"1,53 €",,"1,53 €/l",
GALBANI Mozzarella Fresca Mini 150 g,"2,69 €",,"17,93 €/Kg",
KOLIÓS Queijo Feta DOP 200 g,"2,59 €",,"12,95 €/Kg",
CAMPAINHA Queijo Ralado Flamengo 150 g,"1,69 €",,"11,27 €/Kg",
FALLINI Queijo Ralado em Pó com Doseador 80 g,"1,69 €",,"21,12 €/Kg",
PAIVA Queijo Prato Apimentado 1 Un,"6,55 €","7,55 €","6,55 €/ud","7,55 €/ud"
A VACA QUE RI Queijo Fundido Porções (16 unidades) 280 g,"3,29 €",,"0,21 €/ud",
A VACA QUE RI Queijo Fundido Porções Light (16 unidades) 280 g,"3,39 €",,"12,11 €/Kg",
OIKOS Iogurte Pêssego 4x110 g,"2,09 €",,"4,75 €/Kg",
MIMOSA Molho de Natas Para Carne 200 ml,"1,09 €",,"5,45 €/l",
"DIA LÁCTEA Queijo Fresco sem Lactose 4x62,5 g","2,09 €",,"8,36 €/Kg",
MILHAFRE Leite UHT Pastagem Meio Gordo 1 L,"0,95 €",,"0,95 €/l",
OIKOS Iogurte Cheesecake de Mirtilo 4x110 g,"2,09 €",,"4,75 €/Kg",
DANET Sobremesa de Chocolate Duplo Prazer 4x100 g,"1,99 €",,"4,98 €/Kg",
ACTIVIA Iogurte Líquido Magro Lima Limão 4x155 g,"3,39 €",,"5,47 €/Kg",
YOPRO Iogurte Líquido Morango e Framboesa 300 g,"2,39 €",,"7,97 €/Kg",
DIA LÁCTEA Iogurte Líquido Natural açúcarado 1 kg,"1,65 €",,"1,65 €/Kg",
DIA LÁCTEA Iogurte Liquido Morango E Banana 1 kg,"1,65 €",,"1,65 €/Kg",
PRÉSIDENT Chantilly 250 g,"2,89 €",,"11,56 €/Kg",
GO CHILL Cappuccino 230 ml,"1,59 €",,"6,91 €/l",
PRÉSIDENT Creme de Queijo Brie 125 g,"2,45 €",,"19,60 €/Kg",
REINA Iogurte Grego Natural 500 g,"1,89 €",,"3,78 €/Kg",
TERRA NOSTRA Manteiga Sem Sal 250 g,"2,35 €",,"9,40 €/Kg",
MILHAFRE Queijo Ilha Graciosa 280 g,"3,49 €",,"12,46 €/Kg",
LAGOS Queijo de Ovelha E Cabra Curado 1 Un,"5,49 €",,"5,49 €/ud",
MILHAFRE Leite de Pastagem Meio Gordo Bio 1 L,"1,29 €",,"1,29 €/l",
AGROS Queijo Flamengo Fatias 200 g,"1,95 €",,"9,75 €/Kg",
MIMOSA Iogurte Polpa Banana e Morango 4x120 g,"1,99 €",,"4,33 €/Kg",
"MIMOSA Iogurte Polpa Banana, Laranja e Bolacha 4x120 g","1,99 €",,"4,15 €/Kg",
GO CHILL Caffe Late 230 ml,"1,59 €",,"6,91 €/l",
DIA Ovos Classe XL 6 Un,"1,99 €",,"1,99 €/ud",
PALHAIS Queijo Cremoso de Cabra para Barrar 125 g,"1,59 €",,"1,59 €/ud",
SANTIAGO Queijo Cremoso de Mistura para Barrar 125 g,"1,59 €",,"1,59 €/ud",
SANTIAGO Queijo Cremoso de Vaca para Barrar 125 g,"1,59 €",,"1,59 €/ud",
CAMPAINHA Queijo Fatiado Cheddar 150 g,"2,29 €",,"15,27 €/Kg",
SANTIAGO Queijo Três Igrejas 450 g,"5,49 €",,"12,20 €/Kg",
DIA LÁCTEA Leite UHT Meio Gordo 1 L,"0,78 €",,"0,78 €/l",
DIA LÁCTEA Leite Magro 1 L,"0,78 €",,"0,78 €/l",
DIA LÁCTEA Leite UHT Gordo 1 L,"0,94 €",,"0,94 €/l",
DIA LÁCTEA Iogurte Líquido Aroma Frutos Tropicais 160 g,"0,36 €",,"0,36 €/ud",
DIA Queijo Fundido 250 g,"1,83 €",,"7,32 €/Kg",
DIA VITAL Bebida de Soja Natural 1 L,"1,02 €",,"1,02 €/l",
O PRÉMIO DO DIA Sobremesa Flan de Ovo 4x100 g,"1,49 €",,"3,73 €/Kg",
PLANTA Margarina 400 g,"3,49 €",,"8,73 €/Kg",
MIMOSA Manteiga Com Sal 250 g,"2,29 €",,"9,16 €/Kg",
MIMOSA Natas UHT 200 ml,"0,89 €",,"4,45 €/l",
PHILADELPHIA Queijo Fresco Para Barrar Com Ervas 150 g,"2,19 €",,"14,60 €/Kg",
DIA Iogurte Magro Com Pedaços Multifruta 8x125 g,"2,65 €",,"2,65 €/Kg",
PRÉSIDENT Queijo Creme Camembert 125 g,"2,19 €",,"17,52 €/Kg",
MIMOSA Leite Magro 1 L,"0,95 €",,"0,95 €/l",
MIMOSA Leite UHT Meio Gordo 1 L,"0,95 €",,"0,95 €/l",
MIMOSA Leite UHT Gordo 1 L,"1,14 €",,"1,14 €/l",
A VACA QUE RI Queijo Fundido Porções (8 unidades) 140 g,"2,23 €",,"15,93 €/Kg",
"DIA LÁCTEA Iogurte Pedaços de Morango, Framboesa E Pêssego 8x125 g","2,25 €",,"2,25 €/Kg",
MATINAL Leite UHT Meio Gordo 1 L,"0,98 €",,"0,98 €/l",
PALHAIS Queijo de Cabra Original 2x100 g,"3,89 €",,"19,45 €/Kg",
DIA Ovos Classe L 6 Un,"1,47 €",,"1,47 €/ud",
MIMOSA Leite UHT Meio Gordo Com Cálcio 200 ml,"0,50 €",,"2,50 €/l",
MIMOSA Leite Magro Com Cálcio 1 L,"1,05 €",,"1,05 €/l",
MIMOSA Leite UHT Meio Gordo Com Cálcio 1 L,"1,05 €",,"1,05 €/l",
DIA LÁCTEA Leite Com Chocolate 3x200 ml,"0,87 €",,"1,45 €/l",
TERRA NOSTRA Queijo Flamengo Fatias 200 g,"2,39 €",,"11,95 €/Kg",
DIA LÁCTEA Queijo Fresco 2x250 g,"2,69 €",,"5,38 €/Kg",
DIA LÁCTEA Iogurte Líquido Aroma Morango 160 g,"0,36 €",,"0,36 €/ud",
AGROS Leite Meio Gordo 1 L,"0,82 €",,"0,82 €/l",
LAGOS Queijo de Ovelha Amanteigado de Seia 1 Un,"7,99 €",,"7,99 €/ud",
DIA Queijo Emmental 250 g,"2,45 €",,"9,80 €/Kg",
UCAL Leite Com Chocolate 250 ml,"0,72 €",,"2,88 €/l",
MATINAL Manteiga Magra 250 g,"2,39 €",,"9,56 €/Kg",
MILHAFRE Manteiga Dos Açores 250 g,"2,04 €",,"8,16 €/Kg",
AGROS Leite Com Chocolate 200 ml,"0,42 €",,"2,10 €/l",
DANACOL Frutos Exóticos 6x100 g,"3,99 €",,"6,65 €/Kg",
LIMIANO Queijo Flamengo Bola 600 g,"4,99 €",,"4,99 €/ud",
GRESSO Leite UHT Meio Gordo 1 L,"0,79 €",,"0,79 €/l",
BECEL Margarina 400 g,"3,17 €",,"7,93 €/Kg",
PALHAIS Queijo de Cabra Chèvre 180 g,"2,99 €","3,89 €","16,61 €/Kg","21,61 €/Kg"
DAN'UP Iogurte Líquido de Morango 4x155 g,"2,99 €",,"4,82 €/Kg",
O PRÉMIO DO DIA Mousse de Chocolate 4x60 g,"1,05 €",,"4,38 €/Kg",
PARMALAT Natas UHT Para Bater 200 ml,"1,12 €",,"5,60 €/l",
PARMALAT Natas Para Culinária 200 ml,"1,12 €",,"5,60 €/l",
DIA DONA MARGARIDA Margarina Girassol 500 g,"1,95 €","2,29 €","3,90 €/Kg","4,58 €/Kg"
BABYBEL Queijo Mini Rede 6 unidades 120 g,"2,29 €",,"19,08 €/Kg",
DIA BIFIDUS Iogurte Líquido Bifidus Cereais 4x160 g,"1,65 €",,"0,41 €/ud",
PRÉSIDENT Queijo Roquefort 100 g,"3,35 €",,"33,50 €/Kg",
LIMIANO Queijo Amanteigado Vaca E Ovelha 450 g,"4,69 €",,"10,42 €/Kg",
TERRA NOSTRA Queijo Flamengo Fatias Light 200 g,"2,29 €",,"11,45 €/Kg",
PRÉSIDENT Manteiga Magra 250 g,"2,55 €",,"10,20 €/Kg",
O PRÉMIO DO DIA Arroz Doce 4x130 g,"2,59 €",,"4,98 €/Kg",
MIMOSA Leite UHT Meio Gordo 3x200 ml,"1,19 €",,"1,98 €/l",
TERRA NOSTRA Queijo Flamengo Fatias 2x200 g,"5,09 €",,"12,73 €/Kg",
LIMIANO Queijo Flamengo Fatias Light 2x200 g,"4,39 €",,"10,97 €/Kg",
LIMIANO Queijo Flamengo Fatias 2x200 g,"4,29 €",,"10,73 €/Kg",
DIA O CHOCALHO Queijo Flamengo Fatias 450 g,"3,89 €",,"8,64 €/Kg",
DIA LÁCTEA Natas Uht Para Cozinhar 3x200 ml,"2,35 €",,"3,92 €/l",
"DANONE Iogurte Aroma Morango, Banana E Tutti-Frutti 8x120 g","1,99 €",,"2,07 €/Kg",
VAQUEIRO Margarina Líquida 500 ml,"2,96 €",,"5,92 €/l",
LAGOS Requeijão de Ovelha 150 g,"1,09 €",,"7,27 €/Kg",
PRÉSIDENT Queijo Brie 200 g,"3,79 €",,"18,95 €/Kg",
DIA LÁCTEA Iogurte Líquido Morango E Banana 160 g,"0,36 €",,"0,36 €/ud",
ACTIVIA Iogurte Magro Frutos Silvestres 4x155 g,"1,99 €",,"3,21 €/Kg",
VIGOR Leite Pasteurizado Magro 1 L,"0,99 €",,"0,99 €/l",
VIGOR Leite Pasteurizado Meio Gordo 1 L,"0,99 €",,"0,99 €/l",
DIA Iogurte Líquido Magro Aroma Morango 160 g,"0,40 €",,"0,40 €/ud",
OIKOS Iogurte Grego Stracciatella 4x110 g,"2,09 €",,"4,75 €/Kg",
A VACA QUE RI Queijo Fundido Palitos 35 g,"0,69 €",,"19,71 €/Kg",
TERRA NOSTRA Manteiga 250 g,"2,35 €",,"9,40 €/Kg",
ACTIVIA Iogurte Bifidus Líquido Morango 4x155 g,"1,99 €",,"3,21 €/Kg",
PHILADELPHIA Queijo Fresco Barrar Regular 150 g,"1,99 €",,"13,27 €/Kg",
PHILADELPHIA Queijo Fresco Barrar Light 150 g,"1,99 €",,"13,27 €/Kg",
FLORA Margarina 225 g,"1,99 €",,"8,84 €/Kg",
DANONINO Petitdino Morango 6x50 g,"2,39 €",,"7,97 €/Kg",
DANONINO Petitdino Morango/Banana 6x50 g,"2,39 €",,"7,97 €/Kg",
CORPOS DANONE Iogurte Líquido Magro Morango/Framboesa 4x155 g,"3,39 €",,"5,47 €/Kg",
PLANTA Creme Para Barrar Com Sabor a Manteiga 400 g,"3,49 €",,"8,73 €/Kg",
MIMOSA Leite Meio Gordo Sem Lactose 1 L,"1,09 €",,"1,09 €/l",
CORPOS DANONE Iogurte Líquido Magro de Pinacolada 4x155 g,"3,39 €",,"5,47 €/Kg",
UCAL Galão 3x200 ml,"2,29 €",,"3,82 €/l",
DIA SONHOS Gelatina de Morango 6x100 g,"1,39 €",,"2,32 €/Kg",
GRESSO Leite Com Chocolate 200 ml,"0,33 €",,"1,65 €/l",
MIMOSA Leite Magro Sem Lactose 1 L,"1,09 €",,"1,09 €/l",
CAMPAINHA Queijo Ralado Mozzarella 150 g,"1,99 €",,"13,27 €/Kg",
ACTIVIA Iogurte Sólido Frutos Secos E Cereais 4x120 g,"2,09 €",,"4,35 €/Kg",
OIKOS Iogurte Grego Natural Açucarado 4x110 g,"2,09 €",,"4,75 €/Kg",
O PRÉMIO DO DIA Sobremesa Serradura 2x85 g,"1,99 €",,"11,71 €/Kg",
OIKOS Iogurte Grego Caramelo 4x110 g,"2,09 €",,"4,75 €/Kg",
OIKOS Iogurte Grego Manga Papaia 4x110 g,"2,09 €",,"4,75 €/Kg",
ACTIVIA Iogurte Sólido Aveia E Nozes 4x115 g,"2,79 €",,"6,07 €/Kg",
DIA SELEÇÃO MUNDIAL Queijo Brie 200 g,"1,59 €",,"7,95 €/Kg",
MATINAL Leite Magro 1 L,"0,98 €",,"0,98 €/l",
DIA SR. BEM BOM Salame de Chocolate 450 g,"3,19 €",,"7,09 €/Kg",
DIA Ovos Classe M 6 Un,"1,35 €",,"1,35 €/ud",
DIA Manteiga Dos Açores 250 g,"2,09 €",,"8,36 €/Kg",
DIA Ovos Galinha Campo 6 Un,"1,39 €",,"1,39 €/ud",
DIA Flan de Baunilha 6x100 g,"1,15 €",,"1,92 €/Kg",
TERRA NOSTRA Queijo Flamengo Bola 1/4 350 g,"3,36 €","3,95 €","9,60 €/Kg","11,29 €/Kg"
PARMALAT Natas Culinária Com Cogumelos 200 ml,"1,27 €",,"6,35 €/l",
DIA O CHOCALHO Queijo Mistura Amanteigado 1 Un,"4,89 €",,"4,89 €/ud",
MIMOSA Natas UHT Para Culinária 200 ml,"0,89 €",,"4,45 €/l",
DANONE Iogurte Líquido Morango 4x155 g,"2,59 €",,"4,18 €/Kg",
DANONE Iogurte Líquido Morango/Banana 4x155 g,"2,59 €",,"4,18 €/Kg",
DIA LÁCTEA Queijo Fresco Normal 4x62 g,"2,05 €",,"8,20 €/Kg",
MIMOSA Leite Com Chocolate Bem Essencial 200 ml,"0,50 €",,"2,50 €/l",
OIKOS Iogurte Grego Morango 4x110 g,"2,09 €",,"4,75 €/Kg",
OIKOS Iogurte Grego Natural 4x110 g,"2,09 €",,"4,75 €/Kg",
DIA VITAL Bebida de Soja Natural 3x200 ml,"1,02 €",,"1,70 €/l",
DANONE Iogurte Natural 4x120 g,"0,96 €","1,48 €","2,00 €/Kg","3,08 €/Kg"
CASTELÕES Queijo em Fatias 200 g,"1,99 €",,"9,95 €/Kg",
DIA VITAL Bebida de Soja Light 1 L,"1,12 €",,"1,12 €/l",
DIA LÁCTEA Leite Meio Gordo Sem Lactose 1 L,"1,02 €",,"1,02 €/l",
KITKAT Iogurtes Bicompartimentados Nestlé 2x115 g,"1,85 €",,"8,04 €/Kg",
SMARTIES Iogurtes Bicompartimentados Nestlé 2x130 g,"1,85 €",,"7,12 €/Kg",
DIA FIDIAS Iogurte Grego Natural Açúcarado 4x125 g,"1,55 €",,"3,10 €/Kg",
CAMPAINHA Queijo Cabra Fresco 130 g,"1,49 €",,"11,46 €/Kg",
CORPOS DANONE Iogurte Líquido Magro de Kiwi E Morango 4x155 g,"3,39 €",,"5,47 €/Kg",
ACTIVIA Iogurte Líquido Cereais 4x155 g,"1,99 €",,"3,21 €/Kg",
DIA VITAL Bebida de Soja de Chocolate 3x200 ml,"1,33 €",,"2,22 €/l",
ACTIVIA Iogurte Cremoso Coco 4x120 g,"1,89 €",,"3,94 €/Kg",
TERRA NOSTRA Leite UHT Pastagem Magro 1 L,"1,04 €",,"1,04 €/l",
TERRA NOSTRA Leite UHT Pastagem Meio Gordo 1 L,"1,04 €",,"1,04 €/l",
SHOYCE Creme Culinário 200 ml,"1,11 €",,"5,55 €/l",
NIDO Leite Em Pó Gordo Nestlé 680 g,"8,99 €",,"13,22 €/Kg",
LAGOS Queijo Em Fatias de Cabra Curado 125 g,"2,39 €",,"19,12 €/Kg",
PRIMOR Manteiga Sem Lactose Magra 125 g,"1,99 €",,"15,92 €/Kg",
UCAL Leite C/Chocolate Go! 3x250 ml,"2,94 €",,"3,92 €/l",
MATINAL Leite Magro Leve 1 L,"1,19 €",,"1,19 €/l",
MIMOSA Iogurte Aroma de Multisabores Super Poupança 8x120 g,"1,89 €",,"1,97 €/Kg",
ACTIVIA Iogurte Líquido Magro Pêssego E Maracujá 4x155 g,"1,99 €",,"3,21 €/Kg",
SHOYCE Bebida de Aveia 200 ml,"0,73 €",,"3,65 €/l",
DANET Sobremesa Chocolate 4x125 g,"1,99 €",,"3,98 €/Kg",
SHOYCE Bebida de Amêndoa 1 L,"2,19 €",,"2,19 €/l",
PAIVA Queijo Amanteigado de Lamego 1 Un,"6,55 €","7,55 €","6,55 €/ud","7,55 €/ud"
PRIMOR Manteiga Com Sal 250 g,"2,29 €",,"9,16 €/Kg",
MIMOSA Iogurte Magro Sólido Morango Coco Super Poupança 6x120 g,"1,99 €",,"2,76 €/Kg",
MIMOSA Manteiga Com Sal Magra 250 g,"2,29 €",,"9,16 €/Kg",
DIA VITAL Bebida de Amêndoa 1 L,"1,64 €",,"1,64 €/l",
REINA Leite Creme Com Bolacha 4x125 g,"2,30 €",,"4,60 €/Kg",
DIA VITAL Bebida de Aveia 1 L,"1,53 €",,"1,53 €/l",
DIA LÁCTEA Leite Magro Sem Lactose 1 L,"1,02 €",,"1,02 €/l",
PARMAREGGIO Queijo Parmigiano Reggiano 150 g,"3,99 €",,"26,60 €/Kg",
ACTIMEL Natural O% Actimel 6x100 g,"2,49 €",,"4,15 €/Kg",
SANTIAGO Requeijão de Cabra 170 g,"2,39 €",,"14,06 €/Kg",
MILHAFRE Queijo em Fatias 200 g,"2,39 €",,"11,95 €/Kg",
VIGOR Kefir Natural 200 ml,"0,62 €",,"3,10 €/l",
VIGOR Kefir Maracujá 200 ml,"0,62 €",,"3,10 €/l",
DANACOL Iogurte Redutor Aveia 6x100 g,"3,99 €",,"6,65 €/Kg",
YOPRO Iogurte Líquido Baunilha Cookies 300 g,"2,39 €",,"7,97 €/Kg",
LINDAHLS Iogurte Sólido Proteico Framboesa 150 g,"1,09 €",,"7,27 €/Kg",
LINDAHLS Iogurte Sólido Proteico Straciatella 150 g,"1,09 €",,"7,27 €/Kg",
DIA LÁCTEA Iogurte Líquido Morango 1 kg,"1,65 €",,"1,65 €/Kg",
DANET Sobremesa Baunilha Chocolate 4x115 g,"1,99 €",,"4,33 €/Kg",
YOCO Iogurte Suissinho Morango Maçã Pera Alperce 6x42 g,"1,62 €",,"6,43 €/Kg",
MIMOSA Iogurte Grego Cheesecake Limão 4x110 g,"2,19 €",,"4,98 €/Kg",
MIMOSA Leite Chocolate Meio Gordo Sem Lactose 200 ml,"0,57 €",,"2,85 €/l",
MIMOSA Leite Meio Gordo Sem Lactose UHT 200 ml,"0,50 €",,"2,50 €/l",
MIMOSA Leite Magro UHT 200 ml,"0,40 €",,"2,00 €/l",
CAMPAINHA Queijo Fatias Flamengo 2x400 g,"8,59 €",,"10,74 €/Kg",
LINDAHLS Iogurte Sólido Pro+ Limão e Cookies 150 g,"1,09 €",,"7,27 €/Kg",
YAOS Iogurte Natural Creations 1 kg,"3,79 €",,"3,79 €/Kg",
YOCO Iogurte Suissinho Morango 6x42 g,"1,62 €",,"6,43 €/Kg",
YOPRO Iogurte Sólido Mirtilo 160 g,"1,39 €",,"8,69 €/Kg",
YOPRO Iogurte Sólido Manteiga De Amendoim e Banana 160 g,"1,39 €",,"8,69 €/Kg",
A VACA QUE RI Queijo Fundido Palitos 4x35 g,"1,94 €",,"13,86 €/Kg",
MIMOSA Iogurte Líquido Aroma Frutos Tropicais Super Poupança 6x156 g,"2,09 €",,"2,31 €/l",
DIA Iogurte Líquido Polpa Coco e Ananás 4x160 g,"1,55 €",,"2,42 €/Kg",
MIMOSA Iogurte Sólido 0% Lactose Magro 4x120 g,"2,09 €",,"4,35 €/Kg",
MIMOSA Iogurte Líquido Bem Especial sem Lactose Sabor Morango 4x156 g,"2,09 €",,"3,46 €/l",
MIMOSA Iogurte Sólido ELEVA Sabor Framboesa 4x115 g,"1,99 €",,"4,33 €/Kg",
ACTIVIA Iogurte Líquido de Manga e Papaia 4x155 g,"1,99 €",,"3,21 €/Kg",
PARMALAT Nata Culinária Sem Lactose 200 ml,"1,32 €",,"6,60 €/l",
SHOYCE Bebida de Amêndoa 0% Açúcar 1 L,"2,19 €",,"2,19 €/l",
MIMOSA Leite Equílibrio Aveia 1 L,"1,69 €",,"1,69 €/l",
MIMOSA Leite Equílibrio Amêndoa 1 L,"1,69 €",,"1,69 €/l",
VIGOR Leite Gordo Pasteurizado 1 L,"1,09 €",,"1,09 €/l",
MIMOSA Biogurte Líquido Morango 4x156 g,"2,79 €",,"4,62 €/l",
MIMOSA Biogurte Sólido Natural 4x115 g,"2,09 €",,"4,54 €/Kg",
MIMOSA Biogurte Sólido Aveia e Maçã 2x115 g,"1,29 €",,"5,61 €/Kg",
MIMOSA Biogurte Sólido Mirtilo e Cassis 2x115 g,"1,29 €",,"5,61 €/Kg",
PARMALAT Natas Carbonara 200 ml,"1,27 €",,"6,35 €/l",
UCAL Leite com Chocolate 1 L,"2,85 €",,"2,85 €/l",
YOPRO Iogurte Líquido Caramelo 300 g,"2,39 €",,"7,97 €/Kg",
LIMIANO Queijo Flamengo Fatias Light 200 g,"2,35 €","2,79 €","11,75 €/Kg","13,95 €/Kg"
CAMPAINHA Queijo Fatiado Edam 150 g,"1,99 €",,"13,27 €/Kg",
DIA O CHOCALHO Queijo Ralado 150 g,"1,19 €",,"7,93 €/Kg",
DIA LÁCTEA Queijo Ralado 4 Queijos 200 g,"2,39 €",,"11,95 €/Kg",
CAMPAINHA Queijo Fatiado Gouda 150 g,"1,99 €",,"13,27 €/Kg",
SANTIAGO Queijo Atabafado Quinta do Olival Alho & Ervas 2x90 g,"3,99 €",,"22,17 €/Kg",
SHOYCE Bebida Aveia e Amêndoa 0% 1 L,"2,19 €",,"2,19 €/l",
SHOYCE Bebida Aveia Choco 0% 1 L,"2,19 €",,"2,19 €/l",
SHOYCE Bebida Leve 0% 1 L,"1,49 €",,"1,49 €/l",
DANONE Iogurte Bicompartimentado M&M's 120 g,"0,94 €",,"7,83 €/Kg",
YOGGI Iogurte Líquido Chocolate 250 ml,"1,67 €",,"6,68 €/l",
PARMALAT Nata com Café 200 ml,"1,27 €",,"6,35 €/l",
BECEL Creme Vegetal Sabor a Manteiga 225 g,"2,99 €",,"13,29 €/Kg",
DIA GALATEA Queijo Ralado Mozzarella 200 g,"1,69 €",,"8,45 €/Kg",
DIA GALATEA Queijo Ralado Emmental 200 g,"1,75 €",,"8,75 €/Kg",
AGROS Leite Magro 1 L,"0,82 €",,"0,82 €/l",
SANTIAGO Queijo de Cabra Atabafado 2x90 g,"3,99 €",,"22,17 €/Kg",
TWIX Iogurte Danone 120 g,"0,94 €",,"7,83 €/Kg",
DIA LÁCTEA Queijo Fundido Light Porções 250 g,"2,45 €",,"9,80 €/Kg",
NESQUIK Petit Nestlé 6x60 g,"3,24 €",,"9,00 €/Kg",
ACTIMEL Iogurte Morango 12x100 g,"3,99 €",,"3,33 €/Kg",
GRESSO Leite Magro 1 L,"0,79 €",,"0,79 €/l",
TERRA NOSTRA Queijo Flamengo Biológico Fatias 150 g,"2,08 €",,"13,87 €/Kg",
DIA LÁCTEA Queijo Fundido Fatias Light 300 g,"1,65 €",,"5,50 €/Kg",
YOPRO Iogurte Líquido Coco 300 g,"2,39 €",,"7,97 €/Kg",
YOPRO Iogurte Sólido Baunilha 160 g,"1,39 €",,"8,69 €/Kg",
PHILADELPHIA Queijo Fresco para Barrar 270 g,"2,99 €",,"11,07 €/Kg",
OIKOS Iogurte Grego Natural 1 kg,"3,49 €",,"3,88 €/Kg",
CHEESON Queijo para Barrar Natural 150 g,"1,19 €",,"7,93 €/Kg",
CHEESON Queijo para Barrar Light 150 g,"1,29 €",,"8,60 €/Kg",
LINDAHLS Iogurte Líquido Morango Pro Nestlé 330 ml,"1,89 €",,"5,73 €/l",
CASTELÕES Queijo Prato Cura Especial Barrado Pimentão 1 un,"6,99 €",,"6,99 €/ud",
DIA O CHOCALHO Queijo Flamengo Barra 1 kg,"7,79 €",,"7,79 €/Kg",
TERRA NOSTRA Leite de Pastagem Meio Gordo Biológico 1 L,"1,47 €",,"1,47 €/l",
DIA LÁCTEA Queijo Fundido Fatias 300 g,"1,49 €",,"4,97 €/Kg",
DIA O CHOCALHO Queijo de Nisa DOP 1 un,"5,99 €",,"5,99 €/ud",
GO CHILL Caramel Macchiato 230 ml,"1,59 €",,"6,91 €/l",
DANACOL Iogurte Líquido Morango 12x100 g,"6,99 €",,"5,83 €/Kg",
MIMOSA Iogurte com Pedaços Morango 4x120 g,"1,79 €",,"3,73 €/Kg",
MIMOSA Iogurte Sólido Aroma Multisabores Super Poupança 8x120 g,"1,89 €",,"1,97 €/Kg",
MIMOSA Iogurte Magro Sólido Aroma Multisabores Super Poupança 8x120 g,"2,49 €",,"2,59 €/Kg",
MIMOSA Manteiga sem Sal 250 g,"2,29 €",,"9,16 €/Kg",
MIMOSA Iogurte com Pedaços Cereais e Avelã 4x120 g,"1,79 €",,"3,73 €/Kg",
