Nome,Preço,Preço Antigo,PpU,PpU Antigo
AGROS Queijo Flamengo Light Fatias 170 g,"1,95 €",,"11,47 €/Kg",
MATINAL Queijo Fresco sem Lactose 3x72 g,"2,49 €",,"11,53 €/Kg",
DIA O CHOCALHO Queijo Azeitão DOP 1 un,"5,99 €",,"5,99 €/ud",
MIMOSA Iogurte Sólido Magro sem Lactose Mirtilo 4x120 g,"2,09 €",,"4,35 €/Kg",
MIMOSA Iogurte Líquido Magro sem Lactose Kiwi 4x156 ml,"2,29 €",,"3,79 €/l",
MIMOSA Iogurte Líquido Banana Morango 8x156 ml,"2,69 €",,"2,23 €/l",
MIMOSA Iogurte Líquido Aromas Frutos Vermelhos 8x156 ml,"2,69 €",,"2,23 €/l",
GRESSO Manteiga com Sal 250 g,"2,19 €",,"8,76 €/Kg",
PROACTIV Creme Vegetal Magro 225 g,"3,99 €",,"17,73 €/Kg",
ACTIVIA Líquido Aveia e Linhaça 4x155 g,"1,99 €",,"3,21 €/Kg",
MIMOSA Molho de Natas para Massas 200 ml,"1,09 €",,"5,45 €/l",
MIMOSA Leite com Chocolate 200 ml,"0,42 €",,"2,10 €/l",
AGROS Leite com Chocolate 1 L,"1,59 €",,"1,59 €/l",
DIA LÁCTEA Leite Meio Gordo 3x200 ml,"0,92 €",,"1,53 €/l",
TERRA NOSTRA Queijo Curado Fatias 180 g,"2,20 €",,"12,22 €/Kg",
DIA O CHOCALHO Queijo de Ovelha Amanteigado 500 g,"6,99 €",,"13,98 €/Kg",
ACTIMEL Iogurte Líquido Vita C 6x100 g,"2,49 €",,"4,15 €/Kg",
DIA O CHOCALHO Queijo Curado Meio Gordo 520 g,"4,29 €",,"8,25 €/Kg",
DIA BIFIDUS Iogurte Cremoso Natural 4x125 g,"1,35 €",,"2,70 €/Kg",
DIA BIFIDUS Iogurte com Ananás e Coco 0% 4x125 g,"1,25 €",,"2,50 €/Kg",
DIA BIFIDUS Iogurte Baunilha 4x125 g,"1,35 €",,"2,70 €/Kg",
DIA BIFIDUS Iogurte Cremoso com Morango e Nozes 4x125 g,"1,35 €",,"2,70 €/Kg",
DIA SELEÇÃO MUNDIAL Queijo Gouda Fatias 240 g,"1,95 €",,"8,13 €/Kg",
DIA O CHOCALHO Queijo Flamengo sem Lactose Fatias 150 g,"1,75 €",,"11,67 €/Kg",
DIA O CHOCALHO Queijo Flamengo 1/4 Bola 350 g,"2,89 €",,"8,26 €/Kg",
DIA LÁCTEA Queijo Fresco 0% 2x250 g,"2,69 €",,"5,38 €/Kg",
AGROS Leite com Chocolate sem Lactose 200 ml,"0,57 €",,"2,85 €/l",
VIOLIFE Fatiado 100% Vegan Sabor Original 200 g,"3,09 €",,"15,45 €/Kg",
DIA SELEÇÃO MUNDIAL Cheddar Fatias 200 g,"2,36 €",,"11,80 €/Kg",
MILHAFRE Leite Pastagem Magro 1 L,"0,95 €",,"0,95 €/l",
LIMIANO Queijo Curado Amanteigado Meio Gordo Vaca e Ovelha 450 g,"4,69 €",,"10,42 €/Kg",
DIA FIDIAS Iogurte Grego Baunilha 4x125 g,"1,55 €",,"3,10 €/Kg",
DIA FIDIAS Iogurte Grego Caramelo 4x125 g,"1,55 €",,"3,10 €/Kg",
DIA Iogurte Líquido Magro Pêssego 4x160 g,"1,75 €",,"0,44 €/ud",
DIA LÁCTEA Iogurte Líquido Ananás Coco 160 g,"0,36 €",,"2,25 €/Kg",
DIA LÁCTEA Iogurte Líquido Ananás Coco 1 kg,"1,65 €",,"1,65 €/Kg",
PLANTA Creme Culinário 250 g,"1,59 €",,"6,36 €/Kg",
UCAL Leite Chocolate 0% Lactose 6x250 ml,"4,84 €",,"3,23 €/l",
DIA LÁCTEA Iogurte Líquido Stracciatella 4x160 g,"1,55 €",,"2,42 €/Kg",
YOPRO Iogurte Líquido Manga 300 g,"2,39 €",,"7,97 €/Kg",
SHOYCE Bebida Avelã 0% 1 L,"2,49 €",,"2,49 €/l",
SHOYCE Bebida Amêndoa 0% 200 ml,"0,73 €",,"3,65 €/l",
DIA LÁCTEA Iogurte Natural Açucarado Cana de Açúcar 8x125 g,"1,65 €",,"1,65 €/Kg",
LINDAHLS Iogurte Líquido Proteico Straciatella 330 ml,"1,89 €",,"5,73 €/l",
NESTLÉ Kefir Natural 6x100 g,"3,09 €",,"5,15 €/Kg",
ALPRO Bebida Vegetal Soja Original 1 L,"1,99 €",,"1,99 €/l",
ALPRO Bebida Vegetal Amêndoa sem Açúcar 1 L,"2,39 €",,"2,39 €/l",
SANTIAGO Tábua de Queijo Sabores Mistura 3x90 g,"5,99 €",,"22,19 €/Kg",
DIA O CHOCALHO Queijo 3 Leites 250 g,"2,99 €",,"11,96 €/Kg",
YOPRO Pudim Proteico Caramelo 180 g,"2,29 €",,"12,72 €/Kg",
YOPRO Pudim Proteico Chocolate 180 g,"2,29 €",,"12,72 €/Kg",
YOPRO Iogurte Líquido Stracciatella 300 g,"2,39 €",,"7,97 €/Kg",
DIA LÁCTEA Iogurte Natural 8x125 g,"1,39 €",,"1,39 €/Kg",
DIA LÁCTEA Manteiga sem Sal 250 g,"2,09 €",,"8,36 €/Kg",
DIA LÁCTEA Manteiga com Sal 250 g,"2,09 €",,"8,36 €/Kg",
NESTLÉ Kefir Morango 6x100 g,"3,09 €",,"5,15 €/Kg",
EVROFARMA Queijo Feta DOP 150 g,"2,39 €",,"15,93 €/Kg",
PARMAREGGIO Queijo Ralado Parmigiano Reggiano 60 g,"1,99 €",,"33,17 €/Kg",
DIA FIDIAS Iogurte Grego Natural 4x125 g,"1,55 €",,"3,10 €/Kg",
SOIGNON Rolo de Cabra e Vaca Duo 180 g,"2,99 €",,"16,61 €/Kg",
HERDADE DA MAIA Pack Queijo Curado Vaca e Vaca com Pimentão 2x100 g,"2,89 €",,"14,45 €/Kg",
MIMOSA Iogurte Sólido Bifidus Pêssego e Cenoura Sem Lactose Eleva 4x115 g,"1,99 €",,"4,33 €/Kg",
MIMOSA Iogurte Grego Doce de Leite 4x110 g,"2,19 €",,"4,98 €/Kg",
MATINAL Queijo Fresco Cottage Light 180 g,"1,49 €",,"8,28 €/Kg",
MIMOSA Iogurte Líquido Magro Ananás e Manga Super Poupança 8x151 ml,"2,99 €",,"2,48 €/l",
LINDAHLS Pudim Proteico Caramelo 150 g,"1,49 €",,"9,93 €/Kg",
