Nome,Marca,Quantidade,Preço Primário,Preço Por Unidade,Promo
"BEBIDA SOJA C/CALCIO LIGHT ,1L",ALPRO,Emb. 1 LT,"1,89€","1,89€ / LT",
Refrigerante com Gás Ginger Ale,SCHWEPPES,Garrafa 1 LT,"1,95€","1,95€ / LT",
Vinho Regional Alentejo Tinto,REGUENGOS,Garrafa 0.75 LT,"2,39€","3,19€ / LT",
Esfregão Salva Unhas Classic,SCOTCH BRITE,Emb. 2 UNID.,"0,99€","0,50€ / UNID.",
Vinho Regional Dão Tinto,CASA DE SANTAR,Garrafa 0.75 LT,"7,49€","9,99€ / LT",
Abrasivo Sanitário Active Fresh Pinho,HARPIC,Emb. 0.75 LT,"1,94€","2,59€ / LT",
Óleo de Argão,PANTENE,Emb. 0.1 LT,"9,99€","99,90€ / LT",
Queijo Fatiado 2X200 g,LIMIANO,Emb. 0.4 KG,"5,09€","12,73€ / KG",
Esfregão Salva Unhas Comfort,SCOTCH BRITE,Emb. 2 UNID.,"2,54€","1,27€ / UNID.",
"Tisana Silhueta de Cavalinha, Erva Príncipe e Gengibre",LIPTON,Emb. 0.028 KG,"1,94€","69,29€ / KG",
Vinho Regional Bairrada Tinto,MARQUES DE MARIALVA,Garrafa 0.75 LT,"19,99€","26,65€ / LT",
Champô Repara Azeite de Argão de Marrocos,HERBAL ESSENCES,Emb. 0.4 LT,"3,99€","9,98€ / LT",
Sumo Refrigerado Cidreira Tília Camomila Limão,PLENO TISANAS,Garrafa 1.5 LT,"1,49€","0,99€ / LT",
Gel de Banho Corpo e Zona Íntima Suave,CORINE DE FARME,Emb. 0.25 LT,"2,49€","9,96€ / LT",
Iogurte Líquido Morango 4x155g,DANONE,Emb. 0.62 KG,"1,69€","2,73€ / KG",
Queijo Flamengo Light Fatiado,MIMOSA,Emb. 0.2 KG,"2,49€","12,45€ / KG",
Limpa Máquinas da Roupa,XAU,Emb. 0.25 LT,"3,99€","15,96€ / LT",
RECARGA MICROF.BALDE COM PEDAL,VILEDA,,"7,49€",/ Unid.,
Vinho Regional Alentejano Tinto,QUINTA DO CARMO,Garrafa 0.75 LT,"16,99€","22,65€ / LT",
Barras de Cereais 6 Unid.,FITNESS,Emb. 0.141 KG,"2,33€","16,52€ / KG",
Bolachas com Aveia,TRIUNFO,Emb. 0.19 KG,"1,49€","7,84€ / KG",
COGUMELOS FERBAR INTEIRO 290G,FERBAR,Emb. 0.29 KG,"1,33€","4,59€ / KG",
Cápsulas Café Verona P/ Nespresso,STARBUCKS,Emb. 10 CAPS.,"4,49€","0,45€ / CAPS.",
Iogurte Líquido Corpos Piña Colada 4x155g,DANONE,Emb. 0.62 KG,"1,69€","2,73€ / KG",
Whisky Cutty Sark,CUTTY SARK,Garrafa 0.7 LT,"11,49€","16,41€ / LT",
Tomate Cacho,,1 Unid. = 0.2 KG (aprox.),"1,48€/kg","1,49€ / Unid.",
Chá de Frutos Vermelhos,TETLEY,Emb. 10 SAQ.,"1,12€","0,11€ / SAQ.",
Lip Therapy Aloe Vera,VASELINE,Emb. 0.017 KG,"2,99€","175,88€ / KG",
Cápsulas Café Latte Macchiato P/ Dolce Gusto,STARBUCKS,Emb. 12 CAPS.,"5,49€","0,46€ / CAPS.",
Ambientador Recarga Portátil Relax Zen Lavanda e Jasmim,GLADE,Emb. 3 UNID.,"10,78€","3,59€ / UNID.",
Refrigerante C/ Gás Laranja Pack 6,FANTA,Emb. 1.98 LT,"4,14€","2,09€ / LT",
Alimento P/ Gato Adulto de Frango,PURINA,Emb. 3 KG,"22,99€","7,66€ / KG",
Tronco de Natal,,1 Unid. = 1 KG (aprox.),"10,49€/kg","10,49€ / Unid.",
Ambientador Recarga Elétrico Lavanda e Aloé Vera,GLADE,Emb. 2 UNID.,"7,18€","3,59€ / UNID.",
Máscara Repara & Fortalece Capilar com Biotina,TRESEMMÉ,Emb. 0.3 LT,"5,39€","17,97€ / LT",
Bolachas Tosta Rica Choco Guay,CUÉTARA,Emb. 0.168 UNID.,"2,09€","12,44€ / UNID.",
Recarga Ambientador Smooth Satin & Moon Lilly,AIRWICK,Emb. 1 UNID.,"3,59€","3,59€ / UNID.",
Manteiga de Amendoim com Pedaços,CALVÉ,Emb. 0.35 KG,"3,49€","9,97€ / KG",
Chiclets Spearmint 12 Unid.,CHICLETS,Emb. 0.017 KG,"0,99€","58,24€ / KG",
Café Delta Em Grão Torrado Chávena,DELTA,Emb. 1 KG,"12,99€","12,99€ / KG",
Refrigerante S/ Gás Limão,AQUARIUS,Garrafa 1.5 LT,"2,00€","1,33€ / LT",
Iogurte Líquido Straciatella 4x155g,DANONE,Emb. 0.62 KG,"1,69€","2,73€ / KG",
Queijo Fatiado -50% Gordura 2X200 g,TERRA NOSTRA,Emb. 0.4 KG,"5,19€","12,98€ / KG",
Canela Pau,MARGÃO,Emb. 0.03 KG,"2,79€","93,00€ / KG",
Massa Bago,MILANEZA,Emb. 0.25 KG,"0,85€","3,40€ / KG",
BANZAI NOODLE CARNE CIGALA,CIGALA,Emb. 0.067 KG,"0,94€","14,03€ / KG",
Doce de Abóbora,CASA MATEUS,Frasco 0.345 KG,"2,47€","7,16€ / KG",
Alimento Seco P/ Gatos Esterilizados Peru e Legumes,PURINA FRISKIES,Emb. 1.5 KG,"6,99€","4,66€ / KG",
Condicionador para Cabelo Encaracolado,TRESEMMÉ,Emb. 0.5 LT,"4,19€","8,38€ / LT",
Snacks Futebolas,CHEETOS,Emb. 0.13 KG,"1,65€","12,69€ / KG",
Cuecas Incontinência Boutique M,AUSONIA,Emb. 9 UNID.,"11,99€","1,33€ / UNID.",
Crocantes de Frango Original Ultracongelado,IGLO,Emb. 0.18 KG,"3,99€","22,17€ / KG",
Pão de Forma com Códea Especial Torradas,PANRICO,Emb. 0.75 KG,"1,59€","2,12€ / KG",
Máscara de Abacate Ultra Suave,GARNIER,Emb. 0.3 LT,"6,79€","22,63€ / LT",
Cereais Aveia e Morango,NESTUM,Emb. 0.25 KG,"2,19€","8,76€ / KG",
Creme Depilatório Peles Normais,VEET,Emb. 0.2 LT,"6,64€","33,20€ / LT",
DETERGENTE LÍQUIDO CÍTRICO,CIF,Emb. 1.1 LT,"1,99€","1,81€ / LT",
Gel de Banho Naturals Amêndoa e Leite,PALMOLIVE,Emb. 0.5 LT,"2,69€","5,38€ / LT",
Amaciador Concentrado Aromaterapia Dourado,VERNEL,Emb. 57 DOSES,"3,29€","0,06€ / DOSES",
Leite Bem Essencial UHT Meio Gordo,MIMOSA,Emb. 1 LT,"0,95€","0,95€ / LT",
Sumo Delight California,SUNNY DELIGHT,Garrafa 1.25 LT,"1,64€","1,31€ / LT",
Vinho Regional Península de Setúbal Branco,DONA ERMELINDA,Garrafa 0.75 LT,"5,29€","7,05€ / LT",
Snack Queijo de Vaca,PRÉSIDENT,Emb. 0.18 KG,"3,29€","18,28€ / KG",
ÁGUA MICELAR C/ ÁGUA DE ROSAS 400ML,GARNIER,,"7,99€",/ Unid.,
Vinho Regional Península de Setúbal Tinto,SERRAS DE AZEITÃO,Garrafa 0.75 LT,"2,64€","3,52€ / LT",
Chicharro,,1 Unid. = 0.465 KG (aprox.),"6,99€/kg","3,25€ / Unid.",
Massa Concha,MILANEZA,Emb. 0.5 KG,"1,19€","2,38€ / KG",
Manteiga C/ Sal,MILHAFRE,Emb. 0.25 KG,"2,29€","9,16€ / KG",
Queijo Fatiado Light -50% Gordura,TERRA NOSTRA,Emb. 0.2 KG,"2,28€","11,40€ / KG",
Piri Piri Moído,MARGÃO,Emb. 0.038 KG,"2,19€","57,63€ / KG",
Recarga Limpa Vidros,AJAX,Emb. 0.5 LT,"2,99€","5,98€ / LT",
Café Torrado Moído Vietname Moagem Universal Intensidade 10,SICAL,Emb. 0.22 KG,"3,06€","13,91€ / KG",
Molho Cocktail Salsa,HEINZ,Emb. 0.22 KG,"2,39€","10,86€ / KG",
Elixir 12 Horas Protection,COLGATE,Emb. 0.5 LT,"6,99€","13,98€ / LT",
Gel de Banho Hidratante Baby Sensitive,BABY DOVE,Emb. 0.2 LT,"1,79€","8,95€ / LT",
Azeite extra virgem bio suave,GALLO,Emb. 0.75,"4,99€","6,65€ /",
Dentífrico Natural Extracts Brilho Intenso,COLGATE,Emb. 0.075 LT,"3,24€","43,20€ / LT",
Ice Tea Melância Hortelã,LIPTON,Emb. 2 LT,"2,49€","1,25€ / LT",
Pensos Higiénicos Cottonlike Normal Alas,EVAX,Emb. 1 P,"2,59€","2,59€ / P",
Papel Higiénico 2 Folhas Super,RENOVA,Emb. 48 ROLOS,"14,65€","0,31€ / ROLOS",
Gel Limão,FINISH,Emb. 1 LT,"8,99€","8,99€ / LT",
Legumes C/ Vitela desde os 6 Meses S/ Glúten,NESTLÉ,Emb. 0.19 KG,"1,39€","7,32€ / KG",
Chiclets de Morango 12 Unid.,CHICLETS,Emb. 0.017 KG,"0,99€","58,24€ / KG",
Gentil Lixívia para a Roupa a Cores e Delicada,NEOBLANC,Emb. 2 LT,"5,49€","2,75€ / LT",
WC Frescura Continua,NEO BLANC,Emb. 2 UNID.,"4,19€","2,10€ / UNID.",
DESODORIZANTE AXE AERO BLACK,AXE,Emb. 0.15 LT,"3,29€","21,93€ / LT",
Caldo de Carne Menos 30% Sal,KNORR,Emb. 0.08 KG,"1,49€","18,63€ / KG",
Iogurte Aroma Tutti-Frutti 4 Unid.,LONGA VIDA,Emb. 0.125 KG,"0,89€","7,12€ / KG",
Queijo Amanteigado Fatiado,PAIVA,Emb. 0.18 Kg,"2,19€","12,17€ / Kg",
Vinho Verde Branco,VIA LATINA,Garrafa 0.75 LT,"2,99€","3,99€ / LT",
Alimento Húmido P/ Gato Fórmula Indoor Atum e Vitela Pack 4,PURINA ONE,4 G,"3,49€","0,87€ / G",
Sabonete Liquido Leite e Azeitona,,Emb. 0.3 LT,"3,19€","10,63€ / LT",
Café Solúvel Clássico,NESCAFÉ,Emb. 0.2 KG,"6,14€","30,70€ / KG",
Rolo de Cozinha Extra XXL,RENOVA,Emb. 1 ROLO,"1,19€","1,19€ / ROLO",
Champô Cabelo Secos Garnier Maravilhoso,ULTRA SUAVE,Emb. 0.25 LT,"3,59€","14,36€ / LT",
Óleo Intense 6-80 Louro Avelã,SYOSS,,"6,24€",/ Unid.,
Desodorizante Roll On Açaí Waterlily,DOVE,Emb. 0.05 LT,"2,69€","53,80€ / LT",
Iogurte Morango e Banana 0% Açúcar 4 Unid.,IOGOLINO,Emb. 0.4 KG,"2,89€","7,23€ / KG",
Óleo de Duche Natural,NIVEA,Emb. 0.2 LT,"3,99€","19,95€ / LT",
Elixir Total Care Zero,LISTERINE,Emb. 0.5 LT,"6,49€","12,98€ / LT",
Alimento Seco P/ Cão Frango com Arroz <10kg,PURINA,Emb. 0.8 KG,"5,69€","7,11€ / KG",
Leite com Chocolate UHT 4x200 ml,GRESSO,Emb. 0.8 LT,"1,59€","1,99€ / LT",
Refrigerante C/ Gás Zero Açúcar,COCA COLA ZERO,Emb. 1 LT,"1,60€","1,60€ / LT",
Gel Elastic Ultimate 7,NIVEA MEN,Emb. 0.15 LT,"4,59€","30,60€ / LT",
Iogurte Líquido Frutos Tropicais 4 Unid.,YOGGI,Emb. 0.64 KG,"2,09€","3,27€ / KG",
Cápsulas de Café Alumínio Nespresso Clássico,SEGAFREDO,Emb. 10 UN,"4,29€","0,43€ / UN",
Azeite Pet,OLIVEIRA DA SERRA,Emb. 0.75 LT,"3,24€","4,32€ / LT",
Ambientador 5 em 1 Relax Zen,BRISE,Emb. 0.3 LT,"1,54€","5,13€ / LT",
Manteiga Tradicional,PRIMOR,Emb. 0.25 KG,"2,29€","9,16€ / KG",
OIKOS AMORA 110G X4,OIKOS,Emb. 0.44 KG,"2,39€","5,43€ / KG",
Farinha S/ Fermento T65,NACIONAL,Emb. 1 KG,"1,04€","1,04€ / KG",
Vinho Regional Douro Branco,ADEGA DE VILA REAL,Garrafa 0.75 LT,"3,29€","4,39€ / LT",
Salsicha Peru,NOBRE,Emb. 0.16 KG,"1,39€","8,69€ / KG",
Cerveja com Álcool,SUPER BOCK,Lata 0.33 LT,"0,59€","1,79€ / LT",
Leite Fresco Gordo,VIGOR,Emb. 1 LT,"1,15€","1,15€ / LT",
Dentífrico Max White Cool Mint,COLGATE,Emb. 0.075 LT,"5,49€","73,20€ / LT",
Donuts,,1 Unid. = 0.045 KG,"0,28€","6,22€ / KG",
AUSONIA ORG COTTON SUPER ABAS,AUSONIA,Emb. 10 UNID.,"2,54€","0,25€ / UNID.",
Cápsulas Café Au Lait Galão,DOLCE GUSTO,Emb. 16 CAPS.,"5,99€","0,37€ / CAPS.",
Desodorizante Roll-On Invisible Care,DOVE,Emb. 0.05 LT,"2,69€","53,80€ / LT",
Tomate em Pedaços Manjerição e Orégãos,GULOSO,Emb. 0.392 KG,"2,29€","5,84€ / KG",
Água Micelar Peles Sensíveis,BIOTEN,Emb. 0.1 LT,"1,97€","19,70€ / LT",
Gelado de Chocolate Pack 6,CORNETTO,Emb. 0.54 LT,"4,99€","9,24€ / LT",
Cuecas Incontinência Discreet L,AUSONIA,Emb. 7 UNID.,"7,99€","1,14€ / UNID.",
Camarão Cal. 30/40 Congelado,,1 Unid. = 0.238 KG (aprox.),"15,76€/kg","3,75€ / Unid.",
Alface Frisada,,1 Unid. = 0.4 KG (aprox.),"1,71€/kg","0,68€ / Unid.",
Champô Volume Toranja Branca e Menta,HERBAL ESSENCES,Emb. 0.4 LT,"3,99€","9,98€ / LT",
Bebida de Soja Baunilha 3x200ML,SHOYCE,Emb. 0.6 LT,"1,79€","2,98€ / LT",
DENIM DEO SPRAY ORIGINAL,DENIM,Emb. 0.15 LT,"2,39€","15,93€ / LT",
Gel de Banho Naturals Oliva e Leite,PALMOLIVE,Emb. 0.5 LT,"2,69€","5,38€ / LT",
"A+ COLOR LIQ 85D,,4.25L",A+,,"11,99€",/ Unid.,
Refrigerante sem Gás Ananás,FRUTIS,Emb. 1.5 LT,"1,15€","0,77€ / LT",
Licor Beirão,BEIRÃO,Garrafa 0.7 LT,"10,99€","15,70€ / LT",
Detergente Loiça Manual Original Ultra,FAIRY,Emb. 1.5 LT,"5,64€","3,76€ / LT",
FARINHA BRANCA NEVE SUPER FINA,BRANCA DE NEVE,Emb. 1 KG,"1,69€","1,69€ / KG",
Mad Chip Alho e Evas,CALVÉ,Emb. 0.26 KG,"2,69€","10,35€ / KG",
Tablete de Chocolate de Leite,NESTLÉ,Emb. 0.09 KG,"1,09€","12,11€ / KG",
Sabonete Líquido para as Mãos,DOVE,Emb. 0.25 LT,"2,39€","9,56€ / LT",
Ice tea de Manga 3x20 cl,LIPTON,Emb. 0.6 LT,"1,17€","1,95€ / LT",
Alimento Húmido P/ Gatinhos C/ Vitela,GOURMET,Emb. 0.085 KG,"0,75€","8,82€ / KG",
Óleo Cabelo Repara e Protege,PANTENE,Emb. 0.1 LT,"9,99€","99,90€ / LT",
Palitos de La Reine Mousse d´Or,DU BOIS DE LA ROCHE,Emb. 0.2 KG,"2,89€","14,45€ / KG",
"AZEITONA OXIDADA,FRC,210G QAMPO",,0.21 KG,"1,39€","6,62€ / KG",
Alimento Húmido Gato P/ Gold,GOURMET,Emb. 0.085 KG,"0,75€","8,82€ / KG",
Sumo de Laranja,JOI,Garrafa 1.5 LT,"1,04€","0,69€ / LT",
Pantene Cuidado Clássico Champô 3 Em 1,PANTENE PV,Emb. 0.3 LT,"4,99€","16,63€ / LT",
Lima,,1 Unid. = 0.08 KG (aprox.),"2,99€/kg","0,24€ / Unid.",
Vinagre Balsâmico Rosé,GALLO,Emb. 0.25 LT,"1,86€","7,44€ / LT",
Natas Cremosas Light,MIMOSA,Emb. 0.2 LT,"0,89€","4,45€ / LT",
Couve Coração,,1 Unid. = 0.84 KG (aprox.),"0,99€/kg","0,83€ / Unid.",
Óleo Intense 4-23 Cereja Profundo,SYOSS,,"6,24€",/ Unid.,
Bebida de Soja Original,SHOYCE,Emb. 1 LT,"1,69€","1,69€ / LT",
Gel de Duche Nutritivo,DOVE,Emb. 0.75 LT,"4,79€","6,39€ / LT",
"Alimento Húmido P/Cão Adulto C/ Gelatina de Boi, Frango e Cordeiro",,Emb. 0.4 KG,"2,59€","6,48€ / KG",
Sopa de Espargos,KNORR,Emb. 0.07 KG,"1,49€","21,29€ / KG",
Fraldas Incontinência Máxima G,LINDOR,Emb. 46 UNID.,"28,74€","0,62€ / UNID.",
Alimento P/ Cão Adulto De Salmão e Aveia,BEYOND,Emb. 1.4 KG,"6,34€","4,53€ / KG",
Máquinas de Barbear Descartáveis Blue II,GILLETTE,Emb. 10 UNID.,"5,99€","0,60€ / UNID.",
Queijo Curado 7 meses,SÃO JORGE,Emb. 0.4 KG,"5,99€","14,98€ / KG",
Douradinhos de Filete de Peixe 15 Unid. Ultracongelado,CAPITÃO IGLO,Emb. 0.42 KG,"5,69€","13,55€ / KG",
Conserva de Ervilhas da Horta,COMPAL,Emb. 0.42 KG,"0,99€","2,36€ / KG",
Bolachas Ovos Dinossauros,ARTIACH,Emb. 0.14 KG,"2,09€","14,93€ / KG",
Fios de Bacon,PRIMOR,Emb. 0.1,"2,08€","20,80€ /",
Champô Anti-Caspa Men Limpeza Profunda,LINIC,Emb. 0.36 LT,"4,94€","13,72€ / LT",
Neoblanc Densa+,NEOBLANC,Emb. 2 LT,"2,58€","1,29€ / LT",
BANZAI NOODLE CARIL CIGALA,CIGALA,Emb. 0.067 KG,"0,94€","14,03€ / KG",
Refrigerante sem Gás Limão,FRUTIS,Emb. 1.5 LT,"1,15€","0,77€ / LT",
Arroz Carolino,PATO REAL,Emb. 1 KG,"1,17€","1,17€ / KG",
Cápsulas Café Ristretto Barista Intensidade 9,DOLCE GUSTO,Emb. 16 CAPS.,"4,79€","0,30€ / CAPS.",
Escova de Dentes Max White,COLGATE,Emb. 1 UNID.,"4,39€","4,39€ / UNID.",
Leite Bem Essencial C/ Polpa de Morango 4 Unid.,MIMOSA,Emb. 0.8 LT,"1,99€","2,49€ / LT",
"OIKOS STRACCIATELLA 110G ,,440G",OIKOS,Emb. 0.44 KG,"2,39€","5,43€ / KG",
Cream Crackers,JACOB'S,Emb. 0.2 KG,"0,99€","4,95€ / KG",
Fatias Finas Peito de Peru,NOBRE,Emb. 0.11 KG,"2,14€","19,45€ / KG",
Fraldas Bebé Extra Absorção Activity Tamanho 5,DODOT,Emb. 48 LT,"13,29€","0,28€ / LT",
Bálsamo Aftershave active energy 2 em 1 shave,NIVEA,Emb. 0.1 LT,"8,99€","89,90€ / LT",
Whisky Bourbon Jack Daniels,JACK DANIEL'S,Garrafa 0.7 LT,"23,99€","34,27€ / LT",
Cera Signature,AXE,Emb. 0.075 LT,"3,99€","53,20€ / LT",
Barquette Morango,LULU,Emb. 0.12 KG,"1,99€","16,58€ / KG",
Tablete Chocolate Culinária,PANTAGRUEL,Emb. 0.2 KG,"1,79€","8,95€ / KG",
Cápsulas Leite Achocolatado Nesquik,DOLCE GUSTO,Emb. 16 CAPS.,"5,99€","0,37€ / CAPS.",
100% Cevada,PENSAL,Frasco 0.2 KG,"2,59€","12,95€ / KG",
Máscaras Liso Keratina,TRESEMMÉ,Emb. 0.3 LT,"5,39€","17,97€ / LT",
Licor Anis Escarchado,BORLIDO,Garrafa 1 LT,"8,49€","8,49€ / LT",
Alimento Seco P/ Cão Adulto Borrego,PURINA,Emb. 14 KG,"49,99€","3,57€ / KG",
Conserva de Salsichas Aves 5 Unid.,IZIDORO,Frasco 0.25 KG,"1,59€","6,36€ / KG",
Yofu de Soja e Manga sem Açúcar,ALPRO,Emb. 0.4 KG,"2,39€","5,98€ / KG",
Conserva de Feijão Branco Cozido Da Horta,COMPAL,Emb. 0.42 KG,"0,99€","2,36€ / KG",
Pensos Diários Slip Normal,AUSONIA,Emb. 40 UNID.,"1,49€","0,04€ / UNID.",
B&J Cookie Dough 465ml,,Emb. 0.465 LT,"6,79€","14,60€ / LT",
Bacalhau Especial Islândia,,1 Unid. = 3.5 KG (aprox.),"12,98€/kg","45,43€ / Unid.",
Bacalhau Graúdo Noruega Asa Preta,,1 Unid. = 2.5 KG,"12,99€/kg","32,48€ / Unid.",
Limpa Vidros Anti Embaciamento,AJAX,Spray 0.5 LT,"3,59€","7,18€ / LT",
FILETE ATUM EM ESCABECHE 120 GR,TENÓRIO,Emb. 0.12 KG,"2,29€","19,08€ / KG",
Bebida de Amêndoa 0%,SHOYCE,Emb. 1 LT,"2,19€","2,19€ / LT",
Cereais Granola de Aveia C/ Arandos e Sementes de Abóbora,FITNESS,Emb. 0.3 KG,"2,79€","9,30€ / KG",
Iogurte Líquido Danonino Bebedino Morango 4x100g,DANONE,Emb. 0.4 KG,"1,79€","4,48€ / KG",
Ambientador Recarga Spray Lavanda,GLADE,Emb. 2 UNID.,"7,18€","3,59€ / UNID.",
Cerveja com Álcool 6x20cl,CRISTAL,Emb. 1.2 LT,"2,29€","1,91€ / LT",
PensosHigiénicos Cottonlike Super Plus Alas,EVAX,Emb. 10   UNID.,"2,59€","0,26€ /   UNID.",
Azeite Maduras,OLIVEIRA DA SERRA,Emb. 0.75 LT,"6,19€","8,25€ / LT",
Café Ricoré,DOLCE GUSTO,Emb. 16 CAPS.,"5,99€","0,37€ / CAPS.",
Sumo de Laranja e Manga,JOI,Garrafa 1.5 LT,"1,04€","0,69€ / LT",
Molho Francesinha,GULOSO,Frasco 0.5 KG,"3,29€","6,58€ / KG",
Sabonete líquido para as mãos,DOVE,Emb. 0.5 LT,"2,49€","4,98€ / LT",
Recarga Ambientador Elétrica White Bouquet,AIR WICK,Emb. 0.019 LT,"3,59€","188,95€ / LT",
Vinho Regional Lisboa Branco,PROVA RÉGIA,Garrafa 0.75 LT,"3,99€","5,32€ / LT",
Pimenta Branca Moída,MARGÃO,Emb. 0.04 KG,"2,39€","59,75€ / KG",
Costeletas de Lombo Porco,,1 Unid. = 0.3 KG (aprox.),"4,19€/kg","1,26€ / Unid.",
Gel Sanitário Harpic Liquido Força do Oceano,,Emb. 0.75 LT,"1,94€","2,59€ / LT",
Vinho Regional Península de Setúbal Branco,FONTANARIO,Garrafa 0.75 LT,"2,69€","3,59€ / LT",
Vinho Regional Alentejano Tinto,SOVIBOR,Garrafa 0.75 LT,"2,99€","3,99€ / LT",
Champô Color Revitalizante,TRESEMMÉ,Emb. 0.9 LT,"6,59€","7,32€ / LT",
Chocolate de Leite,MILKA,Emb. 0.09 KG,"1,59€","17,67€ / KG",
Coloração 4-2 Castanho Avermelhado 16X3,SYOSS,,"4,99€",/ Unid.,
Champô Cabelo Anti-caspa Power,NIVEA MEN,Emb. 0.25 LT,"4,39€","17,56€ / LT",
Alecrim,MARGÃO,Emb. 0.015 KG,"0,99€","66,00€ / KG",
Cereais Corn Flakes Original,KELLOGG'S,Emb. 0.5 KG,"2,24€","4,48€ / KG",
Refrigerante C/ Gás  Zero Açúcar Vidro Pack 4,COCA COLA ZERO,Emb. 0.08 LT,"2,76€","34,50€ / LT",
Vinho Rosé Emotions,MATEUS,Garrafa 0.75 LT,"4,29€","5,72€ / LT",
Iogurte Líquido Framboesa Arandos 4x155g,DANONE,Emb. 0.62 KG,"1,69€","2,73€ / KG",
Tampões com Aplicador Pearl Super,TAMPAX,Emb. 24 UNID.,"4,99€","0,21€ / UNID.",
Chá Baunilha e Caramelo,LIPTON,Emb. 20 SAQ.,"1,74€","0,09€ / SAQ.",
Palmier Coberto,,1 UNID.,"0,80€","0,80€ / UNID.",
Detergente Manual Loiça Limão,SUPER POP,Emb. 0.7 LT,"1,49€","2,13€ / LT",
Nuggets de Frango 18 Unid.,CAPITÃO IGLO,Emb. 0.375 KG,"8,99€","23,97€ / KG",
Escova Dentes Extra Interdental Média,AQUAFRESH,Emb. 1 UNID.,"3,19€","3,19€ / UNID.",
"AGUA FASTIO,,2.5L",FASTIO,,"1,29€",/ Unid.,
Conserva de Salsichas Frankfurt 6 Unid.,IZIDORO,Lata 0.12 KG,"0,83€","6,92€ / KG",
Vinho do Porto Velhotes Tawny,CALEM,Garrafa 0.75 LT,"4,99€","6,65€ / LT",
Cápsulas Café Espresso Intenso Intensidade 13,DOLCE GUSTO,Emb. 48 CAPS.,"14,89€","0,31€ / CAPS.",
Alimento Completo Periquito,VITAKRAFT,Emb. 1 KG,"3,99€","3,99€ / KG",
Johnson's Gel de Banho para Bebé Cuidado Completo,JOHNSON'S BABY,Emb. 0.5 LT,"3,89€","7,78€ / LT",
Cápsulas Café Macchiato Caramelo P/ Dolce Gusto,STARBUCKS,Emb. 12 CAPS.,"5,49€","0,46€ / CAPS.",
Água Tónica Mist,NORDIC,Lata 0.25 LT,"0,75€","3,00€ / LT",
Whisky Fin Blen,WILLIAM LAWSON'S,Garrafa 0.7 LT,"14,79€","21,13€ / LT",
Chá Ervas Noite Tranquila,LIPTON,Emb. 0.03 KG,"1,94€","64,67€ / KG",
Esparguete Picante,MILANEZA,Emb. 0.5 KG,"2,69€","5,38€ / KG",
Leite Condensado Magro,NESTLÉ,Lata 0.387 KG,"1,49€","3,85€ / KG",
Caldo de Galinha,KNORR,Emb. 0.252 KG,"2,39€","9,48€ / KG",
Mini Snack de Chocolate de Leite,LION,Emb. 11 UNID.,"2,79€","0,25€ / UNID.",
Almôndegas,NOBRE,Emb. 0.42 KG,"2,74€","6,52€ / KG",
GELEIA MORANGO 345G,CASA MATEUS,Emb. 0.345 KG,"2,47€","7,16€ / KG",
Farinha P/ Bolos C/ Fermento,NACIONAL,Emb. 1 KG,"1,18€","1,18€ / KG",
Body Lotion Refirmante em 2 Semanas Q10,NIVEA,Emb. 0.25 LT,"4,99€","19,96€ / LT",
Arroz Carolino,LOURO,Emb. 1 KG,"1,09€","1,09€ / KG",
Ambientador Máquina Loiça Limão,FINISH,Emb. 2 UNID.,"4,99€","2,50€ / UNID.",
Molho de Nata Carne,MIMOSA,Emb. 0.2 LT,"0,98€","4,90€ / LT",
Condicionador Nourish & Replenish,TRESEMMÉ,Emb. 0.4 LT,"4,79€","11,98€ / LT",
Iogurte Líquido Tutti Frutti 6 Unid.,ACTIMEL,Emb. 0.6 KG,"2,59€","4,32€ / KG",
Bolachas Original,OREO,Emb. 0.154 KG,"1,39€","9,03€ / KG",
Maionese Vegan sem Glúten,CALVÉ,Emb. 0.27 KG,"3,29€","12,19€ / KG",
Refresco em Pó Laranja,TANG,Emb. 0.03 KG,"0,83€","27,67€ / KG",
Body Milk Nutritivo Pele Seca,NIVEA,Emb. 0.4 LT,"4,99€","12,48€ / LT",
Chá de Camomila,TETLEY,Emb. 10 UNID.,"0,84€","0,08€ / UNID.",
Gelado Super Maxi,OLÁ,Emb. 0.39 LT,"3,99€","10,23€ / LT",
Leite Bem Essencial C/ Chocolate UHT 4 Unid.,MIMOSA,Emb. 0.8 LT,"1,99€","2,49€ / LT",
Mini Tostas Redondas,BIMBO,Emb. 0.1 KG,"1,24€","12,40€ / KG",
Johnson\'s Loção para Crianças Bons Sonhos,JOHNSON'S BABY,Emb. 0.5 LT,"3,89€","7,78€ / LT",
Destop Gel Express Odor Stop 1Litro x15,DESTOP,Emb. 1 LT,"5,99€","5,99€ / LT",
Tónica Suave Pele Seca,NIVEA,Emb. 0.2 LT,"4,99€","24,95€ / LT",
Desodorizante Roll-On Biorythm 48H,REXONA,Emb. 0.05 LT,"2,39€","47,80€ / LT",
Leite de Crescimento 1+ Cereais,NESTLÉ,Emb. 1 LT,"2,49€","2,49€ / LT",
FAIRY LIMÃO 340ML,FAIRY,Emb. 0.34 LT,"1,28€","3,76€ / LT",
Creme de Cabra,PRÉSIDENT,Emb. 0.125 LT,"2,45€","19,60€ / LT",
Gelatina Light Melancia 4 Unid.,ROYAL,Emb. 0.4 KG,"2,19€","5,48€ / KG",
Bolacha Diet Nature Recheio Chocolate,GULLÓN,Emb. 0.25 KG,"2,34€","9,36€ / KG",
Gelado Coco Choco Parfait Les Dessertss,CARTE D'OR,Emb. 0.9 LT,"3,29€","3,66€ / LT",
Queijo Mini Babybel,BABYBEL,Emb. 0.12 KG,"1,94€","16,17€ / KG",
Toucinho Fumado,DAMATTA,Emb. 0.2 KG,"3,29€","16,45€ / KG",
Mateus Rosé,MATEUS,Garrafa 0.75 LT,"4,29€","5,72€ / LT",
Ananás dos Açores,,1 Unid. = 1.2 KG (aprox.),"5,99€/kg","7,19€ / Unid.",
Pensos Incontinência Discreet Maxi Night,AUSONIA,Emb. 16 UNID.,"7,99€","0,50€ / UNID.",
Lava Tudo Multisuperficies Lavanda,CIF,Emb. 1.4 LT,"1,99€","1,42€ / LT",
Creme Culinária Soja,SHOYCE,Emb. 0.2 L,"1,39€","6,95€ / L",
Vinho do Porto Ruby,FERREIRA,Garrafa 0.75 LT,"6,29€","8,39€ / LT",
Gel de Banho Laranja e Manga,VASELINE,Emb. 0.7 LT,"2,99€","4,27€ / LT",
Crocante de Frango Recheio Alho e Ervas,IGLO,Emb. 0.204 KG,"4,99€","24,46€ / KG",
Sopa Económica Rabo de Boi,KNORR,Emb. 0.06 KG,"1,09€","18,17€ / KG",
Ambientador Absorve Odores Marinho 2x150gr,BRISE,Emb. 0.3 KG,"2,99€","9,97€ / KG",
Air Wick Sticks Perfumados Flor de Cerejeira x5,AIRWICK,Emb. 0.025 LT,"7,19€","287,60€ / LT",
Toranja Cal. 2/3,,1 Unid. = 0.32 KG (aprox.),"1,69€/kg","0,54€ / Unid.",
Lenços Bolso 6+2 Unidades Red Label Pure,LENÇOS RENOVA,Emb. 8 UNID.,"1,89€","0,24€ / UNID.",
Leite Bem Essencial UHT Magro,MIMOSA,Emb. 1 LT,"0,95€","0,95€ / LT",
Barras de Cereais de Morango 6 Unid.,FITNESS,Emb. 0.141 KG,"2,29€","16,24€ / KG",
Iogurte Líquido S/ Lactose Morango Banana 4 Unid.,YOGGI,Emb. 0.64 KG,"2,19€","3,42€ / KG",
Vinho do Porto 10 Anos,FERREIRA,Garrafa 0.75 LT,"16,99€","22,65€ / LT",
Cereais de Mel,ESTRELITAS,Emb. 0.55 KG,"3,14€","5,71€ / KG",
Manga Aérea,,1 Unid. = 0.5 KG (aprox.),"1,99€/kg","1,00€ / Unid.",
Vinho Regional Alentejano Tinto,DOM MARTINHO,Garrafa 0.75 LT,"5,99€","7,99€ / LT",
Elixir Listerine Menta Suave,LISTERINE,Emb. 0.75 LT,"5,99€","7,99€ / LT",
Alimento Húmido P/ Gato Gold Salmão e Frango,GOURMET,Emb. 0.085 KG,"0,75€","8,82€ / KG",
"CHIPS AHOY! PEPITAS XL 18,184G",CHIPS AHOY,Emb. 0.184 KG,"2,59€","14,08€ / KG",
Licor,SHERIDAN'S,Garrafa 0.5 LT,"17,99€","35,98€ / LT",
Cereais Choco Flakes,CUÉTARA,Emb. 0.5 KG,"2,99€","5,98€ / KG",
Ambientador Aerossol  Essências Baunilha 6 em 1,AIR WICK,Spray 0.24 LT,"1,79€","7,46€ / LT",
Conserva de Feijão Frade da Horta,COMPAL,Lata 0.42 KG,"0,99€","2,36€ / KG",
Detergente para a Maquina da Roupa Active Fresh,SKIP,Emb. 1.458 KG,"14,99€","10,28€ / KG",
Alimento Seco P/ Cão Mini Menu Frango,PURINA FRISKIES,Emb. 1.5 KG,"4,84€","3,23€ / KG",
Creme para o Corpo Gordo para Pele Muito Seca,VASELINE,Emb. 0.25 LT,"4,99€","19,96€ / LT",
Tablete de Chocolate Bolacha,MILKA,Emb. 0.3 KG,"3,99€","13,30€ / KG",
Detergente Liquido para a Máquina da Roupa Concentrado,SKIP,Emb. 80 DOSES,"15,99€","0,20€ / DOSES",
Cevada Solúvel com Cereais,DELTA,Emb. 0.2 KG,"2,84€","14,20€ / KG",
Cereais de Trigo Integral,FITNESS,Emb. 0.375 KG,"2,69€","7,17€ / KG",
Recarga Freshmatic White Bouquet,AIR WICK,Spray 0.26 KG,"3,59€","13,81€ / KG",
Café Lote Clássico Grão,SICAL,Emb. 1 KG,"13,99€","13,99€ / KG",
Pantene Creme de Pentear Sem Enxaguar Caracóis 270ml,PANTENE PV,Emb. 0.27 LT,"4,49€","16,63€ / LT",
BATOM STAY INK CRAYON 105BL,MAYBELLINE,Emb. 1 UNID.,"9,49€","9,49€ / UNID.",
Cappuccino,NESCAFÉ,Emb. 0.25 KG,"6,39€","25,56€ / KG",
Flocos de Cereais com Fibras,KELLOGG'S,Emb. 0.375 KG,"2,59€","6,91€ / KG",
Anti-Mosquitos Elétrico Líquido 30 Noites,RAID,Emb. 0.021 LT,"4,49€","213,81€ / LT",
Iogurte Sólido Proteíco Coco Lindahls,NESTLÉ,Emb. 0.15 KG,"1,09€","7,27€ / KG",
Queijo Francês,CAPRICE DES DIEUX,Emb. 0.2 KG,"3,99€","19,95€ / KG",
"BEBIDA SOJA CHOCOLATE, 1L",ALPRO,Emb. 1 LT,"1,89€","1,89€ / LT",
Café Torrado em Grão Intensidade 12,BUONDI,Emb. 0.22 KG,"3,69€","16,77€ / KG",
Recarga Ambientador Freshmatic Oasis Turquesa,AIR WICK,Emb. 0.25 LT,"3,59€","14,36€ / LT",
Champô Anti-Caspa Cuidado Suave para Todos os Tipos de Cabelo,LINIC,Emb. 0.36 LT,"4,94€","13,72€ / LT",
Cerveja com Álcool 24x33cl,SAGRES,Emb. 7.92 LT,"18,29€","2,31€ / LT",
Vinho Branco Meio Seco,LEZÍRIA,Garrafa 0.75 LT,"1,59€","2,12€ / LT",
Detergente para a Máquina da Loiça,SUN,Emb. 1.575 KG,"12,34€","7,83€ / KG",
Johnson's Baby Óleo de Aloe Vera,JOHNSON'S BABY,Emb. 0.5 LT,"5,59€","11,18€ / LT",
GELATINA MARACUJÁ,GELLIMIX,Emb. 0.4 KG,"0,84€","2,10€ / KG",
Caldo de Carne,KNORR,Emb. 24 CUBOS,"2,39€","0,10€ / CUBOS",
Noodles Galinha,KNORR,Emb. 0.07 KG,"1,39€","19,86€ / KG",
