NAME,BRAND,QUANTITY,PRICE,PPU,OLDPRICE,OLDPPU,EAN
BECEL Creme Vegetal para Barrar 225 g,BECEL,,"2,99 €","13,29 €/Kg",,,
VAQUEIRO Margarina 250 g,VAQUEIRO,,"1,59 €","6,36 €/Kg",,,
PLANTA Margarina 225 g,PLANTA,,"1,79 €","7,96 €/Kg",,,
DIA LÁCTEA Iogurte Pedaços Morango 4x125 g,DIA CTEA,,"1,25 €","2,50 €/Kg",,,
DIA LÁCTEA Iogurte Aroma Morango 4x125 g,DIA CTEA,,"0,85 €","1,70 €/Kg",,,
DIA LÁCTEA Iogurte Pedaços Frutos Silvestres 4x125 g,DIA CTEA,,"1,25 €","2,50 €/Kg",,,
PRÉSIDENT Queijo Camembert 250 g,PR SIDENT,,"3,79 €","15,16 €/Kg",,,
SANTIAGO Queijo Serra Da Vila 190 g,SANTIAGO,,"3,79 €","19,95 €/Kg",,,
SANTIAGO Queijo Regional Saloio 190 g,SANTIAGO,,"3,79 €","19,95 €/Kg",,,
MOLICO Leite Em Pó Magro 380 g,MOLICO,,"5,75 €","15,13 €/Kg",,,
DIA Iogurte Pêssego e Maracujá 500 g,DIA,,"1,29 €","2,58 €/Kg",,,
DIA Iogurte Frutos Silvestres 500 g,DIA,,"1,29 €","2,58 €/Kg",,,
LIMIANO Queijo Flamengo Fatias 200 g,LIMIANO,,"2,69 €","13,45 €/Kg",,,
DIA LÁCTEA Iogurte Pedaços Cereais 4x125 g,DIA CTEA,,"1,25 €","2,50 €/Kg",,,
DIA LÁCTEA Iogurte Aroma Coco 4x125 g,DIA CTEA,,"0,85 €","1,70 €/Kg",,,
ACTIMEL Iogurte Líquido Natural 6x100 g,ACTIMEL,,"3,29 €","5,48 €/Kg",,,
DIA LÁCTEA Iogurte Líquido Aroma Banana 160 g,DIA CTEA,,"0,36 €","0,36 €/ud",,,
DIA LÁCTEA Iogurte Líquido Pêssego e Manga 4x160 g,DIA CTEA,,"1,55 €","2,42 €/Kg",,,
DIA LÁCTEA Iogurte Líquido Magro Polpa Manga 4x160 g,DIA CTEA,,"1,75 €","0,44 €/ud",,,
DIA Ovos Classe M 12 Un,DIA,,"2,59 €","2,59 €/ud",,,
ACTIMEL Tutti Frutti 6x100 g,ACTIMEL,,"3,29 €","5,48 €/Kg",,,
DIA LÁCTEA Iogurte Aroma Tutti Frutti 4x125 g,DIA CTEA,,"0,85 €","1,70 €/Kg",,,
DIA LÁCTEA Iogurte Líquido Magro Polpa Morango 4x160 g,DIA CTEA,,"1,75 €","0,44 €/ud",,,
DIA LÁCTEA Natas UHT Para Cozinhar 500 ml,DIA CTEA UHT,,"1,95 €","3,90 €/l",,,
ROYAL Gelatina de Morango 4x100 g,ROYAL,,"1,99 €","4,98 €/Kg",,,
DIA LÁCTEA Iogurte Líquido Polpa Morango 4x160 g,DIA CTEA,,"1,55 €","0,39 €/ud",,,
DIA LÁCTEA Manteiga Magra 250 g,DIA CTEA,,"1,99 €","7,96 €/Kg",,,
DIA Iogurte com Pedaços Ananás 200 g,DIA,,"0,69 €","3,45 €/Kg",,,
DIA Iogurte com Pedaços Avelã 200 g,DIA,,"0,69 €","3,45 €/Kg",,,
DIA Iogurte com Pedaços Morango 200 g,DIA,,"0,69 €","3,45 €/Kg",,,
A VACA QUE RI Queijo Fundido Porções Light (8 unidades) 140 g,VACA QUE RI,,"2,23 €","15,93 €/Kg",,,
"DIA LÁCTEA Queijo Fresco 0% 4x62,5 g",DIA CTEA,,"2,45 €","9,80 €/Kg",,,
BABYBEL Queijo Mini Light Rede 6 unidades 120 g,BABYBEL,,"2,04 €","17,00 €/Kg",,,
DIA Iogurte Stracciatella 500 g,DIA,,"1,29 €","2,58 €/Kg",,,
ROYAL Gelatina de Morango Light 10 Kcal 4x100 g,ROYAL,,"2,19 €","5,48 €/Kg",,,
ACTIVIA Iogurte Líquido Magro Morango e Kiwi 4x155 g,ACTIVIA,,"3,39 €","5,47 €/Kg",,,
DIA Iogurte Líquido Magro Ananás 4x160 g,DIA,,"1,75 €","0,44 €/ud",,,
DIA LÁCTEA Iogurte Líquido 0% de Morango E Kiwi 160 g,DIA CTEA,,"0,40 €","2,50 €/Kg",,,
DIA LÁCTEA Iogurte Líquido Polpa Morango e Banana 4x160 g,DIA CTEA,,"1,55 €","0,39 €/ud",,,
AGROS Queijo Flamengo 350 g,AGROS,,"3,99 €","11,40 €/Kg",,,
DIA LÁCTEA Queijo Mozzarella Fresca 125 g,DIA CTEA,,"1,19 €","9,52 €/Kg",,,
DIA FIDIAS Iogurte Grego Natural Compota de Morango 4x125 g,DIA FIDIAS,,"1,49 €","2,98 €/Kg",,,
QUINTA DA AÇAFA Queijo de Ovelha Curado 1 un,QUINTA DA AFA,,"4,15 €","4,15 €/ud",,,
CAMPAINHA Queijo Fresco Magro 200 g,CAMPAINHA,,"1,19 €","5,95 €/Kg",,,
CAMPAINHA Queijo Fresco Meio Gordo 200 g,CAMPAINHA,,"1,19 €","5,95 €/Kg",,,
YOCO Iogurte Líquido com Palhinhas Morango 6x90 g,YOCO,,"3,18 €","5,89 €/Kg",,,
GALBANI Queijo Mozzarella Fresca 125 g,GALBANI,,"1,85 €","14,80 €/Kg",,,
PLANTA Creme Para Barrar com Sabor a Manteiga  225 g,PLANTA,,"1,79 €","7,96 €/Kg",,,
CHOCAPIC Iogurte Bicompartimentado Nestlé 2x118 g,CHOCAPIC,,"2,54 €","10,76 €/Kg",,,
NESQUIK Iogurte Bicompartimentado Nestlé 2x116 g,NESQUIK,,"2,54 €","10,95 €/Kg",,,
DIA BIFIDUS Iogurte Líquido Bifidus Morango e Kiwi 160 g,DIA BIFIDUS,,"0,45 €","0,45 €/ud",,,
MIMOSA Leite Com Polpa de Morango 4x200 ml,MIMOSA,,"1,99 €","2,49 €/l",,,
LACTAÇORES Queijo DOP S. Jorge 7 Meses 400 g,LACTA ORES DOP,,"7,29 €","18,23 €/Kg",,,
DIA O CHOCALHO Queijo Em Fatias Light Flamengo 200 g,DIA CHOCALHO,,"2,12 €","10,60 €/Kg",,,
DIA O CHOCALHO Queijo Em Fatias Flamengo 200 g,DIA CHOCALHO,,"1,99 €","9,95 €/Kg",,,
MIMOSA Iogurte Líquido Aroma Morango Super Poupança 6x156 ml,MIMOSA,,"2,09 €","2,31 €/l",,,
CORPOS DANONE Iogurte Líquido Magro de Morango 4x155 g,CORPOS DANONE,,"1,69 €","2,73 €/Kg",,,
NOVA AÇORES Manteiga dos Açores 250 g,NOVA ORES,,"2,59 €","10,36 €/Kg",,,
OIKOS Iogurte Grego Maracujá 4x110 g,OIKOS,,"2,99 €","6,80 €/Kg",,,
NOVA AÇORES Queijo da Ilha Fatiado 150 g,NOVA ORES,,"2,25 €","15,00 €/Kg",,,
DAN'UP Iogurte Líquido de Stracciatella 4x155 g,DAN UP,,"2,99 €","4,82 €/Kg",,,
DIA Queijo Da Ilha 400 g,DIA,,"3,79 €","9,48 €/Kg",,,
SANTIAGO Queijo Fresco Meio Gordo 80 g,SANTIAGO,,"0,79 €","9,88 €/Kg",,,
SANTIAGO Queijo Fresco Magro 80 g,SANTIAGO,,"0,79 €","9,88 €/Kg",,,
DIA DONA MARGARIDA Margarina Culinária 250 g,DIA DONA MARGARIDA,,"0,95 €","3,80 €/Kg",,,
ACTIVIA Iogurte Bifidus Líquido Kiwi 4x155 g,ACTIVIA,,"3,39 €","5,47 €/Kg",,,
DIA FIDIAS Iogurte Grego Stracciatella 4x125 g,DIA FIDIAS,,"1,49 €","2,98 €/Kg",,,
DIA FIDIAS Iogurte Grego Maracujá 4x125 g,DIA FIDIAS,,"1,49 €","2,98 €/Kg",,,
DANONE Iogurte Líquido de Tutti-Frutti 4x155 g,DANONE,,"1,29 €","2,08 €/Kg",,,
ROYAL Gelatina de Ananás Light 10 Kcal 4x100 g,ROYAL,,"2,19 €","5,48 €/Kg",,,
AYAM Leite de Coco 200 ml,AYAM,,"1,69 €","8,45 €/l",,,
DIA SONHOS Gelatina de Morango Light 8Kcal 6x100 g,DIA SONHOS,,"1,49 €","2,48 €/Kg",,,
ACTIVIA Iogurte Cremoso Frutos Silvestres 4x120 g,ACTIVIA,,"1,89 €","3,94 €/Kg",,,
ACTIVIA Iogurte Sólido Cereais 4x115 g,ACTIVIA,,"2,09 €","4,54 €/Kg",,,
UCAL Leite C/Chocolate Light 6x250 ml,UCAL,,"5,76 €","3,84 €/l",,,
ACTIVIA Iogurte Sólido Cremoso 0% Cocktail de Frutas 4x120 g,ACTIVIA,,"2,49 €","5,19 €/Kg",,,
PRÉSIDENT Natas Frescas com 30% de Matéria Gorda 200 ml,PR SIDENT,,"1,79 €","8,95 €/l",,,
MIMOSA Iogurte Líquido Magro Morango Super Poupança 6x156 ml,MIMOSA,,"2,69 €","2,97 €/l",,,
MIMOSA Iogurte Líquido Magro Frutos Tropicais Super Poupança 6x156 ml,MIMOSA,,"2,69 €","2,97 €/l",,,
SHOYCE Bebida de Arroz 0% 1 L,SHOYCE,,"1,43 €","1,43 €/l","1,79 €","1,79 €/l",
YOGGI Iogurte Sem Lactose Morango 4x160 g,YOGGI,,"3,22 €","5,03 €/Kg",,,
YOGGI Iogurte Sem Lactose Morango & Banana 4x160 g,YOGGI,,"3,22 €","5,03 €/Kg",,,
VIGOR Leite Pasteurizado Meio Gordo 0% de Lactose 1 L,VIGOR,,"1,18 €","1,18 €/l",,,
BECEL Margarina Sabor A Manteiga 400 g,BECEL,,"5,29 €","13,23 €/Kg",,,
YOGGI Iogurte Líquido de Morango 8x160 g,YOGGI,,"3,94 €","3,08 €/Kg",,,
BECEL Pro Active Sabor Manteiga 225 g,BECEL,,"2,39 €","10,62 €/Kg","3,99 €","17,73 €/Kg",
YOGGI Iogurte Líquido Aroma Frutos Silvestres 4x160 g,YOGGI,,"3,19 €","4,98 €/Kg",,,
YOGGI Iogurte Líquido Aroma Frutos Tropicais 4x160 g,YOGGI,,"3,19 €","4,98 €/Kg",,,
SANTIAGO Queijo Quinta do Olival Barrado 450 g,SANTIAGO,,"8,49 €","8,49 €/ud",,,
SERRAS DE PENELA Queijo de Vaca E Ovelha Pequeno 1 Un,SERRAS DE PENELA,,"2,99 €","2,99 €/ud",,,
SERRAS DE PENELA Queijo de Vaca E Ovelha Grande 1 Un,SERRAS DE PENELA,,"4,49 €","4,49 €/ud",,,
FLORA Margarina 400 g,FLORA,,"3,49 €","8,73 €/Kg",,,
ACTIVIA Iogurte Líquido Frutos Silvestres 4x155 g,ACTIVIA,,"3,39 €","5,47 €/Kg",,,
A VACA QUE RI Queijo Fundido Palitos Light 4x35 g,VACA QUE RI,,"2,39 €","17,07 €/Kg",,,
CASTELÕES Queijo Prato Light 1 Un,CASTEL ES,,"7,24 €","7,24 €/ud",,,
DANET Sobremesa Baunilha 4x125 g,DANET,,"2,99 €","5,98 €/Kg",,,
PAIVA Queijo Curado Meio Gordo 1 Un,PAIVA,,"7,55 €","7,55 €/ud",,,
LACTAÇORES Queijo DOP S. Jorge 12 Meses 300 g,LACTA ORES DOP,,"7,39 €","24,63 €/Kg",,,
DANET Sobremesa Caramelo 4x125 g,DANET,,"2,99 €","5,98 €/Kg",,,
NOVA AÇORES Leite UHT Meio Gordo 1 L,NOVA ORES UHT,,"1,14 €","1,14 €/l",,,
CASTELÕES Queijo Prato 1 Un,CASTEL ES,,"7,24 €","7,24 €/ud",,,
SHOYCE Bebida de Arroz 0% 200 ml,SHOYCE,,"0,48 €","2,40 €/l","0,60 €","3,00 €/l",
DIA VITAL Bebida de Arroz 1 L,DIA VITAL,,"1,53 €","1,53 €/l",,,
KOLIÓS Queijo Feta DOP 200 g,KOLI DOP,,"2,59 €","12,95 €/Kg",,,
CAMPAINHA Queijo Ralado Flamengo 150 g,CAMPAINHA,,"1,69 €","11,27 €/Kg",,,
ACTIMEL Morango 6x100 g,ACTIMEL,,"3,29 €","5,48 €/Kg",,,
FALLINI Queijo Ralado em Pó com Doseador 80 g,FALLINI,,"1,95 €","24,38 €/Kg",,,
PAIVA Queijo Prato Apimentado 1 Un,PAIVA,,"7,55 €","7,55 €/ud",,,
A VACA QUE RI Queijo Fundido Porções (16 unidades) 280 g,VACA QUE RI,,"3,29 €","0,21 €/ud",,,
A VACA QUE RI Queijo Fundido Porções Light (16 unidades) 280 g,VACA QUE RI,,"3,39 €","12,11 €/Kg",,,
OIKOS Iogurte Pêssego 4x110 g,OIKOS,,"2,99 €","6,80 €/Kg",,,
MIMOSA Molho de Natas Para Carne 200 ml,MIMOSA,,"0,98 €","4,90 €/l","1,09 €","5,45 €/l",
"DIA LÁCTEA Queijo Fresco sem Lactose 4x62,5 g",DIA CTEA,,"2,09 €","8,36 €/Kg",,,
MILHAFRE Leite UHT Pastagem Meio Gordo 1 L,MILHAFRE UHT,,"0,99 €","0,99 €/l",,,
OIKOS Iogurte Cheesecake de Mirtilo 4x110 g,OIKOS,,"2,99 €","6,80 €/Kg",,,
DANET Sobremesa de Chocolate Duplo Prazer 4x100 g,DANET,,"2,99 €","7,48 €/Kg",,,
ACTIVIA Iogurte Líquido Magro Lima Limão 4x155 g,ACTIVIA,,"3,39 €","5,47 €/Kg",,,
YOPRO Iogurte Líquido Morango e Framboesa 300 g,YOPRO,,"1,79 €","5,97 €/Kg",,,
DIA LÁCTEA Iogurte Líquido Natural açúcarado 1 kg,DIA CTEA,,"1,65 €","1,65 €/Kg",,,
DIA LÁCTEA Iogurte Liquido Morango E Banana 1 kg,DIA CTEA,,"1,65 €","1,65 €/Kg",,,
PRÉSIDENT Chantilly 250 g,PR SIDENT,,"2,89 €","11,56 €/Kg",,,
GO CHILL Cappuccino 230 ml,GO CHILL,,"1,59 €","6,91 €/l",,,
PRÉSIDENT Creme de Queijo Brie 125 g,PR SIDENT,,"2,45 €","19,60 €/Kg",,,
REINA Iogurte Grego Natural 500 g,REINA,,"2,29 €","4,58 €/Kg",,,
TERRA NOSTRA Manteiga Sem Sal 250 g,TERRA NOSTRA,,"2,35 €","9,40 €/Kg",,,
MILHAFRE Queijo Ilha Graciosa 280 g,MILHAFRE,,"4,49 €","16,04 €/Kg",,,
MILHAFRE Leite de Pastagem Meio Gordo Bio 1 L,MILHAFRE,,"1,29 €","1,29 €/l",,,
AGROS Queijo Flamengo Fatias 200 g,AGROS,,"2,29 €","11,45 €/Kg",,,
MIMOSA Iogurte Polpa Banana e Morango 4x120 g,MIMOSA,,"1,99 €","4,33 €/Kg",,,
"MIMOSA Iogurte Polpa Banana, Laranja e Bolacha 4x120 g",MIMOSA,,"1,99 €","4,15 €/Kg",,,
GO CHILL Caffe Late 230 ml,GO CHILL,,"1,59 €","6,91 €/l",,,
DIA Ovos Classe XL 6 Un,DIA XL,,"2,19 €","2,19 €/ud",,,
PALHAIS Queijo Cremoso de Cabra para Barrar 125 g,PALHAIS,,"1,59 €","1,59 €/ud",,,
SANTIAGO Queijo Cremoso de Mistura para Barrar 125 g,SANTIAGO,,"1,59 €","1,59 €/ud",,,
SANTIAGO Queijo Cremoso de Vaca para Barrar 125 g,SANTIAGO,,"1,59 €","1,59 €/ud",,,
CAMPAINHA Queijo Fatiado Cheddar 150 g,CAMPAINHA,,"2,29 €","15,27 €/Kg",,,
SANTIAGO Queijo Três Igrejas 450 g,SANTIAGO,,"7,99 €","17,76 €/Kg",,,
DIA LÁCTEA Leite UHT Meio Gordo 1 L,DIA CTEA UHT,,"0,83 €","0,83 €/l",,,
DIA LÁCTEA Leite Magro 1 L,DIA CTEA,,"0,83 €","0,83 €/l",,,
DIA LÁCTEA Leite UHT Gordo 1 L,DIA CTEA UHT,,"1,04 €","1,04 €/l",,,
DIA LÁCTEA Iogurte Líquido Aroma Frutos Tropicais 160 g,DIA CTEA,,"0,36 €","0,36 €/ud",,,
DIA Queijo Fundido 250 g,DIA,,"1,83 €","7,32 €/Kg",,,
DIA VITAL Bebida de Soja Natural 1 L,DIA VITAL,,"1,02 €","1,02 €/l",,,
O PRÉMIO DO DIA Sobremesa Flan de Ovo 4x100 g,PR MIO DO DIA,,"1,75 €","4,38 €/Kg",,,
PLANTA Margarina 400 g,PLANTA,,"3,49 €","8,73 €/Kg",,,
MIMOSA Manteiga Com Sal 250 g,MIMOSA,,"2,34 €","9,36 €/Kg",,,
MIMOSA Natas UHT 200 ml,MIMOSA UHT,,"0,99 €","4,95 €/l",,,
PHILADELPHIA Queijo Fresco Para Barrar Com Ervas 150 g,PHILADELPHIA,,"2,19 €","14,60 €/Kg",,,
DIA Iogurte Magro Com Pedaços Multifruta 8x125 g,DIA,,"2,65 €","2,65 €/Kg",,,
PRÉSIDENT Queijo Creme Camembert 125 g,PR SIDENT,,"2,45 €","19,60 €/Kg",,,
MIMOSA Leite Magro 1 L,MIMOSA,,"0,89 €","0,89 €/l",,,
MIMOSA Leite UHT Meio Gordo 1 L,MIMOSA UHT,,"0,89 €","0,89 €/l",,,
MIMOSA Leite UHT Gordo 1 L,MIMOSA UHT,,"1,19 €","1,19 €/l",,,
"DIA LÁCTEA Iogurte Pedaços de Morango, Framboesa E Pêssego 8x125 g",DIA CTEA,,"2,25 €","2,25 €/Kg",,,
MATINAL Leite UHT Meio Gordo 1 L,MATINAL UHT,,"1,09 €","1,09 €/l",,,
PALHAIS Queijo de Cabra Original 2x100 g,PALHAIS,,"4,39 €","21,95 €/Kg",,,
DIA Ovos Classe L 6 Un,DIA,,"1,49 €","1,49 €/ud",,,
MIMOSA Leite UHT Meio Gordo Com Cálcio 200 ml,MIMOSA UHT,,"0,50 €","2,50 €/l",,,
MIMOSA Leite Magro Com Cálcio 1 L,MIMOSA,,"0,98 €","0,98 €/l",,,
MIMOSA Leite UHT Meio Gordo Com Cálcio 1 L,MIMOSA UHT,,"0,98 €","0,98 €/l",,,
DIA LÁCTEA Leite Com Chocolate 3x200 ml,DIA CTEA,,"0,99 €","1,65 €/l",,,
TERRA NOSTRA Queijo Flamengo Fatias 200 g,TERRA NOSTRA,,"2,69 €","13,45 €/Kg",,,
DIA LÁCTEA Queijo Fresco 2x250 g,DIA CTEA,,"2,69 €","5,38 €/Kg",,,
DIA LÁCTEA Iogurte Líquido Aroma Morango 160 g,DIA CTEA,,"0,36 €","0,36 €/ud",,,
AGROS Leite Meio Gordo 1 L,AGROS,,"0,96 €","0,96 €/l",,,
LAGOS Queijo de Ovelha Amanteigado de Seia 1 Un,LAGOS,,"8,99 €","8,99 €/ud",,,
UCAL Leite Com Chocolate 250 ml,UCAL,,"0,96 €","3,84 €/l",,,
MATINAL Manteiga Magra 250 g,MATINAL,,"2,24 €","8,96 €/Kg",,,
MILHAFRE Manteiga Dos Açores 250 g,MILHAFRE,,"2,34 €","9,36 €/Kg",,,
AGROS Leite Com Chocolate 200 ml,AGROS,,"0,36 €","1,80 €/l",,,
DANACOL Frutos Exóticos 6x100 g,DANACOL,,"3,99 €","6,65 €/Kg",,,
LIMIANO Queijo Flamengo Bola 600 g,LIMIANO,,"6,79 €","6,79 €/ud",,,
GRESSO Leite UHT Meio Gordo 1 L,GRESSO UHT,,"0,89 €","0,89 €/l",,,
BECEL Margarina 400 g,BECEL,,"5,29 €","13,23 €/Kg",,,
PALHAIS Queijo de Cabra Chèvre 180 g,PALHAIS,,"3,99 €","22,17 €/Kg",,,
DAN'UP Iogurte Líquido de Morango 4x155 g,DAN UP,,"2,99 €","4,82 €/Kg",,,
O PRÉMIO DO DIA Mousse de Chocolate 4x60 g,PR MIO DO DIA,,"1,05 €","4,38 €/Kg",,,
PARMALAT Natas UHT Para Bater 200 ml,PARMALAT UHT,,"1,12 €","5,60 €/l",,,
PARMALAT Natas Para Culinária 200 ml,PARMALAT,,"1,12 €","5,60 €/l",,,
DIA DONA MARGARIDA Margarina Girassol 500 g,DIA DONA MARGARIDA,,"2,55 €","5,10 €/Kg",,,
BABYBEL Queijo Mini Rede 6 unidades 120 g,BABYBEL,,"2,12 €","17,67 €/Kg",,,
DIA BIFIDUS Iogurte Líquido Bifidus Cereais 4x160 g,DIA BIFIDUS,,"1,65 €","0,41 €/ud",,,
PRÉSIDENT Queijo Roquefort 100 g,PR SIDENT,,"3,35 €","33,50 €/Kg",,,
LIMIANO Queijo Amanteigado Vaca E Ovelha 450 g,LIMIANO,,"6,19 €","13,76 €/Kg",,,
TERRA NOSTRA Queijo Flamengo Fatias Light 200 g,TERRA NOSTRA,,"2,79 €","13,95 €/Kg",,,
PRÉSIDENT Manteiga Magra 250 g,PR SIDENT,,"2,55 €","10,20 €/Kg",,,
O PRÉMIO DO DIA Arroz Doce 4x130 g,PR MIO DO DIA,,"2,59 €","4,98 €/Kg",,,
MIMOSA Leite UHT Meio Gordo 3x200 ml,MIMOSA UHT,,"1,19 €","1,98 €/l",,,
TERRA NOSTRA Queijo Flamengo Fatias 2x200 g,TERRA NOSTRA,,"5,09 €","12,73 €/Kg",,,
LIMIANO Queijo Flamengo Fatias Light 2x200 g,LIMIANO,,"5,19 €","12,98 €/Kg",,,
LIMIANO Queijo Flamengo Fatias 2x200 g,LIMIANO,,"5,09 €","12,73 €/Kg",,,
DIA O CHOCALHO Queijo Flamengo Fatias 450 g,DIA CHOCALHO,,"3,99 €","8,87 €/Kg",,,
DIA LÁCTEA Natas Uht Para Cozinhar 3x200 ml,DIA CTEA,,"2,45 €","4,08 €/l",,,
"DANONE Iogurte Aroma Morango, Banana E Tutti-Frutti 8x120 g",DANONE,,"1,99 €","2,07 €/Kg",,,
VAQUEIRO Margarina Líquida 500 ml,VAQUEIRO,,"3,49 €","6,98 €/l",,,
LAGOS Requeijão de Ovelha 150 g,LAGOS,,"1,49 €","9,93 €/Kg",,,
PRÉSIDENT Queijo Brie 200 g,PR SIDENT,,"3,79 €","18,95 €/Kg",,,
DIA LÁCTEA Iogurte Líquido Morango E Banana 160 g,DIA CTEA,,"0,36 €","0,36 €/ud",,,
ACTIVIA Iogurte Magro Frutos Silvestres 4x155 g,ACTIVIA,,"3,39 €","5,47 €/Kg",,,
VIGOR Leite Pasteurizado Magro 1 L,VIGOR,,"0,98 €","0,98 €/l",,,
VIGOR Leite Pasteurizado Meio Gordo 1 L,VIGOR,,"0,98 €","0,98 €/l",,,
DIA Iogurte Líquido Magro Aroma Morango 160 g,DIA,,"0,40 €","0,40 €/ud",,,
OIKOS Iogurte Grego Stracciatella 4x110 g,OIKOS,,"2,99 €","6,80 €/Kg",,,
A VACA QUE RI Queijo Fundido Palitos 35 g,VACA QUE RI,,"0,79 €","22,57 €/Kg",,,
TERRA NOSTRA Manteiga 250 g,TERRA NOSTRA,,"2,35 €","9,40 €/Kg",,,
ACTIVIA Iogurte Bifidus Líquido Morango 4x155 g,ACTIVIA,,"3,39 €","5,47 €/Kg",,,
PHILADELPHIA Queijo Fresco Barrar Regular 150 g,PHILADELPHIA,,"1,99 €","13,27 €/Kg",,,
PHILADELPHIA Queijo Fresco Barrar Light 150 g,PHILADELPHIA,,"1,99 €","13,27 €/Kg",,,
FLORA Margarina 225 g,FLORA,,"1,99 €","8,84 €/Kg",,,
DANONINO Petitdino Morango 6x50 g,DANONINO,,"2,39 €","7,97 €/Kg",,,
DANONINO Petitdino Morango/Banana 6x50 g,DANONINO,,"2,39 €","7,97 €/Kg",,,
CORPOS DANONE Iogurte Líquido Magro Morango/Framboesa 4x155 g,CORPOS DANONE,,"1,69 €","2,73 €/Kg",,,
PLANTA Creme Para Barrar Com Sabor a Manteiga 400 g,PLANTA,,"3,49 €","8,73 €/Kg",,,
MIMOSA Leite Meio Gordo Sem Lactose 1 L,MIMOSA,,"1,09 €","1,09 €/l",,,
CORPOS DANONE Iogurte Líquido Magro de Pinacolada 4x155 g,CORPOS DANONE,,"1,69 €","2,73 €/Kg",,,
UCAL Galão 3x200 ml,UCAL,,"2,29 €","3,82 €/l",,,
DIA SONHOS Gelatina de Morango 6x100 g,DIA SONHOS,,"1,39 €","2,32 €/Kg",,,
GRESSO Leite Com Chocolate 200 ml,GRESSO,,"0,40 €","2,00 €/l",,,
MIMOSA Leite Magro Sem Lactose 1 L,MIMOSA,,"1,09 €","1,09 €/l",,,
CAMPAINHA Queijo Ralado Mozzarella 150 g,CAMPAINHA,,"1,99 €","13,27 €/Kg",,,
ACTIVIA Iogurte Sólido Frutos Secos E Cereais 4x120 g,ACTIVIA,,"2,09 €","4,35 €/Kg",,,
OIKOS Iogurte Grego Natural Açucarado 4x110 g,OIKOS,,"2,99 €","6,80 €/Kg",,,
O PRÉMIO DO DIA Sobremesa Serradura 2x85 g,PR MIO DO DIA,,"1,99 €","11,71 €/Kg",,,
OIKOS Iogurte Grego Caramelo 4x110 g,OIKOS,,"2,99 €","6,80 €/Kg",,,
OIKOS Iogurte Grego Manga Papaia 4x110 g,OIKOS,,"2,99 €","6,80 €/Kg",,,
ACTIVIA Iogurte Sólido Aveia E Nozes 4x115 g,ACTIVIA,,"2,79 €","6,07 €/Kg",,,
DIA SELEÇÃO MUNDIAL Queijo Brie 200 g,DIA SELE MUNDIAL,,"1,59 €","7,95 €/Kg",,,
MATINAL Leite Magro 1 L,MATINAL,,"1,09 €","1,09 €/l",,,
DIA SR. BEM BOM Salame de Chocolate 450 g,DIA SR BEM BOM,,"3,19 €","7,09 €/Kg",,,
DIA Ovos Classe M 6 Un,DIA,,"1,35 €","1,35 €/ud",,,
DIA Manteiga Dos Açores 250 g,DIA,,"2,09 €","8,36 €/Kg",,,
DIA Ovos Galinha Campo 6 Un,DIA,,"1,55 €","1,55 €/ud",,,
DIA Flan de Baunilha 6x100 g,DIA,,"1,19 €","1,98 €/Kg",,,
PARMALAT Natas Culinária Com Cogumelos 200 ml,PARMALAT,,"1,27 €","6,35 €/l",,,
DIA O CHOCALHO Queijo Mistura Amanteigado 1 Un,DIA CHOCALHO,,"5,29 €","5,29 €/ud",,,
MIMOSA Natas UHT Para Culinária 200 ml,MIMOSA UHT,,"0,99 €","4,95 €/l",,,
DANONE Iogurte Líquido Morango 4x155 g,DANONE,,"1,29 €","2,08 €/Kg",,,
DANONE Iogurte Líquido Morango/Banana 4x155 g,DANONE,,"1,29 €","2,08 €/Kg",,,
DIA LÁCTEA Queijo Fresco Normal 4x62 g,DIA CTEA,,"2,05 €","8,20 €/Kg",,,
MIMOSA Leite Com Chocolate Bem Essencial 200 ml,MIMOSA,,"0,50 €","2,50 €/l",,,
OIKOS Iogurte Grego Morango 4x110 g,OIKOS,,"2,99 €","6,80 €/Kg",,,
OIKOS Iogurte Grego Natural 4x110 g,OIKOS,,"2,99 €","6,80 €/Kg",,,
DIA VITAL Bebida de Soja Natural 3x200 ml,DIA VITAL,,"1,02 €","1,70 €/l",,,
DANONE Iogurte Natural 4x120 g,DANONE,,"1,48 €","3,08 €/Kg",,,
CASTELÕES Queijo em Fatias 200 g,CASTEL ES,,"2,49 €","12,45 €/Kg",,,
DIA VITAL Bebida de Soja Light 1 L,DIA VITAL,,"1,12 €","1,12 €/l",,,
DIA LÁCTEA Leite Meio Gordo Sem Lactose 1 L,DIA CTEA,,"1,07 €","1,07 €/l",,,
SMARTIES Iogurtes Bicompartimentados Nestlé 2x130 g,SMARTIES,,"2,54 €","9,77 €/Kg",,,
DIA FIDIAS Iogurte Grego Natural Açúcarado 4x125 g,DIA FIDIAS,,"1,49 €","2,98 €/Kg",,,
CORPOS DANONE Iogurte Líquido Magro de Kiwi E Morango 4x155 g,CORPOS DANONE,,"1,69 €","2,73 €/Kg",,,
ACTIVIA Iogurte Líquido Cereais 4x155 g,ACTIVIA,,"3,39 €","5,47 €/Kg",,,
DIA VITAL Bebida de Soja de Chocolate 3x200 ml,DIA VITAL,,"1,33 €","2,22 €/l",,,
ACTIVIA Iogurte Cremoso Coco 4x120 g,ACTIVIA,,"1,89 €","3,94 €/Kg",,,
TERRA NOSTRA Leite UHT Pastagem Magro 1 L,TERRA NOSTRA UHT,,"1,04 €","1,04 €/l",,,
TERRA NOSTRA Leite UHT Pastagem Meio Gordo 1 L,TERRA NOSTRA UHT,,"1,04 €","1,04 €/l",,,
SHOYCE Creme Culinário 200 ml,SHOYCE,,"1,39 €","6,95 €/l",,,
LAGOS Queijo Em Fatias de Cabra Curado 125 g,LAGOS,,"2,39 €","19,12 €/Kg",,,
PRIMOR Manteiga Sem Lactose Magra 125 g,PRIMOR,,"1,99 €","15,92 €/Kg",,,
UCAL Leite C/Chocolate Go! 3x250 ml,UCAL,,"2,94 €","3,92 €/l",,,
MATINAL Leite Magro Leve 1 L,MATINAL,,"1,05 €","1,05 €/l",,,
MIMOSA Iogurte Aroma de Multisabores Super Poupança 8x120 g,MIMOSA,,"1,89 €","1,97 €/Kg",,,
ACTIVIA Iogurte Líquido Magro Pêssego E Maracujá 4x155 g,ACTIVIA,,"3,39 €","5,47 €/Kg",,,
SHOYCE Bebida de Aveia 200 ml,SHOYCE,,"0,58 €","2,90 €/l","0,73 €","3,65 €/l",
DANET Sobremesa Chocolate 4x125 g,DANET,,"2,99 €","5,98 €/Kg",,,
SHOYCE Bebida de Amêndoa 1 L,SHOYCE,,"1,75 €","1,75 €/l","2,19 €","2,19 €/l",
PAIVA Queijo Amanteigado de Lamego 1 Un,PAIVA,,"7,55 €","7,55 €/ud",,,
PRIMOR Manteiga Com Sal 250 g,PRIMOR,,"2,34 €","9,36 €/Kg",,,
MIMOSA Iogurte Magro Sólido Morango Coco Super Poupança 6x120 g,MIMOSA,,"1,99 €","2,76 €/Kg",,,
MIMOSA Manteiga Com Sal Magra 250 g,MIMOSA,,"2,39 €","9,56 €/Kg",,,
DIA VITAL Bebida de Amêndoa 1 L,DIA VITAL,,"1,64 €","1,64 €/l",,,
REINA Leite Creme Com Bolacha 4x125 g,REINA,,"2,30 €","4,60 €/Kg",,,
DIA VITAL Bebida de Aveia 1 L,DIA VITAL,,"1,53 €","1,53 €/l",,,
DIA LÁCTEA Leite Magro Sem Lactose 1 L,DIA CTEA,,"1,07 €","1,07 €/l",,,
PARMAREGGIO Queijo Parmigiano Reggiano 150 g,PARMAREGGIO,,"3,99 €","26,60 €/Kg",,,
ACTIMEL Natural O% Actimel 6x100 g,ACTIMEL,,"3,29 €","5,48 €/Kg",,,
SANTIAGO Requeijão de Cabra 170 g,SANTIAGO,,"2,39 €","14,06 €/Kg",,,
MILHAFRE Queijo em Fatias 200 g,MILHAFRE,,"2,09 €","10,45 €/Kg",,,
VIGOR Kefir Maracujá 200 ml,VIGOR,,"0,62 €","3,10 €/l",,,
DANACOL Iogurte Redutor Aveia 6x100 g,DANACOL,,"3,99 €","6,65 €/Kg",,,
YOPRO Iogurte Líquido Baunilha Cookies 300 g,YOPRO,,"1,79 €","5,97 €/Kg",,,
LINDAHLS Iogurte Sólido Proteico Framboesa 150 g,LINDAHLS,,"1,49 €","9,93 €/Kg",,,
LINDAHLS Iogurte Sólido Proteico Straciatella 150 g,LINDAHLS,,"1,49 €","9,93 €/Kg",,,
DIA LÁCTEA Iogurte Líquido Morango 1 kg,DIA CTEA,,"1,65 €","1,65 €/Kg",,,
DANET Sobremesa Baunilha Chocolate 4x115 g,DANET,,"2,99 €","6,50 €/Kg",,,
YOCO Iogurte Suissinho Morango Maçã Pera Alperce 6x42 g,YOCO,,"2,35 €","9,33 €/Kg",,,
MIMOSA Iogurte Grego Cheesecake Limão 4x110 g,MIMOSA,,"2,19 €","4,98 €/Kg",,,
MIMOSA Leite Chocolate Meio Gordo Sem Lactose 200 ml,MIMOSA,,"0,59 €","2,95 €/l",,,
MIMOSA Leite Meio Gordo Sem Lactose UHT 200 ml,MIMOSA UHT,,"0,52 €","2,60 €/l",,,
MIMOSA Leite Magro UHT 200 ml,MIMOSA UHT,,"0,40 €","2,00 €/l",,,
CAMPAINHA Queijo Fatias Flamengo 2x400 g,CAMPAINHA,,"8,59 €","10,74 €/Kg",,,
YAOS Iogurte Natural Creations 1 kg,YAOS,,"5,57 €","5,57 €/Kg",,,
YOCO Iogurte Suissinho Morango 6x42 g,YOCO,,"2,35 €","9,33 €/Kg",,,
YOPRO Iogurte Sólido Mirtilo 160 g,YOPRO,,"1,04 €","6,50 €/Kg",,,
YOPRO Iogurte Sólido Manteiga De Amendoim e Banana 160 g,YOPRO,,"1,04 €","6,50 €/Kg",,,
A VACA QUE RI Queijo Fundido Palitos 4x35 g,VACA QUE RI,,"2,29 €","16,36 €/Kg",,,
MIMOSA Iogurte Líquido Aroma Frutos Tropicais Super Poupança 6x156 g,MIMOSA,,"2,09 €","2,31 €/l",,,
DIA Iogurte Líquido Polpa Coco e Ananás 4x160 g,DIA,,"1,55 €","2,42 €/Kg",,,
MIMOSA Iogurte Sólido 0% Lactose Magro 4x120 g,MIMOSA,,"2,09 €","4,35 €/Kg",,,
MIMOSA Iogurte Líquido Bem Especial sem Lactose Sabor Morango 4x156 g,MIMOSA,,"2,09 €","3,46 €/l",,,
PARMALAT Nata Culinária Sem Lactose 200 ml,PARMALAT,,"1,32 €","6,60 €/l",,,
SHOYCE Bebida de Amêndoa 0% Açúcar 1 L,SHOYCE,,"1,75 €","1,75 €/l","2,19 €","2,19 €/l",
MIMOSA Leite Equílibrio Aveia 1 L,MIMOSA,,"1,49 €","1,49 €/l",,,
MIMOSA Leite Equílibrio Amêndoa 1 L,MIMOSA,,"1,49 €","1,49 €/l",,,
VIGOR Leite Gordo Pasteurizado 1 L,VIGOR,,"1,07 €","1,07 €/l",,,
PARMALAT Natas Carbonara 200 ml,PARMALAT,,"1,27 €","6,35 €/l",,,
UCAL Leite com Chocolate 1 L,UCAL,,"2,85 €","2,85 €/l",,,
YOPRO Iogurte Líquido Caramelo 300 g,YOPRO,,"1,79 €","5,97 €/Kg",,,
LIMIANO Queijo Flamengo Fatias Light 200 g,LIMIANO,,"2,79 €","13,95 €/Kg",,,
CAMPAINHA Queijo Fatiado Edam 150 g,CAMPAINHA,,"1,99 €","13,27 €/Kg",,,
DIA O CHOCALHO Queijo Ralado 150 g,DIA CHOCALHO,,"1,19 €","7,93 €/Kg",,,
DIA LÁCTEA Queijo Ralado 4 Queijos 200 g,DIA CTEA,,"2,39 €","11,95 €/Kg",,,
CAMPAINHA Queijo Fatiado Gouda 150 g,CAMPAINHA,,"1,99 €","13,27 €/Kg",,,
SANTIAGO Queijo Atabafado Quinta do Olival Alho & Ervas 2x90 g,SANTIAGO,,"3,99 €","22,17 €/Kg",,,
SHOYCE Bebida Aveia e Amêndoa 0% 1 L,SHOYCE,,"1,75 €","1,75 €/l","2,19 €","2,19 €/l",
SHOYCE Bebida Aveia Choco 0% 1 L,SHOYCE,,"1,75 €","1,75 €/l","2,19 €","2,19 €/l",
SHOYCE Bebida Leve 0% 1 L,SHOYCE,,"0,99 €","0,99 €/l","1,49 €","1,49 €/l",
DANONE Iogurte Bicompartimentado M&M's 120 g,DANONE,,"1,34 €","11,17 €/Kg",,,
YOGGI Iogurte Líquido Chocolate 250 ml,YOGGI,,"1,67 €","6,68 €/l",,,
PARMALAT Nata com Café 200 ml,PARMALAT,,"1,27 €","6,35 €/l",,,
BECEL Creme Vegetal Sabor a Manteiga 225 g,BECEL,,"2,99 €","13,29 €/Kg",,,
